### ISSUE TITLE
alpine container DNS does not work

### ISSUE THREAD

**Issue by abacef** [k3s-io/k3s#13472]
**Environmental Info:**
K3s Version: 1.34.3+k3s1

Node(s) CPU architecture, OS, and Version: 
Debian 13, x86_64

Cluster Configuration:
single node installed with
```
curl -sfL https://get.k3s.io | sh - 
```

**Describe the bug:**
DNS in an alpine container does not resolve anything

**Steps To Reproduce:**
```
curl -sfL https://get.k3s.io | sh - 
```
Just run `apk update` inside a new alpine container
```bash
$ kubectl run alp --image=alpine -- sh -c "while true; do sleep 3600; done"
$ kubectl exec alp -- apk update
```
gives error when getting packages:
`DNS: no address for host`

**Expected behavior:**
DNS should work like usual. A DNS works fine in a debian container on the same cluster

**Comment by tedm** [comment]
<img width="798" height="1550" alt="Image" src="https://github.com/user-attachments/assets/5aa1720e-ca42-4f74-ac8c-92d3ed10950b" />

**Comment by tedm** [comment]
take a look at this: https://edu.chainguard.dev/open-source/wolfi/overview/ if debian slim or ubuntu are too large

**Comment by brandond** [comment]
An alpine pod cannot resolve *anything*? Please demonstrate - what errors do you get?

It works fine for me, and for alpine based pods in our CI environment, so I suspect something is misconfigured in your environment.

**Comment by abacef** [comment]
An alpine container does not resolve but a debian container does:

```bash
$ kubectl run alp --image=alpine -- sh -c "while true; do sleep 3600; done"
pod/alp created
$ kubectl exec alp -- apk update
WARNING: updating and opening https://dl-cdn.alpinelinux.org/alpine/v3.23/main/x86_64/APKINDEX.tar.gz: DNS: no address for host
2 unavailable, 0 stale; 16 distinct packages available
WARNING: updating and opening https://dl-cdn.alpinelinux.org/alpine/v3.23/community/x86_64/APKINDEX.tar.gz: DNS: no address for host
command terminated with exit code 2
$ kubectl run deb --image=debian -- sh -c "while true; do sleep 3600; done"
pod/deb created
bacef@penguin:~$ k exec deb -- apt update

WARNING: apt does not have a stable CLI interface. Use with caution in scripts.

Get:1 http://deb.debian.org/debian trixie InRelease [140 kB]
Get:2 http://deb.debian.org/debian trixie-updates InRelease [47.3 kB]
Get:3 http://deb.debian.org/debian-security trixie-security InRelease [43.4 kB]
Get:4 http://deb.debian.org/debian trixie/main amd64 Packages [9670 kB]
Get:5 http://deb.debian.org/debian trixie-updates/main amd64 Packages [5412 B]
Get:6 http://deb.debian.org/debian-security trixie-security/main amd64 Packages [96.1 kB]
Fetched 10.0 MB in 1s (7012 kB/s)
Reading package lists...
Building dependency tree...
Reading state information...
All packages are up to date.
$
```

DNS is working on the host:
```
root@k3s-server-2:~# wget https://dl-cdn.alpinelinux.org/alpine/v3.23/main/x86_64/APKINDEX.tar.gz
--2026-01-17 10:11:12--  https://dl-cdn.alpinelinux.org/alpine/v3.23/main/x86_64/APKINDEX.tar.gz
Resolving dl-cdn.alpinelinux.org (dl-cdn.alpinelinux.org)... 151.101.22.132, 2a04:4e42:5::644
Connecting to dl-cdn.alpinelinux.org (dl-cdn.alpinelinux.org)|151.101.22.132|:443... connected.
```

os-release host:
```
root@k3s-server-2:~# cat /etc/os-release 
PRETTY_NAME="Debian GNU/Linux 13 (trixie)"
NAME="Debian GNU/Linux"
VERSION_ID="13"
VERSION="13 (trixie)"
VERSION_CODENAME=trixie
DEBIAN_VERSION_FULL=13.2
ID=debian
HOME_URL="https://www.debian.org/"
SUPPORT_URL="https://www.debian.org/support"
BUG_REPORT_URL="https://bugs.debian.org/"
```

lscpu host:
```
root@k3s-server-2:~# lscpu
Architecture:                x86_64
  CPU op-mode(s):            32-bit, 64-bit
  Address sizes:             40 bits physical, 48 bits virtual
  Byte Order:                Little Endian
CPU(s):                      4
  On-line CPU(s) list:       0-3
Vendor ID:                   GenuineIntel
  Model name:                QEMU Virtual CPU version 2.5+
    CPU family:              15
    Model:                   107
    Thread(s) per core:      1
    Core(s) per socket:      4
    Socket(s):               1
    Stepping:                1
    BogoMIPS:                4589.16
    Flags:                   fpu de pse tsc msr pae mce cx8 apic sep mtrr pge mca cmov pat pse36 clflush mmx fxsr sse sse2 ht syscall nx lm constant_tsc nopl xtopology cpuid tsc_known_freq pni ssse3 cx16 sse4_1 
                             sse4_2 x2apic popcnt aes hypervisor lahf_lm cpuid_fault pti
Virtualization features:     
  Hypervisor vendor:         KVM
  Virtualization type:       full
```

system containers:
```
$ k get pod -n kube-system
NAME                                      READY   STATUS      RESTARTS       AGE
coredns-6d668d687-p6rml                   1/1     Running     0              30d
helm-install-traefik-crd-f65ll            0/1     Completed   0              30d
helm-install-traefik-lgmdn                0/1     Completed   0              30d
local-path-provisioner-869c44bfbd-hwvnc   1/1     Running     0              30d
metrics-server-7bfffcd44-zltjx            1/1     Running     3 (30d ago)    112d
svclb-traefik-1f18df7c-88c2p              2/2     Running     12 (30d ago)   112d
svclb-traefik-1f18df7c-c5dvl              2/2     Running     6 (30d ago)    112d
svclb-traefik-1f18df7c-d4f57              2/2     Running     8 (30d ago)    112d
traefik-865bd56545-t2bwr                  1/1     Running     0              30d
```

coredns logs:
```
$ k logs -n kube-system coredns-6d668d687-p6rml
[WARNING] No files matching import glob pattern: /etc/coredns/custom/*.override
[WARNING] No files matching import glob pattern: /etc/coredns/custom/*.server
[WARNING] No files matching import glob pattern: /etc/coredns/custom/*.override
[WARNING] No files matching import glob pattern: /etc/coredns/custom/*.server
[WARNING] No files matching import glob pattern: /etc/coredns/custom/*.override
[WARNING] No files matching import glob pattern: /etc/coredns/custom/*.server
```

**Comment by abacef** [comment]
Hmm: on an alpine container with dig installed
```
/ # dig dl-cdn.alpinelinux.org

; <<>> DiG 9.20.17 <<>> dl-cdn.alpinelinux.org
;; global options: +cmd
;; Got answer:
;; ->>HEADER<<- opcode: QUERY, status: NOERROR, id: 12029
;; flags: qr aa rd ra; QUERY: 1, ANSWER: 5, AUTHORITY: 0, ADDITIONAL: 1

;; OPT PSEUDOSECTION:
; EDNS: version: 0, flags:; udp: 1232
; COOKIE: 0f5868efba8ee226 (echoed)
;; QUESTION SECTION:
;dl-cdn.alpinelinux.org.                IN      A

;; ANSWER SECTION:
dl-cdn.alpinelinux.org. 23      IN      CNAME   dualstack.j.sni.global.fastly.net.
dualstack.j.sni.global.fastly.net. 23 IN A      151.101.66.132
dualstack.j.sni.global.fastly.net. 23 IN A      151.101.2.132
dualstack.j.sni.global.fastly.net. 23 IN A      151.101.130.132
dualstack.j.sni.global.fastly.net. 23 IN A      151.101.194.132

;; Query time: 0 msec
;; SERVER: 10.43.0.10#53(10.43.0.10) (UDP)
;; WHEN: Sun Jan 18 02:52:18 UTC 2026
;; MSG SIZE  rcvd: 328

/ # ping dl-cdn.alpinelinux.org
ping: bad address 'dl-cdn.alpinelinux.org'
```

**Comment by muicoder** [comment]
This issue is not a bug in Alpine or Kubernetes, but a mismatch between musl’s strict DNS behavior and Kubernetes’ default DNS policy (optimized for glibc).
```yaml
dnsConfig:
  searches: []
  options:
  - name: ndots
    value: "1"
```

**Comment by abacef** [comment]
@brandond is ndots set to 1 for you when you try to reproduce this?

**Comment by tedm** [comment]
potential duplicate of this issue? https://github.com/k3s-io/k3s/issues/6561

**Comment by JoeNyland** [comment]
I'm seeing this issue, too. I believe that https://github.com/k3s-io/k3s/issues/6561 is reporting the same issue, but I feel that issue was incorrectly lumped in with a `search .` issue (https://github.com/k3s-io/k3s/issues/6132) and was incorrectly closed as an issue with Alpine. I get why the finger is being pointed at Alpine, but even with Debian, DNS resolution is kind of clunky under K3s.

**TL;DR**: With `options ndots:5`, a DNS query to resolve `google.co.uk` first submit a query for `google.co.uk.domain.` Some resolvers are ok with this and retry with the original requested hostname, but some fail fast when the initial query fails (which I personally think is a defensible approach).

@abacef I can confirm that setting `options ndots:1` does seem to help, but this is only needed for images that use musl, like Alpine; having `options ndots:5` on pod using a Debian image results in a weird initial query too, but it eventually resolves the address.

In both cases, resolving google.co.uk results in a query for `google.co.uk.home.domain.net.` (where `home.domain.net.` is anyone's home - or enterprise - domain suffix) which obviously fails. This query is attempted because of `options ndots:5` and because `google.co.uk(.)` has 3 dots and 3<5, it smashes the domain on the end. However, when this fails to resolve, Alpine seems to give up. Whereas Debian re-tries, but with no search domain. This can be seen in the `tcpdump`s below.

I guess the question I have is: Why do pods on K3s have `options ndots:5`? It seems that without it, DNS resolution would be more sane on all images and it would alleviate the issue with Alpine ones. Yes, Debian 'handles' this, but it is still sending a nonsense DNS query initially that has to fail before the actual intended query is sent and this is all because of the `ndots` being >1.

I'm guessing the intention was to support resolving other pods and services with short names, but I feel like that convenience at the cost of essentially breaking DNS for pods that use an image that uses musl libraries isn't really a fair balance.

For context, this is the DNS config I have on K3s nodes:

```
root@k3s-node-1:~# cat /etc/resolv.conf 
nameserver 2001:db8:0010::1
nameserver 10.10.0.1
search home.domain.net
```

Just to prove DNS is working ok on the node:

```
root@k3s-node-1:~# ping -6 -c 1 google.co.uk
PING google.co.uk (2a00:1450:4009:c17::5e) 56 data bytes
64 bytes from sv-in-f94.1e100.net (2a00:1450:4009:c17::5e): icmp_seq=1 ttl=113 time=8.70 ms

--- google.co.uk ping statistics ---
1 packets transmitted, 1 received, 0% packet loss, time 0ms
rtt min/avg/max/mdev = 8.701/8.701/8.701/0.000 ms
root@k3s-node-1:~# ping -4 -c 1 google.co.uk
PING google.co.uk (142.250.117.94) 56(84) bytes of data.
64 bytes from um-in-f94.1e100.net (142.250.117.94): icmp_seq=1 ttl=113 time=8.01 ms

--- google.co.uk ping statistics ---
1 packets transmitted, 1 received, 0% packet loss, time 0ms
rtt min/avg/max/mdev = 8.014/8.014/8.014/0.000 ms
```

## Alpine

```
$ kubectl run alpine --image=alpine -- sh -c "while true; do sleep 3600; done"
pod/alpine created
$ kubectl exec -it pods/alpine -- /bin/sh
/ # cat /etc/resolv.conf 
search default.svc.cluster.local svc.cluster.local cluster.local home.domain.net
nameserver 2001:db8:0050::a
nameserver 10.43.0.10
options ndots:5
/ # ping -4 google.co.uk
ping: bad address 'google.co.uk'
/ # ping -6 google.co.uk
ping: bad address 'google.co.uk'
/ # echo "options ndots:1" >> /etc/resolv.conf 
/ # ping -6 -c 3 google.co.uk
PING google.co.uk (2a00:1450:4009:c0f::5e): 56 data bytes
64 bytes from 2a00:1450:4009:c0f::5e: seq=0 ttl=107 time=7.952 ms
64 bytes from 2a00:1450:4009:c0f::5e: seq=1 ttl=107 time=8.167 ms
64 bytes from 2a00:1450:4009:c0f::5e: seq=2 ttl=107 time=8.076 ms

--- google.co.uk ping statistics ---
3 packets transmitted, 3 packets received, 0% packet loss
round-trip min/avg/max = 7.952/8.065/8.167 ms
/ # ping -4 -c 3 google.co.uk
PING google.co.uk (142.250.140.94): 56 data bytes
64 bytes from 142.250.140.94: seq=0 ttl=112 time=7.640 ms
64 bytes from 142.250.140.94: seq=1 ttl=112 time=8.047 ms
64 bytes from 142.250.140.94: seq=2 ttl=112 time=7.971 ms

--- google.co.uk ping statistics ---
3 packets transmitted, 3 packets received, 0% packet loss
round-trip min/avg/max = 7.640/7.886/8.047 ms
```

## Debian

```
$ kubectl run debian --image=debian -- sh -c "while true; do sleep 3600; done"
pod/debian created
$ kubectl exec -it pods/debian -- /bin/sh
# cat /etc/resolv.conf
search default.svc.cluster.local svc.cluster.local cluster.local home.domain.net
nameserver 2001:db8:0050::a
nameserver 10.43.0.10
options ndots:5
# apt update && apt install iputils-ping -y
# ping -6 -c google.co.uk
ping: invalid argument: 'google.co.uk'
# ping -6 -c 3 google.co.uk     
PING google.co.uk (2a00:1450:4009:c0f::5e) 56 data bytes
64 bytes from yulhrs-in-f94.1e100.net (2a00:1450:4009:c0f::5e): icmp_seq=1 ttl=106 time=8.62 ms
64 bytes from yulhrs-in-f94.1e100.net (2a00:1450:4009:c0f::5e): icmp_seq=2 ttl=106 time=8.80 ms
64 bytes from yulhrs-in-f94.1e100.net (2a00:1450:4009:c0f::5e): icmp_seq=3 ttl=106 time=8.63 ms

--- google.co.uk ping statistics ---
3 packets transmitted, 3 received, 0% packet loss, time 2001ms
rtt min/avg/max/mdev = 8.617/8.683/8.802/0.084 ms
# ping -4 -c 3 google.co.uk
PING google.co.uk (142.250.117.94) 56(84) bytes of data.
64 bytes from um-in-f94.1e100.net (142.250.117.94): icmp_seq=1 ttl=112 time=7.91 ms
64 bytes from um-in-f94.1e100.net (142.250.117.94): icmp_seq=2 ttl=112 time=7.95 ms
64 bytes from um-in-f94.1e100.net (142.250.117.94): icmp_seq=3 ttl=112 time=7.91 ms

--- google.co.uk ping statistics ---
3 packets transmitted, 3 received, 0% packet loss, time 2003ms
rtt min/avg/max/mdev = 7.905/7.922/7.950/0.019 ms
```

## Normal (Docker Desktop on Mac) Alpine (no IPv6, because Docker...)

This sort of shows that it's not just a case of "Alpine doesn't like my DNS server or network".

```
$ docker run -it --rm alpine /bin/sh
/ # cat /etc/resolv.conf 
# DNS requests are forwarded to the host. DHCP DNS options are ignored.
nameserver 192.168.65.7
 / # ping -4 -c 3 google.co.uk
PING google.co.uk (142.250.140.94): 56 data bytes
64 bytes from 142.250.140.94: seq=0 ttl=63 time=8.489 ms
64 bytes from 142.250.140.94: seq=1 ttl=63 time=9.023 ms
64 bytes from 142.250.140.94: seq=2 ttl=63 time=9.095 ms

--- google.co.uk ping statistics ---
3 packets transmitted, 3 packets received, 0% packet loss
round-trip min/avg/max = 8.489/8.869/9.095 ms
```

## `tcpdump` whilst an Alpine pod tries to resolve google.co.uk using the default `options ndots:5`

```
root@k3s-node-1:~# tcpdump -i eth0 port 53 -n
tcpdump: verbose output suppressed, use -v[v]... for full protocol decode
listening on eth0, link-type EN10MB (Ethernet), snapshot length 262144 bytes
12:57:53.006173 IP6 2001:db8:00c0::61.33298 > 2001:db8:0010::1.53: 11359+ AAAA? google.co.uk.home.domain.net. (49)
12:57:53.006534 IP6 2001:db8:00c0::61.49273 > 2001:db8:0010::1.53: 55940+ AAAA? google.co.uk.home.domain.net. (49)
12:57:53.023241 IP6 2001:db8:0010::1.53 > 2001:db8:00c0::61.49273: 55940 0/1/0 (114)
12:57:53.051140 IP6 2001:db8:0010::1.53 > 2001:db8:00c0::61.33298: 11359 0/1/0 (114)
```

## `tcpdump` whilst an Alpine pod tries to resolve google.co.uk using the default `options ndots:5`

```
root@k3s-node-1:~# tcpdump -i eth0 port 53 -n
tcpdump: verbose output suppressed, use -v[v]... for full protocol decode
listening on eth0, link-type EN10MB (Ethernet), snapshot length 262144 bytes
12:59:02.999109 IP6 2001:db8:00c0::61.33471 > 2001:db8:0010::1.53: 27706+ A? google.co.uk.home.domain.net. (49)
12:59:02.999540 IP 10.10.1.254.20527 > 10.10.0.1.53: 15520+ AAAA? google.co.uk.home.domain.net. (49)
12:59:03.000286 IP 10.10.0.1.53 > 10.10.1.254.20527: 15520 0/1/0 (114)
12:59:03.053259 IP6 2001:db8:0010::1.53 > 2001:db8:00c0::61.33471: 27706 0/1/0 (114)
12:59:03.054215 IP 10.10.1.254.20527 > 10.10.0.1.53: 13868+ AAAA? google.co.uk. (30)
12:59:03.054452 IP 10.10.1.254.27970 > 10.10.0.1.53: 27030+ A? google.co.uk. (30)
12:59:03.066461 IP 10.10.0.1.53 > 10.10.1.254.27970: 27030 1/0/0 A 142.251.30.94 (46)
12:59:03.095465 IP 10.10.0.1.53 > 10.10.1.254.20527: 13868 1/0/0 AAAA 2a00:1450:4009:c04::5e (58)
[snip]
```

**Comment by JoeNyland** [comment]
This is the workaround that I'm using for any deployment that uses an Alpine-based image, which essentially overrides the `ndots` option so that the search domains aren't appended to any DNS queries if they have 1 or more dots.

```yaml
---
apiVersion: apps/v1
kind: Deployment
spec:
  template:
    spec:
      dnsConfig:
        options:
          - name: ndots
            value: "1"
      containers:
        - image: alpine
        - ...
```

**Comment by brandond** [comment]
There is absolutely nothing unique that k3s does with regards to ndots or resolvers or anything else. We do not modify any defaults or configure anything different than any other distro. This is just how Kubernetes works.
