### ISSUE TITLE
k3s server started but pods are not running

### ISSUE THREAD

**Issue by odorT** [k3s-io/k3s#4858]
**Environmental Info:**
K3s Version: 

k3s version v1.22.5+k3s1 (405bf79d)
go version go1.16.10

Node(s) CPU architecture, OS, and Version: 

Linux rancher 5.4.0-91-generic #102-Ubuntu SMP Fri Nov 5 16:31:28 UTC 2021 x86_64 x86_64 x86_64 GNU/Linux

Cluster Configuration:

1-server cluster

**Describe the bug:**

After k3s server starts successfully, pods in kube-system namespace are stuck at ContainerCreating state.

**Steps To Reproduce:**

- Installed K3s: 
- Followed steps in rancher k3s installation guide: https://rancher.com/docs/rancher/v2.6/en/installation/resources/k8s-tutorials/ha-with-external-db/

**Expected behavior:**

pods should be running

**Actual behavior:**

pods are stuck at ContainerCreating state

**Additional context / logs:**

Everything works okay if I add '--docker' parameter. So I guess this problem is related with containerd.
Logs:
1. Logs from stdout
`E1231 15:31:42.644385   18756 kuberuntime_manager.go:818] "CreatePodSandbox for pod failed" err="rpc error: code = Unknown desc = failed to get sandbox image \"rancher/mirrored-pause:3.1\": failed to pull image \"rancher/mirrored-pause:3.1\": failed to pull and unpack image \"docker.io/rancher/mirrored-pause:3.1\": failed to resolve reference \"docker.io/rancher/mirrored-pause:3.1\": failed to do request: Head \"https://registry-1.docker.io/v2/rancher/mirrored-pause/manifests/3.1\": dial tcp: lookup registry-1.docker.io: no such host" pod="kube-system/local-path-provisioner-64ffb68fd-5p9hf"`

2. kubectl get pods -n kube-system
```
coredns-85cb69466-j75wt                  0/1     ContainerCreating   1          19m
traefik-786ff64748-r28g7                 0/1     ContainerCreating   1          17m
svclb-traefik-5mc72                      0/2     ContainerCreating   2          17m
metrics-server-9cf544f65-grqnq           0/1     ContainerCreating   1          19m
local-path-provisioner-64ffb68fd-5p9hf   0/1     ContainerCreating   1          19m
```

3. kubectl describe pod/coredns-85cb69466-j75wt -n kube-system
```
Name:                 coredns-85cb69466-j75wt
Namespace:            kube-system
Priority:             2000000000
Priority Class Name:  system-cluster-critical
Node:                 rancher/10.0.2.15
Start Time:           Fri, 31 Dec 2021 15:13:23 +0000
Labels:               k8s-app=kube-dns
                      pod-template-hash=85cb69466
Annotations:          <none>
Status:               Running
IP:                   
IPs:                  <none>
Controlled By:        ReplicaSet/coredns-85cb69466
Containers:
  coredns:
    Container ID:  
    Image:         rancher/mirrored-coredns-coredns:1.8.4
    Image ID:      
    Ports:         53/UDP, 53/TCP, 9153/TCP
    Host Ports:    0/UDP, 0/TCP, 0/TCP
    Args:
      -conf
      /etc/coredns/Corefile
    State:          Waiting
      Reason:       ContainerCreating
    Last State:     Terminated
      Reason:       ContainerStatusUnknown
      Message:      The container could not be located when the pod was deleted.  The container used to be Running
      Exit Code:    137
      Started:      Mon, 01 Jan 0001 00:00:00 +0000
      Finished:     Mon, 01 Jan 0001 00:00:00 +0000
    Ready:          False
    Restart Count:  1
    Limits:
      memory:  170Mi
    Requests:
      cpu:        100m
      memory:     70Mi
    Liveness:     http-get http://:8080/health delay=60s timeout=1s period=10s #success=1 #failure=3
    Readiness:    http-get http://:8181/ready delay=0s timeout=1s period=2s #success=1 #failure=3
    Environment:  <none>
    Mounts:
      /etc/coredns from config-volume (ro)
      /var/run/secrets/kubernetes.io/serviceaccount from kube-api-access-hgpds (ro)
Conditions:
  Type              Status
  Initialized       True 
  Ready             False 
  ContainersReady   False 
  PodScheduled      True 
Volumes:
  config-volume:
    Type:      ConfigMap (a volume populated by a ConfigMap)
    Name:      coredns
    Optional:  false
  kube-api-access-hgpds:
    Type:                    Projected (a volume that contains injected data from multiple sources)
    TokenExpirationSeconds:  3607
    ConfigMapName:           kube-root-ca.crt
    ConfigMapOptional:       <nil>
    DownwardAPI:             true
QoS Class:                   Burstable
Node-Selectors:              beta.kubernetes.io/os=linux
Tolerations:                 CriticalAddonsOnly op=Exists
                             node-role.kubernetes.io/control-plane:NoSchedule op=Exists
                             node-role.kubernetes.io/master:NoSchedule op=Exists
                             node.kubernetes.io/not-ready:NoExecute op=Exists for 300s
                             node.kubernetes.io/unreachable:NoExecute op=Exists for 300s
Events:
  Type     Reason                  Age                  From               Message
  ----     ------                  ----                 ----               -------
  Normal   Scheduled               20m                  default-scheduler  Successfully assigned kube-system/coredns-85cb69466-j75wt to rancher
  Warning  FailedCreatePodSandBox  20m (x2 over 20m)    kubelet            Failed to create pod sandbox: rpc error: code = Unknown desc = failed to get sandbox image "rancher/mirrored-pause:3.1": failed to pull image "rancher/mirrored-pause:3.1": failed to pull and unpack image "docker.io/rancher/mirrored-pause:3.1": failed to resolve reference "docker.io/rancher/mirrored-pause:3.1": failed to do request: Head "https://registry-1.docker.io/v2/rancher/mirrored-pause/manifests/3.1": dial tcp: lookup registry-1.docker.io: no such host
  Normal   Pulling                 19m                  kubelet            Pulling image "rancher/mirrored-coredns-coredns:1.8.4"
  Normal   Pulled                  18m                  kubelet            Successfully pulled image "rancher/mirrored-coredns-coredns:1.8.4" in 44.483720004s
  Normal   Created                 18m                  kubelet            Created container coredns
  Normal   Started                 18m                  kubelet            Started container coredns
  Warning  FailedCreatePodSandBox  9s (x17 over 3m41s)  kubelet            Failed to create pod sandbox: rpc error: code = Unknown desc = failed to get sandbox image "rancher/mirrored-pause:3.1": failed to pull image "rancher/mirrored-pause:3.1": failed to pull and unpack image "docker.io/rancher/mirrored-pause:3.1": failed to resolve reference "docker.io/rancher/mirrored-pause:3.1": failed to do request: Head "https://registry-1.docker.io/v2/rancher/mirrored-pause/manifests/3.1": dial tcp: lookup registry-1.docker.io: no such host
```

**Backporting**

- [ ] Needs backporting to older releases

**Comment by brandond** [comment]
`Head \"https://registry-1.docker.io/v2/rancher/mirrored-pause/manifests/3.1\": dial tcp: lookup registry-1.docker.io: no such host`

Your DNS server is claiming that registry-1.docker.io doesn't exist.

**Comment by odorT** [comment]
> `Head \"https://registry-1.docker.io/v2/rancher/mirrored-pause/manifests/3.1\": dial tcp: lookup registry-1.docker.io: no such host`
> 
> Your DNS server is claiming that registry-1.docker.io doesn't exist.

When using --docker parameter in k3s server command, everything works fine

**Comment by ChristianCiach** [comment]
Does the system access the internet using an https proxy?

**Comment by odorT** [comment]
Host is vagrant virtual machine, I don't think that uses proxy

**Comment by brandond** [comment]
I would take a look at the network setting in your VM - in particular the DNS config. If containerd is getting a nxdomain response from DNS, there's not much to do about it but fix your network config.

**Comment by tomhobson** [comment]
It seems like I am seeing a similar issue to this, setup k3s on 2 nodes already, finally setting it up on my final node.

Can apt install and curl and everything else on this node, until I install k3s.
K3s daemon starts, pods get assigned to it, then they all get ImagePullBackOff because they can't resolve any container registry.

Resolvectl is using the correct dns server (that is working because the other nodes have the same networking config)
Curl no longer is successful and apt upgrading wont work either.

This is running baremetal (so I'm not in a vm) but I'm definitely seeing this issue too. If you can point me in the place to look into this further / need any command output, let me know.

I'm wondering if k3s is trying to use a different (virtual) network interface due to some form of ordering issue, although I have never worked with baremetal internals of k8s, so I'm likely wrong.

**Comment by brandond** [comment]
> containerd cannot resolve image registries under k3s

Dockershim is going away as of 1.24, so I would probably continue to figure out what's going on with your environment instead of giving up on figuring out what the issue is with your DNS server giving nxdomain responses.

**Comment by dgaffuri** [comment]
I have exactly the same problem, but DNS server seem to respond correctly:
```$ sudo tcpdump -n -v -i enp0s3 udp port 53
tcpdump: listening on enp0s3, link-type EN10MB (Ethernet), capture size 262144 bytes
18:14:23.785363 IP (tos 0x0, ttl 64, id 9897, offset 0, flags [DF], proto UDP (17), length 66)
    10.0.2.15.44205 > 10.0.2.3.domain: 50032+ A? registry-1.docker.io. (38)
18:14:23.785406 IP (tos 0x0, ttl 64, id 9898, offset 0, flags [DF], proto UDP (17), length 66)
    10.0.2.15.44205 > 10.0.2.3.domain: 50230+ AAAA? registry-1.docker.io. (38)
18:14:23.786291 IP (tos 0x10, ttl 64, id 38935, offset 0, flags [none], proto UDP (17), length 194)
    10.0.2.3.domain > 10.0.2.15.44205: 50032 8/0/0 registry-1.docker.io. A 54.197.112.205, registry-1.docker.io. A 52.200.78.26, registry-1.docker.io. A 52.72.252.48, registry-1.docker.io. A 54.198.211.201, registry-1.docker.io. A 52.200.37.142, registry-1.docker.io. A 54.210.12.153, registry-1.docker.io. A 174.129.147.229, registry-1.docker.io. A 52.72.186.182 (166)
18:14:23.786311 IP (tos 0x10, ttl 64, id 38936, offset 0, flags [none], proto UDP (17), length 66)
    10.0.2.3.domain > 10.0.2.15.44205: 50230 NXDomain 0/0/0 (38)```

**Comment by masakichi** [comment]
I also met this issue, it turns out `/etc/resolv.conf` on my host server(Arch Linux) is empty. I solved it by doing

```
# ln -rsf /run/systemd/resolve/stub-resolv.conf /etc/resolv.conf
```

Ref: https://wiki.archlinux.org/title/Systemd-resolved#DNS

**Comment by rjhenry** [comment]
> I have exactly the same problem, but DNS server seem to respond correctly:
> 
> ```
> tcpdump: listening on enp0s3, link-type EN10MB (Ethernet), capture size 262144 bytes
> 18:14:23.785363 IP (tos 0x0, ttl 64, id 9897, offset 0, flags [DF], proto UDP (17), length 66)
>     10.0.2.15.44205 > 10.0.2.3.domain: 50032+ A? registry-1.docker.io. (38)
> 18:14:23.785406 IP (tos 0x0, ttl 64, id 9898, offset 0, flags [DF], proto UDP (17), length 66)
>     10.0.2.15.44205 > 10.0.2.3.domain: 50230+ AAAA? registry-1.docker.io. (38)
> 18:14:23.786291 IP (tos 0x10, ttl 64, id 38935, offset 0, flags [none], proto UDP (17), length 194)
>     10.0.2.3.domain > 10.0.2.15.44205: 50032 8/0/0 registry-1.docker.io. A 54.197.112.205, registry-1.docker.io. A 52.200.78.26, registry-1.docker.io. A 52.72.252.48, registry-1.docker.io. A 54.198.211.201, registry-1.docker.io. A 52.200.37.142, registry-1.docker.io. A 54.210.12.153, registry-1.docker.io. A 174.129.147.229, registry-1.docker.io. A 52.72.186.182 (166)
> 18:14:23.786311 IP (tos 0x10, ttl 64, id 38936, offset 0, flags [none], proto UDP (17), length 66)
>     10.0.2.3.domain > 10.0.2.15.44205: 50230 NXDomain 0/0/0 (38)```
> ```

I'm getting the same. Some pods will pull their images after a couple of re-tries, but most won't. `tcpdump` shows successful resolution, and both the host in question and a `dnsutils` pod running in the cluster can resolve correctly too. My firewall doesn't show any packets being dropped for whatever reason, and this issue persists even when the firewall is instructed to allow any HTTP/S traffic from anywhere to anywhere, or even when (briefly) set to allow all traffic.
What's more, I can actually see HTTPS traffic leaving this host to the `registry-1.docker.io` hosts:
```console
# tcpdump -vvvnni any port 443 and host registry-1.docker.io
tcpdump: data link type LINUX_SLL2
tcpdump: listening on any, link-type LINUX_SLL2 (Linux cooked v2), snapshot length 262144 bytes
10:36:05.778335 enp34s0 Out IP (tos 0x0, ttl 64, id 30815, offset 0, flags [DF], proto TCP (6), length 60)
    95.217.202.189.39182 > 52.72.186.182.443: Flags [S], cksum 0x19c4 (incorrect -> 0x0cdf), seq 2288944647, win 64240, options [mss 1460,sackOK,TS val 1736709591 ecr 0,nop,wscale 7], length 0
10:36:05.882772 enp34s0 In  IP (tos 0x0, ttl 237, id 0, offset 0, flags [DF], proto TCP (6), length 60)
    52.72.186.182.443 > 95.217.202.189.39182: Flags [S.], cksum 0x87fc (correct), seq 1201177034, ack 2288944648, win 26847, options [mss 1460,sackOK,TS val 2123288304 ecr 1736709591,nop,wscale 8], length 0
10:36:05.882802 enp34s0 Out IP (tos 0x0, ttl 64, id 30816, offset 0, flags [DF], proto TCP (6), length 52)
    95.217.202.189.39182 > 52.72.186.182.443: Flags [.], cksum 0x19bc (incorrect -> 0x1d4b), seq 1, ack 1, win 502, options [nop,nop,TS val 1736709695 ecr 2123288304], length 0
10:36:05.882964 enp34s0 Out IP (tos 0x0, ttl 64, id 30817, offset 0, flags [DF], proto TCP (6), length 324)
    95.217.202.189.39182 > 52.72.186.182.443: Flags [P.], cksum 0x1acc (incorrect -> 0x8dce), seq 1:273, ack 1, win 502, options [nop,nop,TS val 1736709695 ecr 2123288304], length 272
10:36:05.987405 enp34s0 In  IP (tos 0x0, ttl 237, id 35567, offset 0, flags [DF], proto TCP (6), length 52)
    52.72.186.182.443 > 95.217.202.189.39182: Flags [.], cksum 0x1d12 (correct), seq 1, ack 273, win 119, options [nop,nop,TS val 2123288472 ecr 1736709695], length 0
<snipped for brevity>
```

Any ideas on what I can take to get images to pull successfully would be appreciated.

**Comment by toboRlivE** [comment]
Same issues

Vagrant deploying single master and 2 worker nodes. After cluster is created local-path-provisioner, metrics-server, coredns pods stuck in a constant ContainerCreating status.

After initial cluster creation apt updates with no issues, git pulls from github with no issues. The VMs don't seem to have any problems with dns other than this.

Found this issue and saw I had similar failures in pod describe:

```
$ kubectl describe pod coredns-96cc4f57d-zjm2s -n kube-system
...
Events:
 Type     Reason                  Age               From               Message
 ----     ------                  ----              ----               -------
  Normal   Scheduled               44s               default-scheduler  Successfully assigned kube-system/coredns-96cc4f57d-cbbqk to k3s-02
  Warning  FailedCreatePodSandBox  11s (x9 over 109s)  kubelet            Failed to create pod sandbox: rpc error: code = Unknown desc = failed to get sandbox image "rancher/mirrored-pause:3.6": failed to pull image "rancher/mirrored-pause:3.6": failed to pull and unpack image "docker.io/rancher/mirrored-pause:3.6": failed to resolve reference "docker.io/rancher/mirrored-pause:3.6": failed to do request: Head "https://registry-1.docker.io/v2/rancher/mirrored-pause/manifests/3.6": dial tcp: lookup registry-1.docker.io: no such host
```

First host erroring: registry-1.docker.io

Added host address manually to /etc/hosts on all nodes

Ran:
```
$ kubectl get pod <pod_name> -n <namespace> -o yaml | kubectl replace --force -f -
```

Next host erroring: auth.docker.io
Repeated kubectl replace and ended up having to manually add production.cloudflare.docker.com as well

After the final kubectl replace with host entries for registry-1.docker.io, auth.docker.io, and production.cloudflare.docker.com, all pods ran within seconds.

At a loss as to what k3s deployment steps I'm missing.

**Comment by brandond** [comment]
> lookup registry-1.docker.io: no such host

There is a DNS server in your environment that is sending out responses indicating that all these hosts don't exist. Do you have a pihole, guest wifi network, or something else configured that would be returning these inaccurate DNS responses?

**Comment by toboRlivE** [comment]
These VM are running within Virtualbox on my laptop. I used my laptop to get the addresses to manually enter into the node's hosts file.

**Comment by toboRlivE** [comment]
Looks like you're right. Laptop has Cisco Umbrella client installed. If I hard code dns server IPs it seems to work fine. Thanks for responding so quickly.

**Comment by dgaffuri** [comment]
> Looks like you're right. Laptop has Cisco Umbrella client installed. If I hard code dns server IPs it seems to work fine. Thanks for responding so quickly.

I was using `vb.customize ["modifyvm", :id, "--natdnshostresolver1", "on"]` for Vagrant virtual box boxes, setting explicitly external DNS in /etc/resolv.conf of the virtual machines solved the problem for me too.

**Comment by CormacLennon** [comment]
We're having the same issue. Our vpn restricts access to docker.io as we're being rate limited so we need to use an internal repository for all docker images, anyway around this?

**Comment by brandond** [comment]
@CormacLennon have you tried https://rancher.com/docs/k3s/latest/en/installation/private-registry/ ?

**Comment by js038706** [comment]
> I also met this issue, it turns out `/etc/resolv.conf` on my host server(Arch Linux) is empty. I solved it by doing
> 
> ```
> # ln -rsf /run/systemd/resolve/stub-resolv.conf /etc/resolv.conf
> ```
> 
> Ref: https://wiki.archlinux.org/title/Systemd-resolved#DNS

Same Issue, solved it as below:

echo "nameserver 8.8.8.8" > /etc/resolv.conf
echo "nameserver 8.8.8.8" | tee /etc/resolv.conf

**Comment by MonolithicMonk** [comment]
> > I also met this issue, it turns out `/etc/resolv.conf` on my host server(Arch Linux) is empty. I solved it by doing
> > ```
> > # ln -rsf /run/systemd/resolve/stub-resolv.conf /etc/resolv.conf
> > ```
> > 
> > 
> >     
> >       
> >     
> > 
> >       
> >     
> > 
> >     
> >   
> > Ref: https://wiki.archlinux.org/title/Systemd-resolved#DNS
> 
> Same Issue, solved it as below:
> 
> echo "nameserver 8.8.8.8" > /etc/resolv.conf echo "nameserver 8.8.8.8" | tee /etc/resolv.conf

I can confirm this fixed two issues for me.  One was with my host environment and issues with sysbox, crio, and k3s producing nameserver limit error.  

The second issue that this solution resolved was with the deployed DinD.  I installed a k3d in the DinD and it looked like it worked until I checked kubectl get all -A and saw that several kube-system namespaced containers failed to pull images.
