### ISSUE TITLE
NodePort Service: 1 second delay

### ISSUE THREAD

**Issue by michael-bouvy** [k3s-io/k3s#1542]
First of all, thanks for the great job, k3s is really easy to deploy and use!

**Version:**

k3s `v1.17.3+k3s1`

Tried on both **Debian 10** (with iptables in legacy mode) and **Ubuntu 18.04**

**K3s arguments:**

Tried incrementally with and without each of these: `--docker --no-deploy servicelb --no-deploy traefik`.

**Describe the bug**

When querying a service exposing a NodePort, a delay of exactly 1 second (+ processing time of backend) is observed, no matter the location of the Pod (same or different node from the one running the query):

```
michael@k3s-84ff0a1a905ae1e3-1:~$ time nc -vz 127.0.0.1 30363
Connection to 127.0.0.1 30363 port [tcp/*] succeeded!

real	0m1.012s
user	0m0.002s
sys	0m0.000s
michael@k3s-84ff0a1a905ae1e3-1:~$ time nc -vz 127.0.0.1 30363
Connection to 127.0.0.1 30363 port [tcp/*] succeeded!

real	0m1.012s
user	0m0.002s
sys	0m0.000s
michael@k3s-84ff0a1a905ae1e3-1:~$ time nc -vz 127.0.0.1 30363
Connection to 127.0.0.1 30363 port [tcp/*] succeeded!

real	0m1.021s
user	0m0.002s
sys	0m0.000s
```

**To Reproduce**

Create a k3s cluster with 3 identical nodes: 1 master and 2 agents.

Deploy nginx ingress controller:

```
kubectl apply -f https://raw.githubusercontent.com/kubernetes/ingress-nginx/nginx-0.30.0/deploy/static/mandatory.yaml
kubectl apply -f https://raw.githubusercontent.com/kubernetes/ingress-nginx/nginx-0.30.0/deploy/static/provider/baremetal/service-nodeport.yaml
```

Scale the Deployment to 3 replicas so each node has 1 Pod of the Deployment running (thanks to the scheduling policy).

Get the NodePort of the `ingress-nginx` service:

```
kubectl -n ingress-nginx get svc ingress-nginx
```

From any node, run `nc -vz 127.0.0.1 <node-port>` or `curl http://127.0.0.1:<node-port>`.

**Expected behavior**

No delay.

**Actual behavior**

1 second delay.

**Additional context / logs**

* Nodes are Google Compute instances
* This does not affect ClusterIP services
* The `tcpdump` output clearly shows the 1 second delay between the two first lines:

```
22:42:54.165187 IP k3s-84ff0a1a905ae1e3-1.7934 > 10.42.1.2.http: Flags [S], seq 1318783836, win 65495, options [mss 65495,sackOK,TS val 716433293 ecr 0,nop,wscale 7], length 0
E..<[ @.@..F
*..
*.....PN..\...................
*...........
22:42:55.189273 IP k3s-84ff0a1a905ae1e3-1.7934 > 10.42.1.2.http: Flags [S], seq 1318783836, win 65495, options [mss 65495,sackOK,TS val 716434317 ecr 0,nop,wscale 7], length 0
E..<[!@.@..E
*..
*.....PN..\...................
*...........
22:42:55.189769 IP 10.42.1.2.http > k3s-84ff0a1a905ae1e3-1.7934: Flags [S.], seq 2820216795, ack 1318783837, win 65184, options [mss 1370,sackOK,TS val 2026443818 ecr 716434317,nop,wscale 7], length 0
E..<..@.?.&g
*..
*...P......N..]....W......Z...
x..**.......
22:42:55.189814 IP k3s-84ff0a1a905ae1e3-1.7934 > 10.42.1.2.http: Flags [.], ack 1, win 512, options [nop,nop,TS val 716434318 ecr 2026443818], length 0
E..4["@.@..L
*..
*.....PN..].........|.....
*...x..*
22:42:55.189867 IP k3s-84ff0a1a905ae1e3-1.7934 > 10.42.1.2.http: Flags [P.], seq 1:88, ack 1, win 512, options [nop,nop,TS val 716434318 ecr 2026443818], length 87: HTTP: HEAD /healthz HTTP/1.1
E...[#@.@...
*..
*.....PN..]...............
*...x..*HEAD /healthz HTTP/1.1
Host: 127.0.0.1:30363
User-Agent: curl/7.58.0
Accept: */*


22:42:55.189999 IP 10.42.1.2.http > k3s-84ff0a1a905ae1e3-1.7934: Flags [.], ack 88, win 509, options [nop,nop,TS val 2026443818 ecr 716434318], length 0
E..4..@.?.-.
*..
*...P......N..............
x..**...
22:42:55.190098 IP 10.42.1.2.http > k3s-84ff0a1a905ae1e3-1.7934: Flags [P.], seq 1:147, ack 88, win 509, options [nop,nop,TS val 2026443818 ecr 716434318], length 146: HTTP: HTTP/1.1 200 OK
E.....@.?.,.
*..
*...P......N........d.....
x..**...HTTP/1.1 200 OK
Server: nginx/1.17.8
Date: Sat, 14 Mar 2020 22:42:55 GMT
Content-Type: text/html
Content-Length: 0
Connection: keep-alive


22:42:55.190112 IP k3s-84ff0a1a905ae1e3-1.7934 > 10.42.1.2.http: Flags [.], ack 147, win 511, options [nop,nop,TS val 716434318 ecr 2026443818], length 0
E..4[$@.@..J
*..
*.....PN......n.....|.....
*...x..*
22:42:55.190232 IP k3s-84ff0a1a905ae1e3-1.7934 > 10.42.1.2.http: Flags [F.], seq 88, ack 147, win 512, options [nop,nop,TS val 716434318 ecr 2026443818], length 0
E..4[%@.@..I
*..
*.....PN......n.....|.....
*...x..*
22:42:55.190346 IP 10.42.1.2.http > k3s-84ff0a1a905ae1e3-1.7934: Flags [F.], seq 147, ack 89, win 509, options [nop,nop,TS val 2026443819 ecr 716434318], length 0
E..4..@.?.-.
*..
*...P.....nN..............
x..+*...
22:42:55.190363 IP k3s-84ff0a1a905ae1e3-1.7934 > 10.42.1.2.http: Flags [.], ack 148, win 512, options [nop,nop,TS val 716434318 ecr 2026443819], length 0
E..4[&@.@..H
*..
*.....PN......o.....|.....
*...x..+
```

**Comment by avz** [comment]
I also have this delay on both `NodePort` and `ClusterIP` on a fresh cluster. I checked it several times by re-creating the cluster on clean servers. The problem is reproduced in 100% of cases.

```
Ubuntu 18.04.4 LTS - 4.15.0-99-generic
k3s: v1.17.4 k3s1 (3eee8ac3)
```

One of test clusters:
```
root@k8s-1:~# kubectl get nodes
NAME    STATUS   ROLES    AGE    VERSION
k8s-3   Ready    <none>   2d7h   v1.17.4+k3s1
k8s-4   Ready    <none>   2d7h   v1.17.4+k3s1
k8s-1   Ready    master   2d8h   v1.17.4+k3s1
k8s-5   Ready    <none>   2d7h   v1.17.4+k3s1
k8s-2   Ready    <none>   2d7h   v1.17.4+k3s1
```

I also noticed that the delay only appears if the connection is redirected to another node. Local connections work without delay.
