### ISSUE TITLE
k3s over tailscale egress UDP is blocked

### ISSUE THREAD

**Issue by edwardchenchen** [k3s-io/k3s#6255]
### What is the issue?

after installing k3s on tailscale0 network, udp connection is blocked.

Ubuntu 20.04.5 LTS (GNU/Linux 5.15.0-1018-gcp x86_64)
k3s version v1.24.6+k3s1 (a8e0c66d)
Tailscale version 1.30.2

### Steps to reproduce

---

## install k3s using following
```
curl -sfL https://get.k3s.io | sh -s - server   \
--token=xxxx   \
--datastore-endpoint "mysql://xxxxx" \
--no-deploy traefik local-storage \
--tls-san 35.244.103.135 \
--tls-san 100.64.0.7 \
--node-ip 100.64.0.7 \
--node-external-ip 35.244.103.135 \
--node-name gcp \
--flannel-iface tailscale0
```

```
# root@terraform-x86:~# kubectl get nodes -o wide
NAME   STATUS   ROLES                  AGE   VERSION        INTERNAL-IP   EXTERNAL-IP      OS-IMAGE             KERNEL-VERSION    CONTAINER-RUNTIME
gcp    Ready    control-plane,master   33s   v1.24.6+k3s1   100.64.0.7    35.244.103.135   Ubuntu 20.04.5 LTS   5.15.0-1018-gcp   containerd://1.6.8-k3s1
```

## create and deploy a cloudflare tunnel which use udp connection and how I found this problem
```
apiVersion: v1
kind: Secret
metadata:
  name: cloudflare-tunnel-token
  namespace: default
type: Opaque
stringData:
  token: xxxxx

---
apiVersion: apps/v1
kind: Deployment
metadata:
  name: cloudflared
spec:
  selector:
    matchLabels:
      app: cloudflared
  replicas: 1
  template:
    metadata:
      labels:
        app: cloudflared
    spec:
      containers:
      - name: cloudflared
        image: cloudflare/cloudflared
        args: ["tunnel", "run"]
        env:
        - name: TUNNEL_TOKEN
          valueFrom:
            secretKeyRef:
              name: cloudflare-tunnel-token
              key: token
              optional: false
```

check the pod logs
```
root@terraform-x86:~# kubectl get pods -o wide
NAME                           READY   STATUS    RESTARTS   AGE   IP          NODE   NOMINATED NODE   READINESS GATES
cloudflared-6ccb9844cf-ltbcq   1/1     Running   0          71s   10.42.0.5   gcp    <none>           <none>
root@terraform-x86:~# kubectl logs cloudflared-6ccb9844cf-ltbcq
2022-10-11T07:38:41Z INF Starting tunnel tunnelID=1e9bcabf-2b07-43e3-a9b9-166e5b61ec47
2022-10-11T07:38:41Z INF Cannot determine default configuration path. No file [config.yml config.yaml] in [~/.cloudflared ~/.cloudflare-warp ~/cloudflare-warp /etc/cloudflared /usr/local/etc/cloudflared]
2022-10-11T07:38:41Z INF Version 2022.10.0
2022-10-11T07:38:41Z INF GOOS: linux, GOVersion: go1.19.1, GoArch: amd64
2022-10-11T07:38:41Z INF Settings: map[no-autoupdate:true]
2022-10-11T07:38:41Z INF Environmental variables map[TUNNEL_TOKEN:*****]
2022-10-11T07:38:41Z INF Generated Connector ID: 3c26fd11-c558-4761-adb5-098406be88ba
2022-10-11T07:38:41Z INF Will be fetching remotely managed configuration from Cloudflare API. Defaulting to protocol: quic
2022-10-11T07:38:41Z INF Initial protocol quic
2022-10-11T07:38:41Z INF ICMP proxy will use 10.42.0.5 as source for IPv4
2022-10-11T07:38:41Z INF ICMP proxy will use ::1 in zone lo as source for IPv6
2022-10-11T07:38:41Z INF Starting metrics server on 127.0.0.1:34281/metrics
2022/10/11 07:38:41 failed to sufficiently increase receive buffer size (was: 208 kiB, wanted: 2048 kiB, got: 416 kiB). See https://github.com/lucas-clemente/quic-go/wiki/UDP-Receive-Buffer-Size for details.
2022-10-11T07:38:46Z ERR Failed to create new quic connection error="failed to dial to edge with quic: timeout: no recent network activity" connIndex=0 ip=198.41.200.43
2022-10-11T07:38:46Z INF Retrying connection in up to 2s seconds connIndex=0 ip=198.41.200.43
2022-10-11T07:38:47Z WRN If this log occurs persistently, and cloudflared is unable to connect to Cloudflare Network with `quic` protocol, then most likely your machine/network is getting its egress UDP to port 7844 (or others) blocked or dropped. Make sure to allow egress connectivity as per https://developers.cloudflare.com/cloudflare-one/connections/connect-apps/configuration/ports-and-ips/
If you are using private routing to this Tunnel, then UDP (and Private DNS Resolution) will not work unless your cloudflared can connect with Cloudflare Network with `quic`. connIndex=0 ip=198.41.200.43
2022-10-11T07:38:47Z INF Switching to fallback protocol http2 connIndex=0 ip=198.41.200.43
2022-10-11T07:38:48Z INF Connection 7dfeb03b-ec99-4ae9-9114-812c6c2cf6e3 registered connIndex=0 ip=198.41.200.43 location=SYD
2022-10-11T07:38:53Z WRN Failed to create new quic connection error="failed to dial to edge with quic: timeout: no recent network activity" connIndex=1 ip=198.41.192.227
2022-10-11T07:38:53Z INF Retrying connection in up to 2s seconds connIndex=1 ip=198.41.192.227
2022-10-11T07:38:53Z WRN If this log occurs persistently, and cloudflared is unable to connect to Cloudflare Network with `quic` protocol, then most likely your machine/network is getting its egress UDP to port 7844 (or others) blocked or dropped. Make sure to allow egress connectivity as per https://developers.cloudflare.com/cloudflare-one/connections/connect-apps/configuration/ports-and-ips/
If you are using private routing to this Tunnel, then UDP (and Private DNS Resolution) will not work unless your cloudflared can connect with Cloudflare Network with `quic`. connIndex=1 ip=198.41.192.227
2022-10-11T07:38:53Z INF Switching to fallback protocol http2 connIndex=1 ip=198.41.192.227
2022-10-11T07:38:53Z WRN Connection terminated error="failed to dial to edge with quic: timeout: no recent network activity" connIndex=1
2022-10-11T07:38:54Z WRN Failed to create new quic connection error="failed to dial to edge with quic: timeout: no recent network activity" connIndex=2 ip=198.41.200.33
2022-10-11T07:38:54Z INF Retrying connection in up to 2s seconds connIndex=2 ip=198.41.200.33
2022-10-11T07:38:54Z WRN If this log occurs persistently, and cloudflared is unable to connect to Cloudflare Network with `quic` protocol, then most likely your machine/network is getting its egress UDP to port 7844 (or others) blocked or dropped. Make sure to allow egress connectivity as per https://developers.cloudflare.com/cloudflare-one/connections/connect-apps/configuration/ports-and-ips/
If you are using private routing to this Tunnel, then UDP (and Private DNS Resolution) will not work unless your cloudflared can connect with Cloudflare Network with `quic`. connIndex=2 ip=198.41.200.33
2022-10-11T07:38:54Z INF Switching to fallback protocol http2 connIndex=2 ip=198.41.200.33
2022-10-11T07:38:54Z WRN Connection terminated error="failed to dial to edge with quic: timeout: no recent network activity" connIndex=2
2022-10-11T07:38:55Z WRN Failed to create new quic connection error="failed to dial to edge with quic: timeout: no recent network activity" connIndex=3 ip=198.41.192.167
2022-10-11T07:38:55Z INF Retrying connection in up to 2s seconds connIndex=3 ip=198.41.192.167
2022-10-11T07:38:55Z WRN If this log occurs persistently, and cloudflared is unable to connect to Cloudflare Network with `quic` protocol, then most likely your machine/network is getting its egress UDP to port 7844 (or others) blocked or dropped. Make sure to allow egress connectivity as per https://developers.cloudflare.com/cloudflare-one/connections/connect-apps/configuration/ports-and-ips/
If you are using private routing to this Tunnel, then UDP (and Private DNS Resolution) will not work unless your cloudflared can connect with Cloudflare Network with `quic`. connIndex=3 ip=198.41.192.167
2022-10-11T07:38:55Z INF Switching to fallback protocol http2 connIndex=3 ip=198.41.192.167
2022-10-11T07:38:55Z WRN Connection terminated error="failed to dial to edge with quic: timeout: no recent network activity" connIndex=3
2022-10-11T07:38:55Z INF Connection f7027f9c-2010-4cab-aec8-b203e8cf1455 registered connIndex=2 ip=198.41.200.33 location=SYD
2022-10-11T07:38:56Z INF Connection aba6146a-4fcf-4c05-922b-db19eb9db8cd registered connIndex=1 ip=198.41.192.227 location=NRT
2022-10-11T07:39:13Z INF Connection 1192ae26-b5b8-4def-9eef-30c840c461a7 registered connIndex=3 ip=198.41.192.167 location=NRT
```

# Issue1: These lines suggests that udp egress is blocked
```
2022-10-11T07:38:46Z ERR Failed to create new quic connection error="failed to dial to edge with quic: timeout: no recent network activity" connIndex=0 ip=198.41.200.43
2022-10-11T07:38:46Z INF Retrying connection in up to 2s seconds connIndex=0 ip=198.41.200.43
2022-10-11T07:38:47Z WRN If this log occurs persistently, and cloudflared is unable to connect to Cloudflare Network with `quic` protocol, then most likely your machine/network is getting its egress UDP to port 7844 (or others) blocked or dropped. Make sure to allow egress connectivity as per https://developers.cloudflare.com/cloudflare-one/connections/connect-apps/configuration/ports-and-ips/
If you are using private routing to this Tunnel, then UDP (and Private DNS Resolution) will not work unless your cloudflared can connect with Cloudflare Network with `quic`. connIndex=0 ip=198.41.200.43
```

# Above is a single node k3s on tailscale network, the issue does not exist when installed on default eth without 
`--flannel-iface tailscale0`
shown below
```
curl -sfL https://get.k3s.io | sh -s - server   \
--token=xxx \
--datastore-endpoint "mysql://xxx" \
--no-deploy traefik local-storage \
--tls-san 35.244.103.135 \
--tls-san 10.152.0.38 \
--node-ip 10.152.0.38 \
--node-external-ip 35.244.103.135 \
--node-name gcp
```

confirm node up
```
root@terraform-x86:~# kubectl get node -o wide
NAME   STATUS   ROLES                  AGE   VERSION        INTERNAL-IP   EXTERNAL-IP      OS-IMAGE             KERNEL-VERSION    CONTAINER-RUNTIME
gcp    Ready    control-plane,master   10s   v1.24.6+k3s1   10.152.0.38   35.244.103.135   Ubuntu 20.04.5 LTS   5.15.0-1018-gcp   containerd://1.6.8-k3s1
```
deploy cloudflare.yaml and confirm udp connection is established with no problem

```
root@terraform-x86:~# kubectl get pods -o wide
NAME                           READY   STATUS    RESTARTS   AGE   IP          NODE   NOMINATED NODE   READINESS GATES
cloudflared-6ccb9844cf-vmktj   1/1     Running   0          11s   10.42.0.5   gcp    <none>           <none>
root@terraform-x86:~# kubectl logs cloudflared-6ccb9844cf-vmktj
2022-10-11T08:08:22Z INF Starting tunnel tunnelID=1e9bcabf-2b07-43e3-a9b9-166e5b61ec47
2022-10-11T08:08:22Z INF Cannot determine default configuration path. No file [config.yml config.yaml] in [~/.cloudflared ~/.cloudflare-warp ~/cloudflare-warp /etc/cloudflared /usr/local/etc/cloudflared]
2022-10-11T08:08:22Z INF Version 2022.10.0
2022-10-11T08:08:22Z INF GOOS: linux, GOVersion: go1.19.1, GoArch: amd64
2022-10-11T08:08:22Z INF Settings: map[no-autoupdate:true]
2022-10-11T08:08:22Z INF Environmental variables map[TUNNEL_TOKEN:*****]
2022-10-11T08:08:22Z INF Generated Connector ID: 0bcd742f-5d64-4633-8846-b06cb7107c8f
2022-10-11T08:08:22Z INF Will be fetching remotely managed configuration from Cloudflare API. Defaulting to protocol: quic
2022-10-11T08:08:22Z INF Initial protocol quic
2022-10-11T08:08:22Z INF ICMP proxy will use 10.42.0.5 as source for IPv4
2022-10-11T08:08:22Z INF ICMP proxy will use fe80::d092:6aff:fed6:5e1e in zone eth0 as source for IPv6
2022-10-11T08:08:22Z INF Starting metrics server on 127.0.0.1:36637/metrics
2022/10/11 08:08:22 failed to sufficiently increase receive buffer size (was: 208 kiB, wanted: 2048 kiB, got: 416 kiB). See https://github.com/lucas-clemente/quic-go/wiki/UDP-Receive-Buffer-Size for details.
2022-10-11T08:08:23Z INF Connection ab8e52d5-d94a-424d-8367-fe910e95006b registered connIndex=0 ip=198.41.200.63 location=SYD
2022-10-11T08:08:24Z INF Connection 3b006ba0-eb57-4a3b-acc0-e2e21c88d94f registered connIndex=1 ip=198.41.192.37 location=NRT
2022-10-11T08:08:25Z INF Connection b2f09f6c-44c7-445b-95ad-1a86142f29ee registered connIndex=2 ip=198.41.200.73 location=SYD
2022-10-11T08:08:26Z INF Connection 0ed13d5f-062b-4226-95df-ef0ff64ad8c8 registered connIndex=3 ip=198.41.192.47 location=NRT
```

---
# Additional info
# I am no expert to iptables, I put the info here, if anyone can help

iptables before k3s install on GCP
```
root@terraform-x86:~# iptables -L
Chain INPUT (policy ACCEPT)
target     prot opt source               destination
ts-input   all  --  anywhere             anywhere

Chain FORWARD (policy ACCEPT)
target     prot opt source               destination
ts-forward  all  --  anywhere             anywhere

Chain OUTPUT (policy ACCEPT)
target     prot opt source               destination

Chain ts-forward (1 references)
target     prot opt source               destination
MARK       all  --  anywhere             anywhere             MARK set 0x40000
ACCEPT     all  --  anywhere             anywhere             mark match 0x40000
DROP       all  --  100.64.0.0/10        anywhere
ACCEPT     all  --  anywhere             anywhere

Chain ts-input (1 references)
target     prot opt source               destination
ACCEPT     all  --  terraform-x86        anywhere
RETURN     all  --  100.115.92.0/23      anywhere
DROP       all  --  100.64.0.0/10        anywhere
```

iptables after k3s install on GCP on tailscale
```
root@terraform-x86:~# iptables -L
Chain INPUT (policy ACCEPT)
target     prot opt source               destination
KUBE-ROUTER-INPUT  all  --  anywhere             anywhere             /* kube-router netpol - 4IA2OSFRMVNDXBVV */
KUBE-NODEPORTS  all  --  anywhere             anywhere             /* kubernetes health check service ports */
KUBE-EXTERNAL-SERVICES  all  --  anywhere             anywhere             ctstate NEW /* kubernetes externally-visible service portals */
KUBE-FIREWALL  all  --  anywhere             anywhere
ts-input   all  --  anywhere             anywhere

Chain FORWARD (policy ACCEPT)
target     prot opt source               destination
KUBE-ROUTER-FORWARD  all  --  anywhere             anywhere             /* kube-router netpol - TEMCG2JMHZYE7H7T */
KUBE-FORWARD  all  --  anywhere             anywhere             /* kubernetes forwarding rules */
KUBE-SERVICES  all  --  anywhere             anywhere             ctstate NEW /* kubernetes service portals */
KUBE-EXTERNAL-SERVICES  all  --  anywhere             anywhere             ctstate NEW /* kubernetes externally-visible service portals */
ts-forward  all  --  anywhere             anywhere
ACCEPT     all  --  terraform-x86/16     anywhere             /* flanneld forward */
ACCEPT     all  --  anywhere             terraform-x86/16     /* flanneld forward */

Chain OUTPUT (policy ACCEPT)
target     prot opt source               destination
KUBE-ROUTER-OUTPUT  all  --  anywhere             anywhere             /* kube-router netpol - VEAAIY32XVBHCSCY */
KUBE-SERVICES  all  --  anywhere             anywhere             ctstate NEW /* kubernetes service portals */
KUBE-FIREWALL  all  --  anywhere             anywhere

Chain KUBE-EXTERNAL-SERVICES (2 references)
target     prot opt source               destination

Chain KUBE-FIREWALL (2 references)
target     prot opt source               destination
DROP       all  --  anywhere             anywhere             /* kubernetes firewall for dropping marked packets */ mark match 0x8000/0x8000
DROP       all  -- !localhost/8          localhost/8          /* block incoming localnet connections */ ! ctstate RELATED,ESTABLISHED,DNAT

Chain KUBE-FORWARD (1 references)
target     prot opt source               destination
DROP       all  --  anywhere             anywhere             ctstate INVALID
ACCEPT     all  --  anywhere             anywhere             /* kubernetes forwarding rules */ mark match 0x4000/0x4000
ACCEPT     all  --  anywhere             anywhere             /* kubernetes forwarding conntrack rule */ ctstate RELATED,ESTABLISHED

Chain KUBE-KUBELET-CANARY (0 references)
target     prot opt source               destination

Chain KUBE-NODEPORTS (1 references)
target     prot opt source               destination

Chain KUBE-NWPLCY-DEFAULT (0 references)
target     prot opt source               destination
MARK       all  --  anywhere             anywhere             /* rule to mark traffic matching a network policy */ MARK or 0x10000

Chain KUBE-PROXY-CANARY (0 references)
target     prot opt source               destination

Chain KUBE-ROUTER-FORWARD (1 references)
target     prot opt source               destination
ACCEPT     all  --  anywhere             anywhere             /* rule to explicitly ACCEPT traffic that comply to network policies */ mark match 0x20000/0x20000

Chain KUBE-ROUTER-INPUT (1 references)
target     prot opt source               destination
RETURN     all  --  anywhere             10.43.0.0/16         /* allow traffic to primary cluster IP range - TZZOAXOCHPHEHX7M */
RETURN     tcp  --  anywhere             anywhere             /* allow LOCAL TCP traffic to node ports - LR7XO7NXDBGQJD2M */ ADDRTYPE match dst-type LOCAL multiport dports 30000:32767
RETURN     udp  --  anywhere             anywhere             /* allow LOCAL UDP traffic to node ports - 76UCBPIZNGJNWNUZ */ ADDRTYPE match dst-type LOCAL multiport dports 30000:32767
ACCEPT     all  --  anywhere             anywhere             /* rule to explicitly ACCEPT traffic that comply to network policies */ mark match 0x20000/0x20000

Chain KUBE-ROUTER-OUTPUT (1 references)
target     prot opt source               destination
ACCEPT     all  --  anywhere             anywhere             /* rule to explicitly ACCEPT traffic that comply to network policies */ mark match 0x20000/0x20000

Chain KUBE-SERVICES (2 references)
target     prot opt source               destination

Chain ts-forward (1 references)
target     prot opt source               destination
MARK       all  --  anywhere             anywhere             MARK set 0x40000
ACCEPT     all  --  anywhere             anywhere             mark match 0x40000
DROP       all  --  100.64.0.0/10        anywhere
ACCEPT     all  --  anywhere             anywhere

Chain ts-input (1 references)
target     prot opt source               destination
ACCEPT     all  --  terraform-x86        anywhere
RETURN     all  --  100.115.92.0/23      anywhere
DROP       all  --  100.64.0.0/10        anywhere
```

iptables after k3s install on eth
```
root@terraform-x86:~# iptables -L
Chain INPUT (policy ACCEPT)
target     prot opt source               destination
KUBE-ROUTER-INPUT  all  --  anywhere             anywhere             /* kube-router netpol - 4IA2OSFRMVNDXBVV */
KUBE-NODEPORTS  all  --  anywhere             anywhere             /* kubernetes health check service ports */
KUBE-EXTERNAL-SERVICES  all  --  anywhere             anywhere             ctstate NEW /* kubernetes externally-visible service portals */
KUBE-FIREWALL  all  --  anywhere             anywhere
ts-input   all  --  anywhere             anywhere

Chain FORWARD (policy ACCEPT)
target     prot opt source               destination
KUBE-ROUTER-FORWARD  all  --  anywhere             anywhere             /* kube-router netpol - TEMCG2JMHZYE7H7T */
KUBE-FORWARD  all  --  anywhere             anywhere             /* kubernetes forwarding rules */
KUBE-SERVICES  all  --  anywhere             anywhere             ctstate NEW /* kubernetes service portals */
KUBE-EXTERNAL-SERVICES  all  --  anywhere             anywhere             ctstate NEW /* kubernetes externally-visible service portals */
ts-forward  all  --  anywhere             anywhere
ACCEPT     all  --  terraform-x86/16     anywhere             /* flanneld forward */
ACCEPT     all  --  anywhere             terraform-x86/16     /* flanneld forward */

Chain OUTPUT (policy ACCEPT)
target     prot opt source               destination
KUBE-ROUTER-OUTPUT  all  --  anywhere             anywhere             /* kube-router netpol - VEAAIY32XVBHCSCY */
KUBE-SERVICES  all  --  anywhere             anywhere             ctstate NEW /* kubernetes service portals */
KUBE-FIREWALL  all  --  anywhere             anywhere

Chain KUBE-EXTERNAL-SERVICES (2 references)
target     prot opt source               destination

Chain KUBE-FIREWALL (2 references)
target     prot opt source               destination
DROP       all  --  anywhere             anywhere             /* kubernetes firewall for dropping marked packets */ mark match 0x8000/0x8000
DROP       all  -- !localhost/8          localhost/8          /* block incoming localnet connections */ ! ctstate RELATED,ESTABLISHED,DNAT

Chain KUBE-FORWARD (1 references)
target     prot opt source               destination
DROP       all  --  anywhere             anywhere             ctstate INVALID
ACCEPT     all  --  anywhere             anywhere             /* kubernetes forwarding rules */ mark match 0x4000/0x4000
ACCEPT     all  --  anywhere             anywhere             /* kubernetes forwarding conntrack rule */ ctstate RELATED,ESTABLISHED

Chain KUBE-KUBELET-CANARY (0 references)
target     prot opt source               destination

Chain KUBE-NODEPORTS (1 references)
target     prot opt source               destination

Chain KUBE-NWPLCY-DEFAULT (8 references)
target     prot opt source               destination
MARK       all  --  anywhere             anywhere             /* rule to mark traffic matching a network policy */ MARK or 0x10000

Chain KUBE-POD-FW-3O4KNX6WISAB32EO (7 references)
target     prot opt source               destination
ACCEPT     all  --  anywhere             anywhere             /* rule for stateful firewall for pod */ ctstate RELATED,ESTABLISHED
ACCEPT     all  --  anywhere             10.42.0.6            /* rule to permit the traffic traffic to pods when source is the pod's local node */ ADDRTYPE match src-type LOCAL
KUBE-NWPLCY-DEFAULT  all  --  10.42.0.6            anywhere             /* run through default egress network policy  chain */
KUBE-NWPLCY-DEFAULT  all  --  anywhere             10.42.0.6            /* run through default ingress network policy  chain */
NFLOG      all  --  anywhere             anywhere             /* rule to log dropped traffic POD name:local-path-provisioner-7b7dc8d6f5-9lrqs namespace: kube-system */ mark match ! 0x10000/0x10000 limit: avg 10/min burst 10 nflog-group 100
REJECT     all  --  anywhere             anywhere             /* rule to REJECT traffic destined for POD name:local-path-provisioner-7b7dc8d6f5-9lrqs namespace: kube-system */ mark match ! 0x10000/0x10000 reject-with icmp-port-unreachable
MARK       all  --  anywhere             anywhere             MARK and 0xfffeffff
MARK       all  --  anywhere             anywhere             /* set mark to ACCEPT traffic that comply to network policies */ MARK or 0x20000

Chain KUBE-POD-FW-4CQOGLDT5QXDFOD3 (7 references)
target     prot opt source               destination
ACCEPT     all  --  anywhere             anywhere             /* rule for stateful firewall for pod */ ctstate RELATED,ESTABLISHED
ACCEPT     all  --  anywhere             10.42.0.7            /* rule to permit the traffic traffic to pods when source is the pod's local node */ ADDRTYPE match src-type LOCAL
KUBE-NWPLCY-DEFAULT  all  --  10.42.0.7            anywhere             /* run through default egress network policy  chain */
KUBE-NWPLCY-DEFAULT  all  --  anywhere             10.42.0.7            /* run through default ingress network policy  chain */
NFLOG      all  --  anywhere             anywhere             /* rule to log dropped traffic POD name:coredns-b96499967-qflrm namespace: kube-system */ mark match ! 0x10000/0x10000 limit: avg 10/min burst 10 nflog-group 100
REJECT     all  --  anywhere             anywhere             /* rule to REJECT traffic destined for POD name:coredns-b96499967-qflrm namespace: kube-system */ mark match ! 0x10000/0x10000 reject-with icmp-port-unreachable
MARK       all  --  anywhere             anywhere             MARK and 0xfffeffff
MARK       all  --  anywhere             anywhere             /* set mark to ACCEPT traffic that comply to network policies */ MARK or 0x20000

Chain KUBE-POD-FW-DGHIOCGKPHGMHBM6 (7 references)
target     prot opt source               destination
ACCEPT     all  --  anywhere             anywhere             /* rule for stateful firewall for pod */ ctstate RELATED,ESTABLISHED
ACCEPT     all  --  anywhere             10.42.0.8            /* rule to permit the traffic traffic to pods when source is the pod's local node */ ADDRTYPE match src-type LOCAL
KUBE-NWPLCY-DEFAULT  all  --  10.42.0.8            anywhere             /* run through default egress network policy  chain */
KUBE-NWPLCY-DEFAULT  all  --  anywhere             10.42.0.8            /* run through default ingress network policy  chain */
NFLOG      all  --  anywhere             anywhere             /* rule to log dropped traffic POD name:metrics-server-668d979685-snbz8 namespace: kube-system */ mark match ! 0x10000/0x10000 limit: avg 10/min burst 10 nflog-group 100
REJECT     all  --  anywhere             anywhere             /* rule to REJECT traffic destined for POD name:metrics-server-668d979685-snbz8 namespace: kube-system */ mark match ! 0x10000/0x10000 reject-with icmp-port-unreachable
MARK       all  --  anywhere             anywhere             MARK and 0xfffeffff
MARK       all  --  anywhere             anywhere             /* set mark to ACCEPT traffic that comply to network policies */ MARK or 0x20000

Chain KUBE-POD-FW-VPDONGZKLL7UIHKZ (7 references)
target     prot opt source               destination
ACCEPT     all  --  anywhere             anywhere             /* rule for stateful firewall for pod */ ctstate RELATED,ESTABLISHED
ACCEPT     all  --  anywhere             10.42.0.9            /* rule to permit the traffic traffic to pods when source is the pod's local node */ ADDRTYPE match src-type LOCAL
KUBE-NWPLCY-DEFAULT  all  --  10.42.0.9            anywhere             /* run through default egress network policy  chain */
KUBE-NWPLCY-DEFAULT  all  --  anywhere             10.42.0.9            /* run through default ingress network policy  chain */
NFLOG      all  --  anywhere             anywhere             /* rule to log dropped traffic POD name:cloudflared-6ccb9844cf-vmktj namespace: default */ mark match ! 0x10000/0x10000 limit: avg 10/min burst 10 nflog-group 100
REJECT     all  --  anywhere             anywhere             /* rule to REJECT traffic destined for POD name:cloudflared-6ccb9844cf-vmktj namespace: default */ mark match ! 0x10000/0x10000 reject-with icmp-port-unreachable
MARK       all  --  anywhere             anywhere             MARK and 0xfffeffff
MARK       all  --  anywhere             anywhere             /* set mark to ACCEPT traffic that comply to network policies */ MARK or 0x20000

Chain KUBE-PROXY-CANARY (0 references)
target     prot opt source               destination

Chain KUBE-ROUTER-FORWARD (1 references)
target     prot opt source               destination
KUBE-POD-FW-4CQOGLDT5QXDFOD3  all  --  anywhere             10.42.0.7            /* rule to jump traffic destined to POD name:coredns-b96499967-qflrm namespace: kube-system to chain KUBE-POD-FW-4CQOGLDT5QXDFOD3 */
KUBE-POD-FW-4CQOGLDT5QXDFOD3  all  --  anywhere             10.42.0.7            PHYSDEV match --physdev-is-bridged /* rule to jump traffic destined to POD name:coredns-b96499967-qflrm namespace: kube-system to chain KUBE-POD-FW-4CQOGLDT5QXDFOD3 */
KUBE-POD-FW-4CQOGLDT5QXDFOD3  all  --  10.42.0.7            anywhere             /* rule to jump traffic from POD name:coredns-b96499967-qflrm namespace: kube-system to chain KUBE-POD-FW-4CQOGLDT5QXDFOD3 */
KUBE-POD-FW-4CQOGLDT5QXDFOD3  all  --  10.42.0.7            anywhere             PHYSDEV match --physdev-is-bridged /* rule to jump traffic from POD name:coredns-b96499967-qflrm namespace: kube-system to chain KUBE-POD-FW-4CQOGLDT5QXDFOD3 */
KUBE-POD-FW-DGHIOCGKPHGMHBM6  all  --  anywhere             10.42.0.8            /* rule to jump traffic destined to POD name:metrics-server-668d979685-snbz8 namespace: kube-system to chain KUBE-POD-FW-DGHIOCGKPHGMHBM6 */
KUBE-POD-FW-DGHIOCGKPHGMHBM6  all  --  anywhere             10.42.0.8            PHYSDEV match --physdev-is-bridged /* rule to jump traffic destined to POD name:metrics-server-668d979685-snbz8 namespace: kube-system to chain KUBE-POD-FW-DGHIOCGKPHGMHBM6 */
KUBE-POD-FW-DGHIOCGKPHGMHBM6  all  --  10.42.0.8            anywhere             /* rule to jump traffic from POD name:metrics-server-668d979685-snbz8 namespace: kube-system to chain KUBE-POD-FW-DGHIOCGKPHGMHBM6 */
KUBE-POD-FW-DGHIOCGKPHGMHBM6  all  --  10.42.0.8            anywhere             PHYSDEV match --physdev-is-bridged /* rule to jump traffic from POD name:metrics-server-668d979685-snbz8 namespace: kube-system to chain KUBE-POD-FW-DGHIOCGKPHGMHBM6 */
KUBE-POD-FW-VPDONGZKLL7UIHKZ  all  --  anywhere             10.42.0.9            /* rule to jump traffic destined to POD name:cloudflared-6ccb9844cf-vmktj namespace: default to chain KUBE-POD-FW-VPDONGZKLL7UIHKZ */
KUBE-POD-FW-VPDONGZKLL7UIHKZ  all  --  anywhere             10.42.0.9            PHYSDEV match --physdev-is-bridged /* rule to jump traffic destined to POD name:cloudflared-6ccb9844cf-vmktj namespace: default to chain KUBE-POD-FW-VPDONGZKLL7UIHKZ */
KUBE-POD-FW-VPDONGZKLL7UIHKZ  all  --  10.42.0.9            anywhere             /* rule to jump traffic from POD name:cloudflared-6ccb9844cf-vmktj namespace: default to chain KUBE-POD-FW-VPDONGZKLL7UIHKZ */
KUBE-POD-FW-VPDONGZKLL7UIHKZ  all  --  10.42.0.9            anywhere             PHYSDEV match --physdev-is-bridged /* rule to jump traffic from POD name:cloudflared-6ccb9844cf-vmktj namespace: default to chain KUBE-POD-FW-VPDONGZKLL7UIHKZ */
KUBE-POD-FW-3O4KNX6WISAB32EO  all  --  anywhere             10.42.0.6            /* rule to jump traffic destined to POD name:local-path-provisioner-7b7dc8d6f5-9lrqs namespace: kube-system to chain KUBE-POD-FW-3O4KNX6WISAB32EO */
KUBE-POD-FW-3O4KNX6WISAB32EO  all  --  anywhere             10.42.0.6            PHYSDEV match --physdev-is-bridged /* rule to jump traffic destined to POD name:local-path-provisioner-7b7dc8d6f5-9lrqs namespace: kube-system to chain KUBE-POD-FW-3O4KNX6WISAB32EO */
KUBE-POD-FW-3O4KNX6WISAB32EO  all  --  10.42.0.6            anywhere             /* rule to jump traffic from POD name:local-path-provisioner-7b7dc8d6f5-9lrqs namespace: kube-system to chain KUBE-POD-FW-3O4KNX6WISAB32EO */
KUBE-POD-FW-3O4KNX6WISAB32EO  all  --  10.42.0.6            anywhere             PHYSDEV match --physdev-is-bridged /* rule to jump traffic from POD name:local-path-provisioner-7b7dc8d6f5-9lrqs namespace: kube-system to chain KUBE-POD-FW-3O4KNX6WISAB32EO */
ACCEPT     all  --  anywhere             anywhere             /* rule to explicitly ACCEPT traffic that comply to network policies */ mark match 0x20000/0x20000

Chain KUBE-ROUTER-INPUT (1 references)
target     prot opt source               destination
RETURN     all  --  anywhere             10.43.0.0/16         /* allow traffic to primary cluster IP range - TZZOAXOCHPHEHX7M */
RETURN     tcp  --  anywhere             anywhere             /* allow LOCAL TCP traffic to node ports - LR7XO7NXDBGQJD2M */ ADDRTYPE match dst-type LOCAL multiport dports 30000:32767
RETURN     udp  --  anywhere             anywhere             /* allow LOCAL UDP traffic to node ports - 76UCBPIZNGJNWNUZ */ ADDRTYPE match dst-type LOCAL multiport dports 30000:32767
KUBE-POD-FW-4CQOGLDT5QXDFOD3  all  --  10.42.0.7            anywhere             /* rule to jump traffic from POD name:coredns-b96499967-qflrm namespace: kube-system to chain KUBE-POD-FW-4CQOGLDT5QXDFOD3 */
KUBE-POD-FW-DGHIOCGKPHGMHBM6  all  --  10.42.0.8            anywhere             /* rule to jump traffic from POD name:metrics-server-668d979685-snbz8 namespace: kube-system to chain KUBE-POD-FW-DGHIOCGKPHGMHBM6 */
KUBE-POD-FW-VPDONGZKLL7UIHKZ  all  --  10.42.0.9            anywhere             /* rule to jump traffic from POD name:cloudflared-6ccb9844cf-vmktj namespace: default to chain KUBE-POD-FW-VPDONGZKLL7UIHKZ */
KUBE-POD-FW-3O4KNX6WISAB32EO  all  --  10.42.0.6            anywhere             /* rule to jump traffic from POD name:local-path-provisioner-7b7dc8d6f5-9lrqs namespace: kube-system to chain KUBE-POD-FW-3O4KNX6WISAB32EO */
ACCEPT     all  --  anywhere             anywhere             /* rule to explicitly ACCEPT traffic that comply to network policies */ mark match 0x20000/0x20000

Chain KUBE-ROUTER-OUTPUT (1 references)
target     prot opt source               destination
KUBE-POD-FW-4CQOGLDT5QXDFOD3  all  --  anywhere             10.42.0.7            /* rule to jump traffic destined to POD name:coredns-b96499967-qflrm namespace: kube-system to chain KUBE-POD-FW-4CQOGLDT5QXDFOD3 */
KUBE-POD-FW-4CQOGLDT5QXDFOD3  all  --  10.42.0.7            anywhere             /* rule to jump traffic from POD name:coredns-b96499967-qflrm namespace: kube-system to chain KUBE-POD-FW-4CQOGLDT5QXDFOD3 */
KUBE-POD-FW-DGHIOCGKPHGMHBM6  all  --  anywhere             10.42.0.8            /* rule to jump traffic destined to POD name:metrics-server-668d979685-snbz8 namespace: kube-system to chain KUBE-POD-FW-DGHIOCGKPHGMHBM6 */
KUBE-POD-FW-DGHIOCGKPHGMHBM6  all  --  10.42.0.8            anywhere             /* rule to jump traffic from POD name:metrics-server-668d979685-snbz8 namespace: kube-system to chain KUBE-POD-FW-DGHIOCGKPHGMHBM6 */
KUBE-POD-FW-VPDONGZKLL7UIHKZ  all  --  anywhere             10.42.0.9            /* rule to jump traffic destined to POD name:cloudflared-6ccb9844cf-vmktj namespace: default to chain KUBE-POD-FW-VPDONGZKLL7UIHKZ */
KUBE-POD-FW-VPDONGZKLL7UIHKZ  all  --  10.42.0.9            anywhere             /* rule to jump traffic from POD name:cloudflared-6ccb9844cf-vmktj namespace: default to chain KUBE-POD-FW-VPDONGZKLL7UIHKZ */
KUBE-POD-FW-3O4KNX6WISAB32EO  all  --  anywhere             10.42.0.6            /* rule to jump traffic destined to POD name:local-path-provisioner-7b7dc8d6f5-9lrqs namespace: kube-system to chain KUBE-POD-FW-3O4KNX6WISAB32EO */
KUBE-POD-FW-3O4KNX6WISAB32EO  all  --  10.42.0.6            anywhere             /* rule to jump traffic from POD name:local-path-provisioner-7b7dc8d6f5-9lrqs namespace: kube-system to chain KUBE-POD-FW-3O4KNX6WISAB32EO */
ACCEPT     all  --  anywhere             anywhere             /* rule to explicitly ACCEPT traffic that comply to network policies */ mark match 0x20000/0x20000

Chain KUBE-SERVICES (2 references)
target     prot opt source               destination

Chain ts-forward (1 references)
target     prot opt source               destination
MARK       all  --  anywhere             anywhere             MARK set 0x40000
ACCEPT     all  --  anywhere             anywhere             mark match 0x40000
DROP       all  --  100.64.0.0/10        anywhere
ACCEPT     all  --  anywhere             anywhere

Chain ts-input (1 references)
target     prot opt source               destination
ACCEPT     all  --  terraform-x86        anywhere
RETURN     all  --  100.115.92.0/23      anywhere
DROP       all  --  100.64.0.0/10        anywhere
```
I don't know why, but this iptable is significantly larger

**Comment by edwardchenchen** [comment]
https://github.com/tailscale/tailscale/issues/5894

**Comment by manuelbuil** [comment]
Hello! First I have a question: why are you deploying k3s with tailscale? Is it because you have a cluster of nodes that are not in the same network?

**Comment by manuelbuil** [comment]
While you answer the question, let me explain you how networking works. Flannel uses the interface to send packets across nodes within the cluster, e.g. to connect pods that are running in different nodes. In your case, if I understand correctly, you are trying to connect from your pod to an external server (cloudflare), right? In that case, the interface is not used at all.

In that case, what happens is that the pod sends the traffic to the host and the host, using iptables, will `MASQUERADE` the traffic, i.e. it changes the source IP and puts the one from the host. This should happen in both cases, when defining flannel-interface and when not defining it. Therefore, I am surprised that you see any difference.

I would like to see the following information, executed in the host where the pod, trying to connect to cloudfare, runs:
1 - `sudo iptables -nt nat --list | grep flannel`
2 - `sudo ip r`
3 - `sudo ip r get 198.41.200.33`

**Comment by edwardchenchen** [comment]
> Hello! First I have a question: why are you deploying k3s with tailscale? Is it because you have a cluster of nodes that are not in the same network?

Yes, I understand my use is not really the recommended way of using k83/k3s.
Yes, for personal use, I utilize Oracle Free ARM and GCP spot instance, AWS spot instance, and sometimes VMWare VM machines on my PC when I need more processing power.

**Comment by edwardchenchen** [comment]
> While you answer the question, let me explain you how networking in Flannel works. Flannel uses the interface to send packets across nodes within the cluster, e.g. to connect pods that are running in different nodes. In your case, if I understand correctly, you are trying to connect from your pod to an external server (cloudflare), right? In that case, the interface is not used at all.
> 
> In that case, what happens is that the pod sends the traffic to the host and the host, using iptables, will `MASQUERADE` the traffic, i.e. it changes the source IP and puts the one from the host. This should happen in both cases, when defining flannel-interface and when not defining it. Therefore, I am surprised that you see any difference.
> 
> I would like to see the following information, executed in the host where the pod, trying to connect to cloudfare, runs: 1 - `sudo iptables -nt nat --list | grep flannel` 2 - `sudo ip r` 3 - `sudo ip r get 198.41.200.33`

```
root@terraform-x86:~# kubectl logs cloudflared-6ccb9844cf-6fzcc
2022-10-14T11:03:05Z INF Starting tunnel tunnelID=1e9bcabf-2b07-43e3-a9b9-166e5b61ec47
2022-10-14T11:03:05Z INF Cannot determine default configuration path. No file [config.yml config.yaml] in [~/.cloudflared ~/.cloudflare-warp ~/cloudflare-warp /etc/cloudflared /usr/local/etc/cloudflared]
2022-10-14T11:03:05Z INF Version 2022.10.0
2022-10-14T11:03:05Z INF GOOS: linux, GOVersion: go1.19.1, GoArch: amd64
2022-10-14T11:03:05Z INF Settings: map[no-autoupdate:true]
2022-10-14T11:03:05Z INF Environmental variables map[TUNNEL_TOKEN:*****]
2022-10-14T11:03:06Z INF Generated Connector ID: 4e28d211-19ca-404c-bfcc-566eb8e2f422
2022-10-14T11:03:06Z INF Will be fetching remotely managed configuration from Cloudflare API. Defaulting to protocol: quic
2022-10-14T11:03:06Z INF Initial protocol quic
2022-10-14T11:03:06Z INF ICMP proxy will use 10.42.0.5 as source for IPv4
2022-10-14T11:03:06Z INF ICMP proxy will use ::1 in zone lo as source for IPv6
2022-10-14T11:03:06Z INF Starting metrics server on 127.0.0.1:41935/metrics
2022/10/14 11:03:06 failed to sufficiently increase receive buffer size (was: 208 kiB, wanted: 2048 kiB, got: 416 kiB). See https://github.com/lucas-clemente/quic-go/wiki/UDP-Receive-Buffer-Size for details.
2022-10-14T11:03:11Z ERR Failed to create new quic connection error="failed to dial to edge with quic: timeout: no recent network activity" connIndex=0 ip=198.41.200.233
2022-10-14T11:03:11Z INF Retrying connection in up to 2s seconds connIndex=0 ip=198.41.200.233
2022-10-14T11:03:12Z WRN If this log occurs persistently, and cloudflared is unable to connect to Cloudflare Network with `quic` protocol, then most likely your machine/network is getting its egress UDP to port 7844 (or others) blocked or dropped. Make sure to allow egress connectivity as per https://developers.cloudflare.com/cloudflare-one/connections/connect-apps/configuration/ports-and-ips/
If you are using private routing to this Tunnel, then UDP (and Private DNS Resolution) will not work unless your cloudflared can connect with Cloudflare Network with `quic`. connIndex=0 ip=198.41.200.233
2022-10-14T11:03:12Z INF Switching to fallback protocol http2 connIndex=0 ip=198.41.200.233
2022-10-14T11:03:13Z INF Connection 1f7c18ad-fd37-4333-883d-25ca5a22b0b4 registered connIndex=0 ip=198.41.200.233 location=SYD
```

```
root@terraform-x86:~# iptables -nt nat --list | grep flannel
RETURN     all  --  10.42.0.0/16         10.42.0.0/16         /* flanneld masq */
MASQUERADE  all  --  10.42.0.0/16        !224.0.0.0/4          /* flanneld masq */ random-fully
RETURN     all  -- !10.42.0.0/16         10.42.0.0/24         /* flanneld masq */
MASQUERADE  all  -- !10.42.0.0/16         10.42.0.0/16         /* flanneld masq */ random-fully
```
```
# ip r
default via 10.152.0.1 dev ens4 proto dhcp src 10.152.0.38 metric 100
10.42.0.0/24 dev cni0 proto kernel scope link src 10.42.0.1
10.152.0.1 dev ens4 proto dhcp scope link src 10.152.0.38 metric 100
```
```
# ip r get 198.41.200.33
198.41.200.33 via 10.152.0.1 dev ens4 src 10.152.0.38 uid 0
    cache
# ip r get 198.41.200.233
198.41.200.233 via 10.152.0.1 dev ens4 src 10.152.0.38 uid 0
    cache
```

it is UDP that is not working, TCP is working.

**Comment by manuelbuil** [comment]
> > Hello! First I have a question: why are you deploying k3s with tailscale? Is it because you have a cluster of nodes that are not in the same network?
> 
> Yes, I understand my use is not really the recommended way of using k83/k3s. Yes, for personal use, I utilize Oracle Free ARM and GCP spot instance, AWS spot instance, and sometimes VMWare VM machines on my PC when I need more processing power.

In the next k3s release (coming out next week), k3s will be able to deploy a cluster on nodes that are not in the same network without needing tailscale or other VPN. You will only need a public IP in your instances. The solution does not have all the features that tailscale includes (central server, GUI, ACLs...) but it is good enough and simple. You would just need to have this in your config:
```
write-kubeconfig-mode: 644
token: "secret"
node-external-ip: $SERVER_PUBLIC_IP
flannel-backend: wireguard-native
```
This is the PR: https://github.com/k3s-io/k3s/pull/6180

**Comment by manuelbuil** [comment]
> > While you answer the question, let me explain you how networking in Flannel works. Flannel uses the interface to send packets across nodes within the cluster, e.g. to connect pods that are running in different nodes. In your case, if I understand correctly, you are trying to connect from your pod to an external server (cloudflare), right? In that case, the interface is not used at all.
> > In that case, what happens is that the pod sends the traffic to the host and the host, using iptables, will `MASQUERADE` the traffic, i.e. it changes the source IP and puts the one from the host. This should happen in both cases, when defining flannel-interface and when not defining it. Therefore, I am surprised that you see any difference.
> > I would like to see the following information, executed in the host where the pod, trying to connect to cloudfare, runs: 1 - `sudo iptables -nt nat --list | grep flannel` 2 - `sudo ip r` 3 - `sudo ip r get 198.41.200.33`
> 
> ```
> root@terraform-x86:~# kubectl logs cloudflared-6ccb9844cf-6fzcc
> 2022-10-14T11:03:05Z INF Starting tunnel tunnelID=1e9bcabf-2b07-43e3-a9b9-166e5b61ec47
> 2022-10-14T11:03:05Z INF Cannot determine default configuration path. No file [config.yml config.yaml] in [~/.cloudflared ~/.cloudflare-warp ~/cloudflare-warp /etc/cloudflared /usr/local/etc/cloudflared]
> 2022-10-14T11:03:05Z INF Version 2022.10.0
> 2022-10-14T11:03:05Z INF GOOS: linux, GOVersion: go1.19.1, GoArch: amd64
> 2022-10-14T11:03:05Z INF Settings: map[no-autoupdate:true]
> 2022-10-14T11:03:05Z INF Environmental variables map[TUNNEL_TOKEN:*****]
> 2022-10-14T11:03:06Z INF Generated Connector ID: 4e28d211-19ca-404c-bfcc-566eb8e2f422
> 2022-10-14T11:03:06Z INF Will be fetching remotely managed configuration from Cloudflare API. Defaulting to protocol: quic
> 2022-10-14T11:03:06Z INF Initial protocol quic
> 2022-10-14T11:03:06Z INF ICMP proxy will use 10.42.0.5 as source for IPv4
> 2022-10-14T11:03:06Z INF ICMP proxy will use ::1 in zone lo as source for IPv6
> 2022-10-14T11:03:06Z INF Starting metrics server on 127.0.0.1:41935/metrics
> 2022/10/14 11:03:06 failed to sufficiently increase receive buffer size (was: 208 kiB, wanted: 2048 kiB, got: 416 kiB). See https://github.com/lucas-clemente/quic-go/wiki/UDP-Receive-Buffer-Size for details.
> 2022-10-14T11:03:11Z ERR Failed to create new quic connection error="failed to dial to edge with quic: timeout: no recent network activity" connIndex=0 ip=198.41.200.233
> 2022-10-14T11:03:11Z INF Retrying connection in up to 2s seconds connIndex=0 ip=198.41.200.233
> 2022-10-14T11:03:12Z WRN If this log occurs persistently, and cloudflared is unable to connect to Cloudflare Network with `quic` protocol, then most likely your machine/network is getting its egress UDP to port 7844 (or others) blocked or dropped. Make sure to allow egress connectivity as per https://developers.cloudflare.com/cloudflare-one/connections/connect-apps/configuration/ports-and-ips/
> If you are using private routing to this Tunnel, then UDP (and Private DNS Resolution) will not work unless your cloudflared can connect with Cloudflare Network with `quic`. connIndex=0 ip=198.41.200.233
> 2022-10-14T11:03:12Z INF Switching to fallback protocol http2 connIndex=0 ip=198.41.200.233
> 2022-10-14T11:03:13Z INF Connection 1f7c18ad-fd37-4333-883d-25ca5a22b0b4 registered connIndex=0 ip=198.41.200.233 location=SYD
> ```
> 
> ```
> root@terraform-x86:~# iptables -nt nat --list | grep flannel
> RETURN     all  --  10.42.0.0/16         10.42.0.0/16         /* flanneld masq */
> MASQUERADE  all  --  10.42.0.0/16        !224.0.0.0/4          /* flanneld masq */ random-fully
> RETURN     all  -- !10.42.0.0/16         10.42.0.0/24         /* flanneld masq */
> MASQUERADE  all  -- !10.42.0.0/16         10.42.0.0/16         /* flanneld masq */ random-fully
> ```
> 
> ```
> # ip r
> default via 10.152.0.1 dev ens4 proto dhcp src 10.152.0.38 metric 100
> 10.42.0.0/24 dev cni0 proto kernel scope link src 10.42.0.1
> 10.152.0.1 dev ens4 proto dhcp scope link src 10.152.0.38 metric 100
> ```
> 
> ```
> # ip r get 198.41.200.33
> 198.41.200.33 via 10.152.0.1 dev ens4 src 10.152.0.38 uid 0
>     cache
> # ip r get 198.41.200.233
> 198.41.200.233 via 10.152.0.1 dev ens4 src 10.152.0.38 uid 0
>     cache
> ```
> 
> it is UDP that is not working, TCP is working.

Everything seems correct. In the env that does not work, can you deploy another pod with `hostNetwork: true` and verify if it works?

**Comment by edwardchenchen** [comment]
> Everything seems correct. In the env that does not work, can you deploy another pod with `hostNetwork: true` and verify if it works?

well, working

```
2022-10-14T11:28:44Z INF Starting tunnel tunnelID=1e9bcabf-2b07-43e3-a9b9-166e5b61ec47
2022-10-14T11:28:44Z INF Cannot determine default configuration path. No file [config.yml config.yaml] in [~/.cloudflared ~/.cloudflare-warp ~/cloudflare-warp /etc/cloudflared /usr/local/etc/cloudflared]
2022-10-14T11:28:44Z INF Version 2022.10.0
2022-10-14T11:28:44Z INF GOOS: linux, GOVersion: go1.19.1, GoArch: amd64
2022-10-14T11:28:44Z INF Settings: map[no-autoupdate:true]
2022-10-14T11:28:44Z INF Environmental variables map[TUNNEL_TOKEN:*****]
2022-10-14T11:28:44Z INF Generated Connector ID: 083a060a-ef8c-4c16-b18e-0406368c195e
2022-10-14T11:28:44Z INF Will be fetching remotely managed configuration from Cloudflare API. Defaulting to protocol: quic
2022-10-14T11:28:44Z INF Initial protocol quic
2022-10-14T11:28:44Z INF ICMP proxy will use 10.152.0.38 as source for IPv4
2022-10-14T11:28:44Z INF ICMP proxy will use fe80::4001:aff:fe98:26 in zone ens4 as source for IPv6
2022-10-14T11:28:44Z INF Starting metrics server on 127.0.0.1:40741/metrics
2022/10/14 11:28:44 failed to sufficiently increase receive buffer size (was: 208 kiB, wanted: 2048 kiB, got: 416 kiB). See https://github.com/lucas-clemente/quic-go/wiki/UDP-Receive-Buffer-Size for details.
2022-10-14T11:28:44Z INF Connection af9aeaa8-7348-4223-bba3-9e04851ddacc registered connIndex=0 ip=198.41.200.53 location=SYD
2022-10-14T11:28:45Z INF Connection 1c91c9ea-4a42-4f28-8b01-11ba3910a2d3 registered connIndex=1 ip=198.41.192.37 location=NRT
2022-10-14T11:28:46Z INF Connection 51a67aff-88a3-453c-8c13-72370acf19d5 registered connIndex=2 ip=198.41.200.113 location=SYD
2022-10-14T11:28:46Z INF Connection b33f0ae8-2cb2-44d5-b9d0-d207b387d3cc registered connIndex=3 ip=198.41.192.47 location=NRT
```

```
apiVersion: apps/v1
kind: Deployment
metadata:
  name: cloudflared
spec:
  selector:
    matchLabels:
      app: cloudflared
  replicas: 1
  template:
    metadata:
      labels:
        app: cloudflared
    spec:
      hostNetwork: true
      containers:
      - name: cloudflared
        image: cloudflare/cloudflared
        args: ["tunnel", "run"]
        env:
        - name: TUNNEL_TOKEN
          valueFrom:
            secretKeyRef:
              name: cloudflare-tunnel-token
              key: token
              optional: false
```

**Comment by edwardchenchen** [comment]
> > > While you answer the question, let me explain you how networking in Flannel works. Flannel uses the interface to send packets across nodes within the cluster, e.g. to connect pods that are running in different nodes. In your case, if I understand correctly, you are trying to connect from your pod to an external server (cloudflare), right? In that case, the interface is not used at all.
> > > In that case, what happens is that the pod sends the traffic to the host and the host, using iptables, will `MASQUERADE` the traffic, i.e. it changes the source IP and puts the one from the host. This should happen in both cases, when defining flannel-interface and when not defining it. Therefore, I am surprised that you see any difference.
> > > I would like to see the following information, executed in the host where the pod, trying to connect to cloudfare, runs: 1 - `sudo iptables -nt nat --list | grep flannel` 2 - `sudo ip r` 3 - `sudo ip r get 198.41.200.33`
> > 
> > 
> > ```
> > root@terraform-x86:~# kubectl logs cloudflared-6ccb9844cf-6fzcc
> > 2022-10-14T11:03:05Z INF Starting tunnel tunnelID=1e9bcabf-2b07-43e3-a9b9-166e5b61ec47
> > 2022-10-14T11:03:05Z INF Cannot determine default configuration path. No file [config.yml config.yaml] in [~/.cloudflared ~/.cloudflare-warp ~/cloudflare-warp /etc/cloudflared /usr/local/etc/cloudflared]
> > 2022-10-14T11:03:05Z INF Version 2022.10.0
> > 2022-10-14T11:03:05Z INF GOOS: linux, GOVersion: go1.19.1, GoArch: amd64
> > 2022-10-14T11:03:05Z INF Settings: map[no-autoupdate:true]
> > 2022-10-14T11:03:05Z INF Environmental variables map[TUNNEL_TOKEN:*****]
> > 2022-10-14T11:03:06Z INF Generated Connector ID: 4e28d211-19ca-404c-bfcc-566eb8e2f422
> > 2022-10-14T11:03:06Z INF Will be fetching remotely managed configuration from Cloudflare API. Defaulting to protocol: quic
> > 2022-10-14T11:03:06Z INF Initial protocol quic
> > 2022-10-14T11:03:06Z INF ICMP proxy will use 10.42.0.5 as source for IPv4
> > 2022-10-14T11:03:06Z INF ICMP proxy will use ::1 in zone lo as source for IPv6
> > 2022-10-14T11:03:06Z INF Starting metrics server on 127.0.0.1:41935/metrics
> > 2022/10/14 11:03:06 failed to sufficiently increase receive buffer size (was: 208 kiB, wanted: 2048 kiB, got: 416 kiB). See https://github.com/lucas-clemente/quic-go/wiki/UDP-Receive-Buffer-Size for details.
> > 2022-10-14T11:03:11Z ERR Failed to create new quic connection error="failed to dial to edge with quic: timeout: no recent network activity" connIndex=0 ip=198.41.200.233
> > 2022-10-14T11:03:11Z INF Retrying connection in up to 2s seconds connIndex=0 ip=198.41.200.233
> > 2022-10-14T11:03:12Z WRN If this log occurs persistently, and cloudflared is unable to connect to Cloudflare Network with `quic` protocol, then most likely your machine/network is getting its egress UDP to port 7844 (or others) blocked or dropped. Make sure to allow egress connectivity as per https://developers.cloudflare.com/cloudflare-one/connections/connect-apps/configuration/ports-and-ips/
> > If you are using private routing to this Tunnel, then UDP (and Private DNS Resolution) will not work unless your cloudflared can connect with Cloudflare Network with `quic`. connIndex=0 ip=198.41.200.233
> > 2022-10-14T11:03:12Z INF Switching to fallback protocol http2 connIndex=0 ip=198.41.200.233
> > 2022-10-14T11:03:13Z INF Connection 1f7c18ad-fd37-4333-883d-25ca5a22b0b4 registered connIndex=0 ip=198.41.200.233 location=SYD
> > ```
> > 
> > 
> >     
> >       
> >     
> > 
> >       
> >     
> > 
> >     
> >   
> > ```
> > root@terraform-x86:~# iptables -nt nat --list | grep flannel
> > RETURN     all  --  10.42.0.0/16         10.42.0.0/16         /* flanneld masq */
> > MASQUERADE  all  --  10.42.0.0/16        !224.0.0.0/4          /* flanneld masq */ random-fully
> > RETURN     all  -- !10.42.0.0/16         10.42.0.0/24         /* flanneld masq */
> > MASQUERADE  all  -- !10.42.0.0/16         10.42.0.0/16         /* flanneld masq */ random-fully
> > ```
> > 
> > 
> >     
> >       
> >     
> > 
> >       
> >     
> > 
> >     
> >   
> > ```
> > # ip r
> > default via 10.152.0.1 dev ens4 proto dhcp src 10.152.0.38 metric 100
> > 10.42.0.0/24 dev cni0 proto kernel scope link src 10.42.0.1
> > 10.152.0.1 dev ens4 proto dhcp scope link src 10.152.0.38 metric 100
> > ```
> > 
> > 
> >     
> >       
> >     
> > 
> >       
> >     
> > 
> >     
> >   
> > ```
> > # ip r get 198.41.200.33
> > 198.41.200.33 via 10.152.0.1 dev ens4 src 10.152.0.38 uid 0
> >     cache
> > # ip r get 198.41.200.233
> > 198.41.200.233 via 10.152.0.1 dev ens4 src 10.152.0.38 uid 0
> >     cache
> > ```
> > 
> > 
> >     
> >       
> >     
> > 
> >       
> >     
> > 
> >     
> >   
> > it is UDP that is not working, TCP is working.
> 
> Everything seems correct. In the env that does not work, can you deploy another pod with `hostNetwork: true` and verify if it works?

change it back, not working
```
2022-10-14T11:30:26Z INF Starting tunnel tunnelID=1e9bcabf-2b07-43e3-a9b9-166e5b61ec47
2022-10-14T11:30:26Z INF Cannot determine default configuration path. No file [config.yml config.yaml] in [~/.cloudflared ~/.cloudflare-warp ~/cloudflare-warp /etc/cloudflared /usr/local/etc/cloudflared]
2022-10-14T11:30:26Z INF Version 2022.10.0
2022-10-14T11:30:26Z INF GOOS: linux, GOVersion: go1.19.1, GoArch: amd64
2022-10-14T11:30:26Z INF Settings: map[no-autoupdate:true]
2022-10-14T11:30:26Z INF Environmental variables map[TUNNEL_TOKEN:*****]
2022-10-14T11:30:26Z INF Generated Connector ID: 8e207d68-b14a-421a-af64-bba9f9cc089a
2022-10-14T11:30:26Z INF Will be fetching remotely managed configuration from Cloudflare API. Defaulting to protocol: quic
2022-10-14T11:30:26Z INF Initial protocol quic
2022-10-14T11:30:26Z INF ICMP proxy will use 10.42.0.16 as source for IPv4
2022-10-14T11:30:26Z INF ICMP proxy will use ::1 in zone lo as source for IPv6
2022-10-14T11:30:26Z INF Starting metrics server on 127.0.0.1:32809/metrics
2022/10/14 11:30:26 failed to sufficiently increase receive buffer size (was: 208 kiB, wanted: 2048 kiB, got: 416 kiB). See https://github.com/lucas-clemente/quic-go/wiki/UDP-Receive-Buffer-Size for details.
2022-10-14T11:30:31Z ERR Failed to create new quic connection error="failed to dial to edge with quic: timeout: no recent network activity" connIndex=0 ip=198.41.200.33
2022-10-14T11:30:31Z INF Retrying connection in up to 2s seconds connIndex=0 ip=198.41.200.33
2022-10-14T11:30:32Z WRN If this log occurs persistently, and cloudflared is unable to connect to Cloudflare Network with `quic` protocol, then most likely your machine/network is getting its egress UDP to port 7844 (or others) blocked or dropped. Make sure to allow egress connectivity as per https://developers.cloudflare.com/cloudflare-one/connections/connect-apps/configuration/ports-and-ips/
If you are using private routing to this Tunnel, then UDP (and Private DNS Resolution) will not work unless your cloudflared can connect with Cloudflare Network with `quic`. connIndex=0 ip=198.41.200.33
2022-10-14T11:30:32Z INF Switching to fallback protocol http2 connIndex=0 ip=198.41.200.33
2022-10-14T11:30:32Z INF Connection ecd2fd87-9d96-4c47-8ae2-e94ccdc061a1 registered connIndex=0 ip=198.41.200.33 location=SYD
2022-10-14T11:30:37Z WRN Failed to create new quic connection error="failed to dial to edge with quic: timeout: no recent network activity" connIndex=1 ip=198.41.192.7
2022-10-14T11:30:37Z INF Retrying connection in up to 2s seconds connIndex=1 ip=198.41.192.7
2022-10-14T11:30:38Z WRN If this log occurs persistently, and cloudflared is unable to connect to Cloudflare Network with `quic` protocol, then most likely your machine/network is getting its egress UDP to port 7844 (or others) blocked or dropped. Make sure to allow egress connectivity as per https://developers.cloudflare.com/cloudflare-one/connections/connect-apps/configuration/ports-and-ips/
If you are using private routing to this Tunnel, then UDP (and Private DNS Resolution) will not work unless your cloudflared can connect with Cloudflare Network with `quic`. connIndex=1 ip=198.41.192.7
2022-10-14T11:30:38Z INF Switching to fallback protocol http2 connIndex=1 ip=198.41.192.7
2022-10-14T11:30:38Z WRN Connection terminated error="failed to dial to edge with quic: timeout: no recent network activity" connIndex=1
2022-10-14T11:30:38Z WRN Failed to create new quic connection error="failed to dial to edge with quic: timeout: no recent network activity" connIndex=2 ip=198.41.200.113
2022-10-14T11:30:38Z INF Retrying connection in up to 2s seconds connIndex=2 ip=198.41.200.113
2022-10-14T11:30:39Z WRN Failed to create new quic connection error="failed to dial to edge with quic: timeout: no recent network activity" connIndex=3 ip=198.41.192.37
2022-10-14T11:30:39Z INF Retrying connection in up to 2s seconds connIndex=3 ip=198.41.192.37
2022-10-14T11:30:40Z WRN If this log occurs persistently, and cloudflared is unable to connect to Cloudflare Network with `quic` protocol, then most likely your machine/network is getting its egress UDP to port 7844 (or others) blocked or dropped. Make sure to allow egress connectivity as per https://developers.cloudflare.com/cloudflare-one/connections/connect-apps/configuration/ports-and-ips/
If you are using private routing to this Tunnel, then UDP (and Private DNS Resolution) will not work unless your cloudflared can connect with Cloudflare Network with `quic`. connIndex=2 ip=198.41.200.113
2022-10-14T11:30:40Z INF Switching to fallback protocol http2 connIndex=2 ip=198.41.200.113
2022-10-14T11:30:40Z WRN Connection terminated error="failed to dial to edge with quic: timeout: no recent network activity" connIndex=2
2022-10-14T11:30:40Z INF Connection 998ee951-141f-480a-bfed-de634c2b93ac registered connIndex=1 ip=198.41.192.7 location=NRT
2022-10-14T11:30:41Z WRN If this log occurs persistently, and cloudflared is unable to connect to Cloudflare Network with `quic` protocol, then most likely your machine/network is getting its egress UDP to port 7844 (or others) blocked or dropped. Make sure to allow egress connectivity as per https://developers.cloudflare.com/cloudflare-one/connections/connect-apps/configuration/ports-and-ips/
If you are using private routing to this Tunnel, then UDP (and Private DNS Resolution) will not work unless your cloudflared can connect with Cloudflare Network with `quic`. connIndex=3 ip=198.41.192.37
2022-10-14T11:30:41Z INF Switching to fallback protocol http2 connIndex=3 ip=198.41.192.37
2022-10-14T11:30:41Z WRN Connection terminated error="failed to dial to edge with quic: timeout: no recent network activity" connIndex=3
```

```
apiVersion: apps/v1
kind: Deployment
metadata:
  name: cloudflared
spec:
  selector:
    matchLabels:
      app: cloudflared
  replicas: 1
  template:
    metadata:
      labels:
        app: cloudflared
    spec:

      containers:
      - name: cloudflared
        image: cloudflare/cloudflared
        args: ["tunnel", "run"]
        env:
        - name: TUNNEL_TOKEN
          valueFrom:
            secretKeyRef:
              name: cloudflare-tunnel-token
              key: token
              optional: false
```

**Comment by manuelbuil** [comment]
Something strange is happening. If possible, let's sniff the packets. In the host where the cloudflare pod is running, please run:
1 - `sudo tcpdump -eni cni0 host 198.41.200.33`
2 - `sudo tcpdump -eni ens4 host 198.41.200.33`

I would like to check how are packets egressing and whether there is a reply

**Comment by edwardchenchen** [comment]
> Something strange is happening. If possible, let's sniff the packets. In the host where the cloudflare pod is running, please run: 1 - `sudo tcpdump -eni cni0 host 198.41.200.33` 2 - `sudo tcpdump -eni ens4 host 198.41.200.33`
> 
> I would like to check how are packets egressing and whether there is a reply

<details>
  <summary>tcpdump -eni cni0 host 198.41.200.33</summary>

```
root@terraform-x86:~# tcpdump -eni cni0 host 198.41.200.33
tcpdump: verbose output suppressed, use -v or -vv for full protocol decode
listening on cni0, link-type EN10MB (Ethernet), capture size 262144 bytes
13:54:07.593186 82:4b:54:db:95:44 > 0e:2a:e2:9b:d4:ff, ethertype IPv4 (0x0800), length 100: 198.41.200.33.7844 > 10.42.0.16.40700: Flags [P.], seq 299000377:299000423, ack 2722398995, win 8, length 46
13:54:07.593857 0e:2a:e2:9b:d4:ff > 82:4b:54:db:95:44, ethertype IPv4 (0x0800), length 100: 10.42.0.16.40700 > 198.41.200.33.7844: Flags [P.], seq 1:47, ack 46, win 503, length 46
13:54:07.595536 82:4b:54:db:95:44 > 0e:2a:e2:9b:d4:ff, ethertype IPv4 (0x0800), length 54: 198.41.200.33.7844 > 10.42.0.16.40700: Flags [.], ack 47, win 8, length 0
13:54:12.595554 82:4b:54:db:95:44 > 0e:2a:e2:9b:d4:ff, ethertype IPv4 (0x0800), length 100: 198.41.200.33.7844 > 10.42.0.16.40700: Flags [P.], seq 46:92, ack 47, win 8, length 46
13:54:12.595775 0e:2a:e2:9b:d4:ff > 82:4b:54:db:95:44, ethertype IPv4 (0x0800), length 100: 10.42.0.16.40700 > 198.41.200.33.7844: Flags [P.], seq 47:93, ack 92, win 503, length 46
13:54:12.597333 82:4b:54:db:95:44 > 0e:2a:e2:9b:d4:ff, ethertype IPv4 (0x0800), length 54: 198.41.200.33.7844 > 10.42.0.16.40700: Flags [.], ack 93, win 8, length 0
13:54:17.597508 82:4b:54:db:95:44 > 0e:2a:e2:9b:d4:ff, ethertype IPv4 (0x0800), length 100: 198.41.200.33.7844 > 10.42.0.16.40700: Flags [P.], seq 92:138, ack 93, win 8, length 46
13:54:17.598127 0e:2a:e2:9b:d4:ff > 82:4b:54:db:95:44, ethertype IPv4 (0x0800), length 100: 10.42.0.16.40700 > 198.41.200.33.7844: Flags [P.], seq 93:139, ack 138, win 503, length 46
13:54:17.599739 82:4b:54:db:95:44 > 0e:2a:e2:9b:d4:ff, ethertype IPv4 (0x0800), length 54: 198.41.200.33.7844 > 10.42.0.16.40700: Flags [.], ack 139, win 8, length 0
13:54:22.600452 82:4b:54:db:95:44 > 0e:2a:e2:9b:d4:ff, ethertype IPv4 (0x0800), length 100: 198.41.200.33.7844 > 10.42.0.16.40700: Flags [P.], seq 138:184, ack 139, win 8, length 46
13:54:22.601036 0e:2a:e2:9b:d4:ff > 82:4b:54:db:95:44, ethertype IPv4 (0x0800), length 100: 10.42.0.16.40700 > 198.41.200.33.7844: Flags [P.], seq 139:185, ack 184, win 503, length 46
13:54:22.602605 82:4b:54:db:95:44 > 0e:2a:e2:9b:d4:ff, ethertype IPv4 (0x0800), length 54: 198.41.200.33.7844 > 10.42.0.16.40700: Flags [.], ack 185, win 8, length 0
13:54:27.603958 82:4b:54:db:95:44 > 0e:2a:e2:9b:d4:ff, ethertype IPv4 (0x0800), length 100: 198.41.200.33.7844 > 10.42.0.16.40700: Flags [P.], seq 184:230, ack 185, win 8, length 46
13:54:27.604547 0e:2a:e2:9b:d4:ff > 82:4b:54:db:95:44, ethertype IPv4 (0x0800), length 100: 10.42.0.16.40700 > 198.41.200.33.7844: Flags [P.], seq 185:231, ack 230, win 503, length 46
13:54:27.606155 82:4b:54:db:95:44 > 0e:2a:e2:9b:d4:ff, ethertype IPv4 (0x0800), length 54: 198.41.200.33.7844 > 10.42.0.16.40700: Flags [.], ack 231, win 8, length 0
13:54:32.606615 82:4b:54:db:95:44 > 0e:2a:e2:9b:d4:ff, ethertype IPv4 (0x0800), length 100: 198.41.200.33.7844 > 10.42.0.16.40700: Flags [P.], seq 230:276, ack 231, win 8, length 46
13:54:32.606927 0e:2a:e2:9b:d4:ff > 82:4b:54:db:95:44, ethertype IPv4 (0x0800), length 100: 10.42.0.16.40700 > 198.41.200.33.7844: Flags [P.], seq 231:277, ack 276, win 503, length 46
13:54:32.608490 82:4b:54:db:95:44 > 0e:2a:e2:9b:d4:ff, ethertype IPv4 (0x0800), length 54: 198.41.200.33.7844 > 10.42.0.16.40700: Flags [.], ack 277, win 8, length 0
13:54:37.609507 82:4b:54:db:95:44 > 0e:2a:e2:9b:d4:ff, ethertype IPv4 (0x0800), length 100: 198.41.200.33.7844 > 10.42.0.16.40700: Flags [P.], seq 276:322, ack 277, win 8, length 46
13:54:37.609943 0e:2a:e2:9b:d4:ff > 82:4b:54:db:95:44, ethertype IPv4 (0x0800), length 100: 10.42.0.16.40700 > 198.41.200.33.7844: Flags [P.], seq 277:323, ack 322, win 503, length 46
13:54:37.611463 82:4b:54:db:95:44 > 0e:2a:e2:9b:d4:ff, ethertype IPv4 (0x0800), length 54: 198.41.200.33.7844 > 10.42.0.16.40700: Flags [.], ack 323, win 8, length 0
13:54:42.612186 82:4b:54:db:95:44 > 0e:2a:e2:9b:d4:ff, ethertype IPv4 (0x0800), length 100: 198.41.200.33.7844 > 10.42.0.16.40700: Flags [P.], seq 322:368, ack 323, win 8, length 46
13:54:42.612595 0e:2a:e2:9b:d4:ff > 82:4b:54:db:95:44, ethertype IPv4 (0x0800), length 100: 10.42.0.16.40700 > 198.41.200.33.7844: Flags [P.], seq 323:369, ack 368, win 503, length 46
13:54:42.614115 82:4b:54:db:95:44 > 0e:2a:e2:9b:d4:ff, ethertype IPv4 (0x0800), length 54: 198.41.200.33.7844 > 10.42.0.16.40700: Flags [.], ack 369, win 8, length 0
13:54:47.614702 82:4b:54:db:95:44 > 0e:2a:e2:9b:d4:ff, ethertype IPv4 (0x0800), length 100: 198.41.200.33.7844 > 10.42.0.16.40700: Flags [P.], seq 368:414, ack 369, win 8, length 46
13:54:47.615044 0e:2a:e2:9b:d4:ff > 82:4b:54:db:95:44, ethertype IPv4 (0x0800), length 100: 10.42.0.16.40700 > 198.41.200.33.7844: Flags [P.], seq 369:415, ack 414, win 503, length 46
13:54:47.616565 82:4b:54:db:95:44 > 0e:2a:e2:9b:d4:ff, ethertype IPv4 (0x0800), length 54: 198.41.200.33.7844 > 10.42.0.16.40700: Flags [.], ack 415, win 8, length 0
13:54:52.617846 82:4b:54:db:95:44 > 0e:2a:e2:9b:d4:ff, ethertype IPv4 (0x0800), length 100: 198.41.200.33.7844 > 10.42.0.16.40700: Flags [P.], seq 414:460, ack 415, win 8, length 46
13:54:52.618117 0e:2a:e2:9b:d4:ff > 82:4b:54:db:95:44, ethertype IPv4 (0x0800), length 100: 10.42.0.16.40700 > 198.41.200.33.7844: Flags [P.], seq 415:461, ack 460, win 503, length 46
13:54:52.619659 82:4b:54:db:95:44 > 0e:2a:e2:9b:d4:ff, ethertype IPv4 (0x0800), length 54: 198.41.200.33.7844 > 10.42.0.16.40700: Flags [.], ack 461, win 8, length 0
13:54:57.620444 82:4b:54:db:95:44 > 0e:2a:e2:9b:d4:ff, ethertype IPv4 (0x0800), length 100: 198.41.200.33.7844 > 10.42.0.16.40700: Flags [P.], seq 460:506, ack 461, win 8, length 46
13:54:57.620761 0e:2a:e2:9b:d4:ff > 82:4b:54:db:95:44, ethertype IPv4 (0x0800), length 100: 10.42.0.16.40700 > 198.41.200.33.7844: Flags [P.], seq 461:507, ack 506, win 503, length 46
13:54:57.622316 82:4b:54:db:95:44 > 0e:2a:e2:9b:d4:ff, ethertype IPv4 (0x0800), length 54: 198.41.200.33.7844 > 10.42.0.16.40700: Flags [.], ack 507, win 8, length 0
13:55:02.622901 82:4b:54:db:95:44 > 0e:2a:e2:9b:d4:ff, ethertype IPv4 (0x0800), length 100: 198.41.200.33.7844 > 10.42.0.16.40700: Flags [P.], seq 506:552, ack 507, win 8, length 46
13:55:02.623215 0e:2a:e2:9b:d4:ff > 82:4b:54:db:95:44, ethertype IPv4 (0x0800), length 100: 10.42.0.16.40700 > 198.41.200.33.7844: Flags [P.], seq 507:553, ack 552, win 503, length 46
13:55:02.624712 82:4b:54:db:95:44 > 0e:2a:e2:9b:d4:ff, ethertype IPv4 (0x0800), length 54: 198.41.200.33.7844 > 10.42.0.16.40700: Flags [.], ack 553, win 8, length 0
13:55:07.625723 82:4b:54:db:95:44 > 0e:2a:e2:9b:d4:ff, ethertype IPv4 (0x0800), length 100: 198.41.200.33.7844 > 10.42.0.16.40700: Flags [P.], seq 552:598, ack 553, win 8, length 46
13:55:07.626078 0e:2a:e2:9b:d4:ff > 82:4b:54:db:95:44, ethertype IPv4 (0x0800), length 100: 10.42.0.16.40700 > 198.41.200.33.7844: Flags [P.], seq 553:599, ack 598, win 503, length 46
13:55:07.627607 82:4b:54:db:95:44 > 0e:2a:e2:9b:d4:ff, ethertype IPv4 (0x0800), length 54: 198.41.200.33.7844 > 10.42.0.16.40700: Flags [.], ack 599, win 8, length 0
13:55:12.628930 82:4b:54:db:95:44 > 0e:2a:e2:9b:d4:ff, ethertype IPv4 (0x0800), length 100: 198.41.200.33.7844 > 10.42.0.16.40700: Flags [P.], seq 598:644, ack 599, win 8, length 46
13:55:12.629292 0e:2a:e2:9b:d4:ff > 82:4b:54:db:95:44, ethertype IPv4 (0x0800), length 100: 10.42.0.16.40700 > 198.41.200.33.7844: Flags [P.], seq 599:645, ack 644, win 503, length 46
13:55:12.630847 82:4b:54:db:95:44 > 0e:2a:e2:9b:d4:ff, ethertype IPv4 (0x0800), length 54: 198.41.200.33.7844 > 10.42.0.16.40700: Flags [.], ack 645, win 8, length 0
13:55:17.631708 82:4b:54:db:95:44 > 0e:2a:e2:9b:d4:ff, ethertype IPv4 (0x0800), length 100: 198.41.200.33.7844 > 10.42.0.16.40700: Flags [P.], seq 644:690, ack 645, win 8, length 46
13:55:17.632077 0e:2a:e2:9b:d4:ff > 82:4b:54:db:95:44, ethertype IPv4 (0x0800), length 100: 10.42.0.16.40700 > 198.41.200.33.7844: Flags [P.], seq 645:691, ack 690, win 503, length 46
13:55:17.633924 82:4b:54:db:95:44 > 0e:2a:e2:9b:d4:ff, ethertype IPv4 (0x0800), length 54: 198.41.200.33.7844 > 10.42.0.16.40700: Flags [.], ack 691, win 8, length 0
13:55:22.634749 82:4b:54:db:95:44 > 0e:2a:e2:9b:d4:ff, ethertype IPv4 (0x0800), length 100: 198.41.200.33.7844 > 10.42.0.16.40700: Flags [P.], seq 690:736, ack 691, win 8, length 46
13:55:22.635167 0e:2a:e2:9b:d4:ff > 82:4b:54:db:95:44, ethertype IPv4 (0x0800), length 100: 10.42.0.16.40700 > 198.41.200.33.7844: Flags [P.], seq 691:737, ack 736, win 503, length 46
13:55:22.636726 82:4b:54:db:95:44 > 0e:2a:e2:9b:d4:ff, ethertype IPv4 (0x0800), length 54: 198.41.200.33.7844 > 10.42.0.16.40700: Flags [.], ack 737, win 8, length 0
13:55:27.637852 82:4b:54:db:95:44 > 0e:2a:e2:9b:d4:ff, ethertype IPv4 (0x0800), length 100: 198.41.200.33.7844 > 10.42.0.16.40700: Flags [P.], seq 736:782, ack 737, win 8, length 46
13:55:27.638303 0e:2a:e2:9b:d4:ff > 82:4b:54:db:95:44, ethertype IPv4 (0x0800), length 100: 10.42.0.16.40700 > 198.41.200.33.7844: Flags [P.], seq 737:783, ack 782, win 503, length 46
13:55:27.639956 82:4b:54:db:95:44 > 0e:2a:e2:9b:d4:ff, ethertype IPv4 (0x0800), length 54: 198.41.200.33.7844 > 10.42.0.16.40700: Flags [.], ack 783, win 8, length 0
13:55:32.640968 82:4b:54:db:95:44 > 0e:2a:e2:9b:d4:ff, ethertype IPv4 (0x0800), length 100: 198.41.200.33.7844 > 10.42.0.16.40700: Flags [P.], seq 782:828, ack 783, win 8, length 46
13:55:32.641334 0e:2a:e2:9b:d4:ff > 82:4b:54:db:95:44, ethertype IPv4 (0x0800), length 100: 10.42.0.16.40700 > 198.41.200.33.7844: Flags [P.], seq 783:829, ack 828, win 503, length 46
13:55:32.642967 82:4b:54:db:95:44 > 0e:2a:e2:9b:d4:ff, ethertype IPv4 (0x0800), length 54: 198.41.200.33.7844 > 10.42.0.16.40700: Flags [.], ack 829, win 8, length 0
13:55:37.643647 82:4b:54:db:95:44 > 0e:2a:e2:9b:d4:ff, ethertype IPv4 (0x0800), length 100: 198.41.200.33.7844 > 10.42.0.16.40700: Flags [P.], seq 828:874, ack 829, win 8, length 46
13:55:37.644135 0e:2a:e2:9b:d4:ff > 82:4b:54:db:95:44, ethertype IPv4 (0x0800), length 100: 10.42.0.16.40700 > 198.41.200.33.7844: Flags [P.], seq 829:875, ack 874, win 503, length 46
13:55:37.645795 82:4b:54:db:95:44 > 0e:2a:e2:9b:d4:ff, ethertype IPv4 (0x0800), length 54: 198.41.200.33.7844 > 10.42.0.16.40700: Flags [.], ack 875, win 8, length 0
13:55:42.646675 82:4b:54:db:95:44 > 0e:2a:e2:9b:d4:ff, ethertype IPv4 (0x0800), length 100: 198.41.200.33.7844 > 10.42.0.16.40700: Flags [P.], seq 874:920, ack 875, win 8, length 46
13:55:42.647401 0e:2a:e2:9b:d4:ff > 82:4b:54:db:95:44, ethertype IPv4 (0x0800), length 100: 10.42.0.16.40700 > 198.41.200.33.7844: Flags [P.], seq 875:921, ack 920, win 503, length 46
13:55:42.649019 82:4b:54:db:95:44 > 0e:2a:e2:9b:d4:ff, ethertype IPv4 (0x0800), length 54: 198.41.200.33.7844 > 10.42.0.16.40700: Flags [.], ack 921, win 8, length 0
13:55:47.649756 82:4b:54:db:95:44 > 0e:2a:e2:9b:d4:ff, ethertype IPv4 (0x0800), length 100: 198.41.200.33.7844 > 10.42.0.16.40700: Flags [P.], seq 920:966, ack 921, win 8, length 46
13:55:47.650350 0e:2a:e2:9b:d4:ff > 82:4b:54:db:95:44, ethertype IPv4 (0x0800), length 100: 10.42.0.16.40700 > 198.41.200.33.7844: Flags [P.], seq 921:967, ack 966, win 503, length 46
13:55:47.651921 82:4b:54:db:95:44 > 0e:2a:e2:9b:d4:ff, ethertype IPv4 (0x0800), length 54: 198.41.200.33.7844 > 10.42.0.16.40700: Flags [.], ack 967, win 8, length 0
13:55:52.652283 82:4b:54:db:95:44 > 0e:2a:e2:9b:d4:ff, ethertype IPv4 (0x0800), length 100: 198.41.200.33.7844 > 10.42.0.16.40700: Flags [P.], seq 966:1012, ack 967, win 8, length 46
13:55:52.652821 0e:2a:e2:9b:d4:ff > 82:4b:54:db:95:44, ethertype IPv4 (0x0800), length 100: 10.42.0.16.40700 > 198.41.200.33.7844: Flags [P.], seq 967:1013, ack 1012, win 503, length 46
13:55:52.654369 82:4b:54:db:95:44 > 0e:2a:e2:9b:d4:ff, ethertype IPv4 (0x0800), length 54: 198.41.200.33.7844 > 10.42.0.16.40700: Flags [.], ack 1013, win 8, length 0
13:55:57.655286 82:4b:54:db:95:44 > 0e:2a:e2:9b:d4:ff, ethertype IPv4 (0x0800), length 100: 198.41.200.33.7844 > 10.42.0.16.40700: Flags [P.], seq 1012:1058, ack 1013, win 8, length 46
13:55:57.655900 0e:2a:e2:9b:d4:ff > 82:4b:54:db:95:44, ethertype IPv4 (0x0800), length 100: 10.42.0.16.40700 > 198.41.200.33.7844: Flags [P.], seq 1013:1059, ack 1058, win 503, length 46
13:55:57.657496 82:4b:54:db:95:44 > 0e:2a:e2:9b:d4:ff, ethertype IPv4 (0x0800), length 54: 198.41.200.33.7844 > 10.42.0.16.40700: Flags [.], ack 1059, win 8, length 0
13:56:02.657778 82:4b:54:db:95:44 > 0e:2a:e2:9b:d4:ff, ethertype IPv4 (0x0800), length 100: 198.41.200.33.7844 > 10.42.0.16.40700: Flags [P.], seq 1058:1104, ack 1059, win 8, length 46
13:56:02.658170 0e:2a:e2:9b:d4:ff > 82:4b:54:db:95:44, ethertype IPv4 (0x0800), length 100: 10.42.0.16.40700 > 198.41.200.33.7844: Flags [P.], seq 1059:1105, ack 1104, win 503, length 46
13:56:02.659824 82:4b:54:db:95:44 > 0e:2a:e2:9b:d4:ff, ethertype IPv4 (0x0800), length 54: 198.41.200.33.7844 > 10.42.0.16.40700: Flags [.], ack 1105, win 8, length 0
13:56:07.660386 82:4b:54:db:95:44 > 0e:2a:e2:9b:d4:ff, ethertype IPv4 (0x0800), length 100: 198.41.200.33.7844 > 10.42.0.16.40700: Flags [P.], seq 1104:1150, ack 1105, win 8, length 46
13:56:07.660794 0e:2a:e2:9b:d4:ff > 82:4b:54:db:95:44, ethertype IPv4 (0x0800), length 100: 10.42.0.16.40700 > 198.41.200.33.7844: Flags [P.], seq 1105:1151, ack 1150, win 503, length 46
13:56:07.662505 82:4b:54:db:95:44 > 0e:2a:e2:9b:d4:ff, ethertype IPv4 (0x0800), length 54: 198.41.200.33.7844 > 10.42.0.16.40700: Flags [.], ack 1151, win 8, length 0
13:56:10.540219 0e:2a:e2:9b:d4:ff > 82:4b:54:db:95:44, ethertype IPv4 (0x0800), length 212: 10.42.0.16.40700 > 198.41.200.33.7844: Flags [P.], seq 1151:1309, ack 1150, win 503, length 158
13:56:10.541769 82:4b:54:db:95:44 > 0e:2a:e2:9b:d4:ff, ethertype IPv4 (0x0800), length 54: 198.41.200.33.7844 > 10.42.0.16.40700: Flags [.], ack 1309, win 8, length 0
13:56:10.542164 82:4b:54:db:95:44 > 0e:2a:e2:9b:d4:ff, ethertype IPv4 (0x0800), length 100: 198.41.200.33.7844 > 10.42.0.16.40700: Flags [P.], seq 1150:1196, ack 1309, win 8, length 46
13:56:10.542476 0e:2a:e2:9b:d4:ff > 82:4b:54:db:95:44, ethertype IPv4 (0x0800), length 100: 10.42.0.16.40700 > 198.41.200.33.7844: Flags [P.], seq 1309:1355, ack 1196, win 503, length 46
13:56:10.544105 82:4b:54:db:95:44 > 0e:2a:e2:9b:d4:ff, ethertype IPv4 (0x0800), length 54: 198.41.200.33.7844 > 10.42.0.16.40700: Flags [.], ack 1355, win 8, length 0
13:56:11.318299 82:4b:54:db:95:44 > 0e:2a:e2:9b:d4:ff, ethertype IPv4 (0x0800), length 172: 198.41.200.33.7844 > 10.42.0.16.40700: Flags [P.], seq 1196:1314, ack 1355, win 8, length 118
13:56:11.319032 0e:2a:e2:9b:d4:ff > 82:4b:54:db:95:44, ethertype IPv4 (0x0800), length 96: 10.42.0.16.40700 > 198.41.200.33.7844: Flags [P.], seq 1355:1397, ack 1314, win 503, length 42
13:56:11.319110 0e:2a:e2:9b:d4:ff > 82:4b:54:db:95:44, ethertype IPv4 (0x0800), length 148: 10.42.0.16.40700 > 198.41.200.33.7844: Flags [P.], seq 1397:1491, ack 1314, win 503, length 94
13:56:11.319387 0e:2a:e2:9b:d4:ff > 82:4b:54:db:95:44, ethertype IPv4 (0x0800), length 132: 10.42.0.16.40700 > 198.41.200.33.7844: Flags [P.], seq 1491:1569, ack 1314, win 503, length 78
13:56:11.319612 0e:2a:e2:9b:d4:ff > 82:4b:54:db:95:44, ethertype IPv4 (0x0800), length 156: 10.42.0.16.40700 > 198.41.200.33.7844: Flags [P.], seq 1569:1671, ack 1314, win 503, length 102
13:56:11.319662 0e:2a:e2:9b:d4:ff > 82:4b:54:db:95:44, ethertype IPv4 (0x0800), length 105: 10.42.0.16.40700 > 198.41.200.33.7844: Flags [P.], seq 1671:1722, ack 1314, win 503, length 51
13:56:11.320584 82:4b:54:db:95:44 > 0e:2a:e2:9b:d4:ff, ethertype IPv4 (0x0800), length 54: 198.41.200.33.7844 > 10.42.0.16.40700: Flags [.], ack 1397, win 8, length 0
13:56:11.320705 82:4b:54:db:95:44 > 0e:2a:e2:9b:d4:ff, ethertype IPv4 (0x0800), length 54: 198.41.200.33.7844 > 10.42.0.16.40700: Flags [.], ack 1491, win 8, length 0
13:56:11.320911 82:4b:54:db:95:44 > 0e:2a:e2:9b:d4:ff, ethertype IPv4 (0x0800), length 54: 198.41.200.33.7844 > 10.42.0.16.40700: Flags [.], ack 1569, win 8, length 0
13:56:11.321132 82:4b:54:db:95:44 > 0e:2a:e2:9b:d4:ff, ethertype IPv4 (0x0800), length 54: 198.41.200.33.7844 > 10.42.0.16.40700: Flags [.], ack 1671, win 8, length 0
13:56:11.321240 82:4b:54:db:95:44 > 0e:2a:e2:9b:d4:ff, ethertype IPv4 (0x0800), length 54: 198.41.200.33.7844 > 10.42.0.16.40700: Flags [.], ack 1722, win 8, length 0
13:56:11.321334 82:4b:54:db:95:44 > 0e:2a:e2:9b:d4:ff, ethertype IPv4 (0x0800), length 96: 198.41.200.33.7844 > 10.42.0.16.40700: Flags [P.], seq 1314:1356, ack 1722, win 8, length 42
13:56:11.321341 82:4b:54:db:95:44 > 0e:2a:e2:9b:d4:ff, ethertype IPv4 (0x0800), length 85: 198.41.200.33.7844 > 10.42.0.16.40700: Flags [P.], seq 1356:1387, ack 1722, win 8, length 31
13:56:11.321369 82:4b:54:db:95:44 > 0e:2a:e2:9b:d4:ff, ethertype IPv4 (0x0800), length 54: 198.41.200.33.7844 > 10.42.0.16.40700: Flags [F.], seq 1387, ack 1722, win 8, length 0
13:56:11.321513 0e:2a:e2:9b:d4:ff > 82:4b:54:db:95:44, ethertype IPv4 (0x0800), length 54: 10.42.0.16.40700 > 198.41.200.33.7844: Flags [.], ack 1388, win 503, length 0
13:56:11.321605 0e:2a:e2:9b:d4:ff > 82:4b:54:db:95:44, ethertype IPv4 (0x0800), length 85: 10.42.0.16.40700 > 198.41.200.33.7844: Flags [P.], seq 1722:1753, ack 1388, win 503, length 31
13:56:11.321647 0e:2a:e2:9b:d4:ff > 82:4b:54:db:95:44, ethertype IPv4 (0x0800), length 54: 10.42.0.16.40700 > 198.41.200.33.7844: Flags [F.], seq 1753, ack 1388, win 503, length 0
13:56:11.323136 82:4b:54:db:95:44 > 0e:2a:e2:9b:d4:ff, ethertype IPv4 (0x0800), length 54: 198.41.200.33.7844 > 10.42.0.16.40700: Flags [R], seq 299001765, win 0, length 0
13:56:11.323230 82:4b:54:db:95:44 > 0e:2a:e2:9b:d4:ff, ethertype IPv4 (0x0800), length 54: 198.41.200.33.7844 > 10.42.0.16.40700: Flags [R], seq 299001765, win 0, length 0
```

</details>

**Comment by edwardchenchen** [comment]
> Something strange is happening. If possible, let's sniff the packets. In the host where the cloudflare pod is running, please run: 1 - `sudo tcpdump -eni cni0 host 198.41.200.33` 2 - `sudo tcpdump -eni ens4 host 198.41.200.33`
> 
> I would like to check how are packets egressing and whether there is a reply

<details>
  <summary>tcpdump -eni ens4 host 198.41.200.33</summary>

```
root@terraform-x86:~# tcpdump -eni ens4 host 198.41.200.33
tcpdump: verbose output suppressed, use -v or -vv for full protocol decode
listening on ens4, link-type EN10MB (Ethernet), capture size 262144 bytes
13:55:42.646605 42:01:0a:98:00:01 > 42:01:0a:98:00:26, ethertype IPv4 (0x0800), length 100: 198.41.200.33.7844 > 10.152.0.38.49635: Flags [P.], seq 299001251:299001297, ack 2722399869, win 8, length 46
13:55:42.647442 42:01:0a:98:00:26 > 42:01:0a:98:00:01, ethertype IPv4 (0x0800), length 100: 10.152.0.38.49635 > 198.41.200.33.7844: Flags [P.], seq 1:47, ack 46, win 503, length 46
13:55:42.648961 42:01:0a:98:00:01 > 42:01:0a:98:00:26, ethertype IPv4 (0x0800), length 54: 198.41.200.33.7844 > 10.152.0.38.49635: Flags [.], ack 47, win 8, length 0
13:55:47.649686 42:01:0a:98:00:01 > 42:01:0a:98:00:26, ethertype IPv4 (0x0800), length 100: 198.41.200.33.7844 > 10.152.0.38.49635: Flags [P.], seq 46:92, ack 47, win 8, length 46
13:55:47.650374 42:01:0a:98:00:26 > 42:01:0a:98:00:01, ethertype IPv4 (0x0800), length 100: 10.152.0.38.49635 > 198.41.200.33.7844: Flags [P.], seq 47:93, ack 92, win 503, length 46
13:55:47.651890 42:01:0a:98:00:01 > 42:01:0a:98:00:26, ethertype IPv4 (0x0800), length 54: 198.41.200.33.7844 > 10.152.0.38.49635: Flags [.], ack 93, win 8, length 0
13:55:52.652223 42:01:0a:98:00:01 > 42:01:0a:98:00:26, ethertype IPv4 (0x0800), length 100: 198.41.200.33.7844 > 10.152.0.38.49635: Flags [P.], seq 92:138, ack 93, win 8, length 46
13:55:52.652863 42:01:0a:98:00:26 > 42:01:0a:98:00:01, ethertype IPv4 (0x0800), length 100: 10.152.0.38.49635 > 198.41.200.33.7844: Flags [P.], seq 93:139, ack 138, win 503, length 46
13:55:52.654346 42:01:0a:98:00:01 > 42:01:0a:98:00:26, ethertype IPv4 (0x0800), length 54: 198.41.200.33.7844 > 10.152.0.38.49635: Flags [.], ack 139, win 8, length 0
13:55:57.655222 42:01:0a:98:00:01 > 42:01:0a:98:00:26, ethertype IPv4 (0x0800), length 100: 198.41.200.33.7844 > 10.152.0.38.49635: Flags [P.], seq 138:184, ack 139, win 8, length 46
13:55:57.655943 42:01:0a:98:00:26 > 42:01:0a:98:00:01, ethertype IPv4 (0x0800), length 100: 10.152.0.38.49635 > 198.41.200.33.7844: Flags [P.], seq 139:185, ack 184, win 503, length 46
13:55:57.657466 42:01:0a:98:00:01 > 42:01:0a:98:00:26, ethertype IPv4 (0x0800), length 54: 198.41.200.33.7844 > 10.152.0.38.49635: Flags [.], ack 185, win 8, length 0
13:56:02.657699 42:01:0a:98:00:01 > 42:01:0a:98:00:26, ethertype IPv4 (0x0800), length 100: 198.41.200.33.7844 > 10.152.0.38.49635: Flags [P.], seq 184:230, ack 185, win 8, length 46
13:56:02.658217 42:01:0a:98:00:26 > 42:01:0a:98:00:01, ethertype IPv4 (0x0800), length 100: 10.152.0.38.49635 > 198.41.200.33.7844: Flags [P.], seq 185:231, ack 230, win 503, length 46
13:56:02.659786 42:01:0a:98:00:01 > 42:01:0a:98:00:26, ethertype IPv4 (0x0800), length 54: 198.41.200.33.7844 > 10.152.0.38.49635: Flags [.], ack 231, win 8, length 0
13:56:07.660327 42:01:0a:98:00:01 > 42:01:0a:98:00:26, ethertype IPv4 (0x0800), length 100: 198.41.200.33.7844 > 10.152.0.38.49635: Flags [P.], seq 230:276, ack 231, win 8, length 46
13:56:07.660826 42:01:0a:98:00:26 > 42:01:0a:98:00:01, ethertype IPv4 (0x0800), length 100: 10.152.0.38.49635 > 198.41.200.33.7844: Flags [P.], seq 231:277, ack 276, win 503, length 46
13:56:07.662478 42:01:0a:98:00:01 > 42:01:0a:98:00:26, ethertype IPv4 (0x0800), length 54: 198.41.200.33.7844 > 10.152.0.38.49635: Flags [.], ack 277, win 8, length 0
13:56:10.540255 42:01:0a:98:00:26 > 42:01:0a:98:00:01, ethertype IPv4 (0x0800), length 212: 10.152.0.38.49635 > 198.41.200.33.7844: Flags [P.], seq 277:435, ack 276, win 503, length 158
13:56:10.541742 42:01:0a:98:00:01 > 42:01:0a:98:00:26, ethertype IPv4 (0x0800), length 54: 198.41.200.33.7844 > 10.152.0.38.49635: Flags [.], ack 435, win 8, length 0
13:56:10.542150 42:01:0a:98:00:01 > 42:01:0a:98:00:26, ethertype IPv4 (0x0800), length 100: 198.41.200.33.7844 > 10.152.0.38.49635: Flags [P.], seq 276:322, ack 435, win 8, length 46
13:56:10.542515 42:01:0a:98:00:26 > 42:01:0a:98:00:01, ethertype IPv4 (0x0800), length 100: 10.152.0.38.49635 > 198.41.200.33.7844: Flags [P.], seq 435:481, ack 322, win 503, length 46
13:56:10.544085 42:01:0a:98:00:01 > 42:01:0a:98:00:26, ethertype IPv4 (0x0800), length 54: 198.41.200.33.7844 > 10.152.0.38.49635: Flags [.], ack 481, win 8, length 0
13:56:11.318224 42:01:0a:98:00:01 > 42:01:0a:98:00:26, ethertype IPv4 (0x0800), length 172: 198.41.200.33.7844 > 10.152.0.38.49635: Flags [P.], seq 322:440, ack 481, win 8, length 118
13:56:11.319075 42:01:0a:98:00:26 > 42:01:0a:98:00:01, ethertype IPv4 (0x0800), length 96: 10.152.0.38.49635 > 198.41.200.33.7844: Flags [P.], seq 481:523, ack 440, win 503, length 42
13:56:11.319118 42:01:0a:98:00:26 > 42:01:0a:98:00:01, ethertype IPv4 (0x0800), length 148: 10.152.0.38.49635 > 198.41.200.33.7844: Flags [P.], seq 523:617, ack 440, win 503, length 94
13:56:11.319399 42:01:0a:98:00:26 > 42:01:0a:98:00:01, ethertype IPv4 (0x0800), length 132: 10.152.0.38.49635 > 198.41.200.33.7844: Flags [P.], seq 617:695, ack 440, win 503, length 78
13:56:11.319624 42:01:0a:98:00:26 > 42:01:0a:98:00:01, ethertype IPv4 (0x0800), length 156: 10.152.0.38.49635 > 198.41.200.33.7844: Flags [P.], seq 695:797, ack 440, win 503, length 102
13:56:11.319670 42:01:0a:98:00:26 > 42:01:0a:98:00:01, ethertype IPv4 (0x0800), length 105: 10.152.0.38.49635 > 198.41.200.33.7844: Flags [P.], seq 797:848, ack 440, win 503, length 51
13:56:11.320564 42:01:0a:98:00:01 > 42:01:0a:98:00:26, ethertype IPv4 (0x0800), length 54: 198.41.200.33.7844 > 10.152.0.38.49635: Flags [.], ack 523, win 8, length 0
13:56:11.320694 42:01:0a:98:00:01 > 42:01:0a:98:00:26, ethertype IPv4 (0x0800), length 54: 198.41.200.33.7844 > 10.152.0.38.49635: Flags [.], ack 617, win 8, length 0
13:56:11.320900 42:01:0a:98:00:01 > 42:01:0a:98:00:26, ethertype IPv4 (0x0800), length 54: 198.41.200.33.7844 > 10.152.0.38.49635: Flags [.], ack 695, win 8, length 0
13:56:11.321121 42:01:0a:98:00:01 > 42:01:0a:98:00:26, ethertype IPv4 (0x0800), length 54: 198.41.200.33.7844 > 10.152.0.38.49635: Flags [.], ack 797, win 8, length 0
13:56:11.321230 42:01:0a:98:00:01 > 42:01:0a:98:00:26, ethertype IPv4 (0x0800), length 54: 198.41.200.33.7844 > 10.152.0.38.49635: Flags [.], ack 848, win 8, length 0
13:56:11.321323 42:01:0a:98:00:01 > 42:01:0a:98:00:26, ethertype IPv4 (0x0800), length 96: 198.41.200.33.7844 > 10.152.0.38.49635: Flags [P.], seq 440:482, ack 848, win 8, length 42
13:56:11.321323 42:01:0a:98:00:01 > 42:01:0a:98:00:26, ethertype IPv4 (0x0800), length 85: 198.41.200.33.7844 > 10.152.0.38.49635: Flags [P.], seq 482:513, ack 848, win 8, length 31
13:56:11.321362 42:01:0a:98:00:01 > 42:01:0a:98:00:26, ethertype IPv4 (0x0800), length 54: 198.41.200.33.7844 > 10.152.0.38.49635: Flags [F.], seq 513, ack 848, win 8, length 0
13:56:11.321534 42:01:0a:98:00:26 > 42:01:0a:98:00:01, ethertype IPv4 (0x0800), length 54: 10.152.0.38.49635 > 198.41.200.33.7844: Flags [.], ack 514, win 503, length 0
13:56:11.321615 42:01:0a:98:00:26 > 42:01:0a:98:00:01, ethertype IPv4 (0x0800), length 85: 10.152.0.38.49635 > 198.41.200.33.7844: Flags [P.], seq 848:879, ack 514, win 503, length 31
13:56:11.321654 42:01:0a:98:00:26 > 42:01:0a:98:00:01, ethertype IPv4 (0x0800), length 54: 10.152.0.38.49635 > 198.41.200.33.7844: Flags [F.], seq 879, ack 514, win 503, length 0
13:56:11.323112 42:01:0a:98:00:01 > 42:01:0a:98:00:26, ethertype IPv4 (0x0800), length 54: 198.41.200.33.7844 > 10.152.0.38.49635: Flags [R], seq 299001765, win 0, length 0
13:56:11.323221 42:01:0a:98:00:01 > 42:01:0a:98:00:26, ethertype IPv4 (0x0800), length 54: 198.41.200.33.7844 > 10.152.0.38.49635: Flags [R], seq 299001765, win 0, length 0
```

</details>

**Comment by edwardchenchen** [comment]
> Something strange is happening. If possible, let's sniff the packets. In the host where the cloudflare pod is running, please run: 1 - `sudo tcpdump -eni cni0 host 198.41.200.33` 2 - `sudo tcpdump -eni ens4 host 198.41.200.33`
> 
> I would like to check how are packets egressing and whether there is a reply

Thanks for your time, I want to make sure we are investigating the current problem here,
I never had any problem with my cluster regarding **TCP** connections
I only have problem with **UDP** connection

**Comment by edwardchenchen** [comment]
> > > Something strange is happening. If possible, let's sniff the packets. In the host where the cloudflare pod is running, please run: 1 - `sudo tcpdump -eni cni0 host 198.41.200.33` 2 - `sudo tcpdump -eni ens4 host 198.41.200.33`
> > > I would like to check how are packets egressing and whether there is a reply
> > 
> > 
> > Thanks for your time, I want to make sure we are investigating the current problem here, I never had any problem with my cluster regarding **TCP** connections I only have problem with **UDP** connection
> 
> I suspect this is not a UDP problem but a problem with the tunneling protocol of cloudflare but I don't know why. In fact, if you see in the logs, the traffic your pod is sending is TCP because it has TCP flags. At some point, and for some reason, the server is sending an `FIN` flag and a `RESET`. Do you know how I could reproduce this in my lab? Do I need a cloudflare account?
> 
> Just to doublecheck that there is nothing wrong with UDP, could deploy a dummy pod that has the `dig` tool and do `dig www.google.com @8.8.8.8`? I normally use the image `wbitt/network-multitool` which contains, among others, `dig`. If you do tcpdump in `cni0` or `ens4` (adding -vv flag) while executing the dig command, you will see that it is sending and receiving UDP traffic

I also suspect this might be the Cloudflare tunnel issue now,
Let's stop the investigation for now, If I have other UDP problem I will post here

did some dig in a pod on the node
```
root@cloudflared-7b45f76bf6-j9gm4:/# dig www.google.com @8.8.8.8

; <<>> DiG 9.18.1-1ubuntu1.2-Ubuntu <<>> www.google.com @8.8.8.8
;; global options: +cmd
;; Got answer:
;; ->>HEADER<<- opcode: QUERY, status: NOERROR, id: 22174
;; flags: qr rd ra; QUERY: 1, ANSWER: 1, AUTHORITY: 0, ADDITIONAL: 1

;; OPT PSEUDOSECTION:
; EDNS: version: 0, flags:; udp: 512
;; QUESTION SECTION:
;www.google.com.                        IN      A

;; ANSWER SECTION:
www.google.com.         138     IN      A       172.217.167.100

;; Query time: 4 msec
;; SERVER: 8.8.8.8#53(8.8.8.8) (UDP)
;; WHEN: Fri Oct 14 14:37:37 UTC 2022
;; MSG SIZE  rcvd: 59
```

```
root@terraform-x86:/home/ubuntu# tcpdump -eni cni0 host 8.8.8.8 -vv
tcpdump: listening on cni0, link-type EN10MB (Ethernet), capture size 262144 bytes
14:34:46.602617 c6:65:a6:df:33:3a > 82:4b:54:db:95:44, ethertype IPv4 (0x0800), length 97: (tos 0x0, ttl 64, id 35346, offset 0, flags [none], proto UDP (17), length 83)
    10.42.0.72.33099 > 8.8.8.8.53: [bad udp cksum 0x1ad2 -> 0x3efa!] 52363+ [1au] A? www.google.com. ar: . OPT UDPsize=1232 (55)
14:34:46.699223 82:4b:54:db:95:44 > c6:65:a6:df:33:3a, ethertype IPv4 (0x0800), length 101: (tos 0x0, ttl 121, id 24941, offset 0, flags [none], proto UDP (17), length 87)
    8.8.8.8.53 > 10.42.0.72.33099: [udp sum ok] 52363 q: A? www.google.com. 1/0/1 www.google.com. A 172.217.167.100 ar: . OPT UDPsize=512 (59)
14:34:55.306943 c6:65:a6:df:33:3a > 82:4b:54:db:95:44, ethertype IPv4 (0x0800), length 97: (tos 0x0, ttl 64, id 64715, offset 0, flags [none], proto UDP (17), length 83)
    10.42.0.72.60392 > 8.8.8.8.53: [bad udp cksum 0x1ad2 -> 0x3a2c!] 24580+ [1au] A? www.google.com. ar: . OPT UDPsize=1232 (55)
14:34:55.403923 82:4b:54:db:95:44 > c6:65:a6:df:33:3a, ethertype IPv4 (0x0800), length 101: (tos 0x0, ttl 121, id 37605, offset 0, flags [none], proto UDP (17), length 87)
    8.8.8.8.53 > 10.42.0.72.60392: [udp sum ok] 24580 q: A? www.google.com. 1/0/1 www.google.com. A 172.217.167.100 ar: . OPT UDPsize=512 (59)
```
