### ISSUE TITLE
Pods seem to have issues connecting outside the cluster.

### ISSUE THREAD

**Issue by justSem** [k3s-io/k3s#6120]
**Environmental Info:**
K3s Version: 
`k3s version v1.24.4+k3s1 (c3f830e9)`
`go version go1.18.1`

Node(s) CPU architecture, OS, and Version: 
`Linux d001 5.15.0-46-generic #49-Ubuntu SMP Thu Aug 4 18:03:25 UTC 2022 x86_64 x86_64 x86_64 GNU/Linux`
`Ubuntu 20.04 x64`

**Cluster Configuration:**
I'm running a single-node k3s server on a Hetzner dedicated server.
This server is configured with Calico as CNI and Metallb as Load Balancer service.

Most of the configuration is default

**Describe the bug:**
Most of my services run through Traefik as Reverse proxy, all connections handled by Traefik work fine, however, a few of my services - 
for example Nextcloud have the ability to install 'packages' or 'apps'. Which basically has them connecting to the outside over https.
Most of my services seem unable to do so.

PCAPs I made (tcpdumping on the pods CNI interface from the host OS) revealed that the pod is sending out packets to said host but for some reason there's no response coming back for 90% of the times. Sometimes it does come back.

My feeling is that this is an MTU issue

**Steps To Reproduce:**

- Install K3S on Ubuntu 20.04 with Traefik, ServiceLB and Flannel disabled.
- Make sure you run iptables in `legacy` mode.
- Install Calico as CNI with the default Tigera Operator install, pod subnet `10.42.0.0/16` svc subnet `10.43.0.0/16`. Make sure VXLAN is set to `Always`.
- Install Metallb in Layer 2 mode, using the nodes external IP
- Set up Traefik + Cert-manager as Ingress.
- Install Nextcloud with their Helm chart, or just a simple `curl` instance.
```
kind: IPPool
metadata:
  name: default-ipv4-ippool
spec:
  allowedUses:
  - Workload
  - Tunnel
  blockSize: 26
  cidr: 10.42.0.0/16
  ipipMode: Never
  natOutgoing: true
  nodeSelector: all()
  vxlanMode: Always
``` 

```
kind: IPPool
metadata:
  creationTimestamp: "2022-08-28T22:21:33Z"
  name: default-ipv6-ippool
  resourceVersion: "2346"
  uid: 84b27b8d-6315-4356-b7f7-2ffef456ea5b
spec:
  allowedUses:
  - Workload
  - Tunnel
  blockSize: 122
  cidr: fd42::/48
  ipipMode: Never
  natOutgoing: true
  nodeSelector: all()
  vxlanMode: Never
``` 

**Expected behavior:**
Pods being able to make their own HTTPS requests outside the cluster.

**Actual behavior:**
Outside requests fail with this as the tcpdump output

_Container perspective_
`tcpdump -vvv -i calic5007db61ed`
`    10.42.201.217.33144 > nextcloud.com.http: Flags [S], cksum 0x69a6 (incorrect -> 0xe409), seq 633854232, win 65280, options [mss 1360,sackOK,TS val 2903952930 ecr 0,nop,wscale 7], length 0
20:01:39.889954 IP6 (flowlabel 0x10b35, hlim 64, next-header TCP (6) payload length: 40) fd42::c9ee:2303:c436:ab05:3526.39396 > web2.nextcloud.com.http: Flags [S], cksum 0xe91b (incorrect -> 0xe9ac), seq 1154201181, win 64320, options [mss 1340,sackOK,TS val 72343792 ecr 0,nop,wscale 7], length 0`

_Host perspective_ 
`tcpdump -i eno0 host 95.217.53.155 or host 2a01:4f9:2b:29dc::155`
20:02:54.534625 IP Ubuntu-2204-jammy-amd64-base.20704 > nextcloud.com.http: Flags [S], seq 2341221364, win 65280, options [mss 1360,sackOK,TS val 2904027767 ecr 0,nop,wscale 7], length 0

**Additional context / logs:**

_Application log:_
`GuzzleHttp\Exception\ConnectException: cURL error 28: Failed to connect to www.nextcloud.com port 80: Connection timed out (see https://curl.haxx.se/libcurl/c/libcurl-errors.html) for http://www.nextcloud.com/`

I'm getting the feeling this issue is MTU related - however, tuning the MTU back to 1450 or 1400 yields no results.
The host itself can curl to the site mentioned above just fine.

For context: I went with Calico because I couldn't get IPv6 working on Flannel for some reason.

I'm CKA certified, so I know a thing or two about vanilla k8s - this issue however, mystifies me as my 'vanilla' clusters - which also run Calico don't seem to have this issue.

**Comment by brandond** [comment]
> This server is configured with Calico as

Pod networking is the responsibility of Calico; I would probably check on your Calico deployment to confirm that you've got everything set up properly for operation on Hetzner. I know they do some interesting things with how they set up the public/private interfaces; Calico may need some additional configuration to select the correct one.

**Comment by justSem** [comment]
Yeah, I know this is probably Calico related. Unfortunately the server doesn't have an private interface, so that kind-of rules out faulty output selection.
I've had vanilla K8S running on Hetzner cloud instances before with Calico as well, that only required some minor tweaking to the MTU (because Hetzner uses openstack networking I believe - the default MTU is 1450). 

But even if it were selecting the wrong interface then I shouldn't observe a packet going out my default (eno1) interface as mentioned above.
So my feeling is the traffic is getting sent out in a 'funny' way causing the other end to drop it as possibly invalid traffic.

**Comment by brandond** [comment]
your packet capture has host/port resolution enabled, so I can't tell if the traffic in question is ipv4 or ipv6. Can you disable that with the `-n` flag when using tcpdump?

**Comment by justSem** [comment]
See the output below.
Here you can see it sometimes 'magically' works. And immediately after it just doesn't.

```
tcpdump: listening on eno1, link-type EN10MB (Ethernet), snapshot length 262144 bytes
22:12:28.765427 IP (tos 0x0, ttl 63, id 64239, offset 0, flags [DF], proto TCP (6), length 60)
    142.132.134.XX.52032 > 34.117.59.81.80: Flags [S], cksum 0x7294 (incorrect -> 0x34ea), seq 1702842287, win 64860, options [mss 1410,sackOK,TS val 3010293592 ecr 0,nop,wscale 7], length 0
22:12:28.770422 IP (tos 0x0, ttl 60, id 28152, offset 0, flags [none], proto TCP (6), length 60)
    34.117.59.81.80 > 142.132.134.XXX.52032: Flags [S.], cksum 0xb44f (correct), seq 2491108491, ack 1702842288, win 65535, options [mss 1430,sackOK,TS val 3146899768 ecr 3010293592,nop,wscale 8], length 0
22:12:28.770443 IP (tos 0x0, ttl 63, id 64240, offset 0, flags [DF], proto TCP (6), length 52)
    142.132.134.XXX.52032 > 34.117.59.81.80: Flags [.], cksum 0x728c (incorrect -> 0xe0fe), seq 1, ack 1, win 507, options [nop,nop,TS val 3010293597 ecr 3146899768], length 0
22:12:28.770499 IP (tos 0x0, ttl 63, id 64241, offset 0, flags [DF], proto TCP (6), length 125)
    142.132.134.XXX.52032 > 34.117.59.81.80: Flags [P.], cksum 0x72d5 (incorrect -> 0xd40d), seq 1:74, ack 1, win 507, options [nop,nop,TS val 3010293597 ecr 3146899768], length 73: HTTP, length: 73
        GET / HTTP/1.1
        Host: ipinfo.io
        User-Agent: curl/7.74.0
        Accept: */*

22:12:28.775387 IP (tos 0x0, ttl 60, id 28155, offset 0, flags [none], proto TCP (6), length 52)
    34.117.59.81.80 > 142.132.134.XXX.52032: Flags [.], cksum 0xe1ab (correct), seq 1, ack 74, win 256, options [nop,nop,TS val 3146899773 ecr 3010293597], length 0
22:12:28.889751 IP (tos 0x0, ttl 124, id 28189, offset 0, flags [none], proto TCP (6), length 791)
    34.117.59.81.80 > 142.132.134.XXX.52032: Flags [P.], cksum 0x368f (correct), seq 1:740, ack 74, win 256, options [nop,nop,TS val 3146899887 ecr 3010293597], length 739: HTTP, length: 739
        HTTP/1.1 200 OK
        access-control-allow-origin: *
        x-frame-options: SAMEORIGIN
        x-xss-protection: 1; mode=block
        x-content-type-options: nosniff
        referrer-policy: strict-origin-when-cross-origin
        content-type: application/json; charset=utf-8
        content-length: 301
        date: Mon, 12 Sep 2022 20:12:28 GMT
        x-envoy-upstream-service-time: 2
        strict-transport-security: max-age=2592000; includeSubDomains
        vary: Accept-Encoding
        Via: 1.1 google

        {
          "ip": "142.132.134.XXX",
          "hostname": "READCTED",
          "city": "Falkenstein",
          "region": "Saxony",
          "country": "DE",
          "loc": "50.4779,12.3713",
          "org": "AS24940 Hetzner Online GmbH",
          "postal": "08223",
          "timezone": "Europe/Berlin",
          "readme": "https://ipinfo.io/missingauth"
        } [|http]
22:12:28.889834 IP (tos 0x0, ttl 63, id 64242, offset 0, flags [DF], proto TCP (6), length 52)
    142.132.134.XXX.52032 > 34.117.59.81.80: Flags [.], cksum 0x728c (incorrect -> 0xdce9), seq 74, ack 740, win 502, options [nop,nop,TS val 3010293716 ecr 3146899887], length 0
22:12:28.890094 IP (tos 0x0, ttl 63, id 64243, offset 0, flags [DF], proto TCP (6), length 52)
    142.132.134XXX.52032 > 34.117.59.81.80: Flags [F.], cksum 0x728c (incorrect -> 0xdce7), seq 74, ack 740, win 502, options [nop,nop,TS val 3010293717 ecr 3146899887], length 0
22:12:28.895104 IP (tos 0x0, ttl 124, id 28191, offset 0, flags [none], proto TCP (6), length 52)
    34.117.59.81.80 > 142.132.134.XXX.52032: Flags [F.], cksum 0xddd6 (correct), seq 740, ack 75, win 256, options [nop,nop,TS val 3146899893 ecr 3010293717], length 0
22:12:28.895170 IP (tos 0x0, ttl 63, id 64244, offset 0, flags [DF], proto TCP (6), length 52)
    142.132.134.XXX.52032 > 34.117.59.81.80: Flags [.], cksum 0x728c (incorrect -> 0xdcdb), seq 75, ack 741, win 502, options [nop,nop,TS val 3010293722 ecr 3146899893], length 0
22:12:32.001602 IP (tos 0x0, ttl 63, id 47596, offset 0, flags [DF], proto TCP (6), length 60)
    142.132.134.XXX.19575 > 34.117.59.81.80: Flags [S], cksum 0x7294 (incorrect -> 0xfbc4), seq 1904930542, win 64860, options [mss 1410,sackOK,TS val 3010296828 ecr 0,nop,wscale 7], length 0
22:12:33.017796 IP (tos 0x0, ttl 63, id 47597, offset 0, flags [DF], proto TCP (6), length 60)
    142.132.134.XX.19575 > 34.117.59.81.80: Flags [S], cksum 0x7294 (incorrect -> 0xf7cc), seq 1904930542, win 64860, options [mss 1410,sackOK,TS val 3010297844 ecr 0,nop,wscale 7], length 0
22:12:35.033767 IP (tos 0x0, ttl 63, id 47598, offset 0, flags [DF], proto TCP (6), length 60)
    142.132.134.XXX.19575 > 34.117.59.81.80: Flags [S], cksum 0x7294 (incorrect -> 0xefec), seq 1904930542, win 64860, options [mss 1410,sackOK,TS val 3010299860 ecr 0,nop,wscale 7], length 0
22:12:39.293786 IP (tos 0x0, ttl 63, id 47599, offset 0, flags [DF], proto TCP (6), length 60)
    142.132.134.XX.19575 > 34.117.59.81.80: Flags [S], cksum 0x7294 (incorrect -> 0xdf48), seq 1904930542, win 64860, options [mss 1410,sackOK,TS val 3010304120 ecr 0,nop,wscale 7], length 0

14 packets captured
14 packets received by filter
0 packets dropped by kernel
```

**Comment by brandond** [comment]
that kind of sounds like either broken connection tracking, something that's blocking traffic to/from certain ports, or perhaps just classic broken IP checksum offload on the vxlan interface.
