### ISSUE TITLE
Pods unable to reach kube-apiserver on same node

### ISSUE THREAD

**Issue by sha256chiku** [k3s-io/k3s#13721]
**Environmental Info:**
K3s Version: 

```
k3s version v1.35.0+k3s1 (a6c6cd15)
go version go1.25.5
```

<details>

  <summary>K3s Config-check</summary>

```
Verifying binaries in /var/lib/rancher/k3s/data/d2fa5a6eb1a2c19eafcd094e4e1f519ae9583dc94d11e647c873f16c400d6292/bin:
- sha256sum: good
- links: good

System:
- /usr/sbin iptables v1.8.11 (nf_tables): ok
- swap: disabled
- routes: default CIDRs 10.42.0.0/16 or 10.43.0.0/16 already routed <---- I guess because k3s is already running?

Limits:
- /proc/sys/kernel/keys/root_maxkeys: 1000000

modprobe: FATAL: Module configs not found in directory /lib/modules/6.12.63+deb13-amd64
info: reading kernel config from /boot/config-6.12.63+deb13-amd64 ...

Generally Necessary:
- cgroup hierarchy: cgroups V2 mounted, cpu|cpuset|memory controllers status: good
- /usr/sbin/apparmor_parser
apparmor: enabled and tools installed
- CONFIG_NAMESPACES: enabled
- CONFIG_NET_NS: enabled
- CONFIG_PID_NS: enabled
- CONFIG_IPC_NS: enabled
- CONFIG_UTS_NS: enabled
- CONFIG_CGROUPS: enabled
- CONFIG_CGROUP_PIDS: enabled
- CONFIG_CGROUP_CPUACCT: enabled
- CONFIG_CGROUP_DEVICE: enabled
- CONFIG_CGROUP_FREEZER: enabled
- CONFIG_CGROUP_SCHED: enabled
- CONFIG_CPUSETS: enabled
- CONFIG_MEMCG: enabled
- CONFIG_SECCOMP: enabled
- CONFIG_KEYS: enabled
- CONFIG_VETH: enabled (as module)
- CONFIG_BRIDGE: enabled (as module)
- CONFIG_BRIDGE_NETFILTER: enabled (as module)
- CONFIG_IP_NF_FILTER: enabled (as module)
- CONFIG_IP_NF_TARGET_MASQUERADE: enabled (as module)
- CONFIG_IP_NF_TARGET_REJECT: enabled (as module)
- CONFIG_NETFILTER_XT_MATCH_ADDRTYPE: enabled (as module)
- CONFIG_NETFILTER_XT_MATCH_CONNTRACK: enabled (as module)
- CONFIG_NETFILTER_XT_MATCH_IPVS: enabled (as module)
- CONFIG_NETFILTER_XT_MATCH_COMMENT: enabled (as module)
- CONFIG_NETFILTER_XT_MATCH_MULTIPORT: enabled (as module)
- CONFIG_NETFILTER_XT_MATCH_STATISTIC: enabled (as module)
- CONFIG_IP_NF_NAT: enabled (as module)
- CONFIG_NF_NAT: enabled (as module)
- CONFIG_POSIX_MQUEUE: enabled

Optional Features:
- CONFIG_USER_NS: enabled
- CONFIG_BLK_CGROUP: enabled
- CONFIG_BLK_DEV_THROTTLING: enabled
- CONFIG_CGROUP_PERF: enabled
- CONFIG_CGROUP_HUGETLB: enabled
- CONFIG_NET_CLS_CGROUP: enabled (as module)
- CONFIG_CGROUP_NET_PRIO: enabled
- CONFIG_CFS_BANDWIDTH: enabled
- CONFIG_FAIR_GROUP_SCHED: enabled
- CONFIG_RT_GROUP_SCHED: missing
- CONFIG_IP_NF_TARGET_REDIRECT: enabled (as module)
- CONFIG_IP_SET: enabled (as module)
- CONFIG_IP_VS: enabled (as module)
- CONFIG_IP_VS_NFCT: enabled
- CONFIG_IP_VS_PROTO_TCP: enabled
- CONFIG_IP_VS_PROTO_UDP: enabled
- CONFIG_IP_VS_RR: enabled (as module)
- CONFIG_EXT4_FS: enabled (as module)
- CONFIG_EXT4_FS_POSIX_ACL: enabled
- CONFIG_EXT4_FS_SECURITY: enabled
- Network Drivers:
  - "overlay":
    - CONFIG_VXLAN: enabled (as module)
      Optional (for encrypted networks):
      - CONFIG_CRYPTO: enabled
      - CONFIG_CRYPTO_AEAD: enabled (as module)
      - CONFIG_CRYPTO_GCM: enabled (as module)
      - CONFIG_CRYPTO_SEQIV: enabled (as module)
      - CONFIG_CRYPTO_GHASH: enabled (as module)
      - CONFIG_XFRM: enabled
      - CONFIG_XFRM_USER: enabled (as module)
      - CONFIG_XFRM_ALGO: enabled (as module)
      - CONFIG_INET_ESP: enabled (as module)
      - CONFIG_INET_XFRM_MODE_TRANSPORT: missing
- Storage Drivers:
  - "overlay":
    - CONFIG_OVERLAY_FS: enabled (as module)

STATUS: pass
```

</details>

Node(s) CPU architecture, OS, and Version: 

```
Linux k3s-server01 6.12.41+deb13-amd64 #1 SMP PREEMPT_DYNAMIC Debian 6.12.41-1 (2025-08-12) x86_64 GNU/Linux
Linux k3s-agent01 6.12.48+deb13-amd64 #1 SMP PREEMPT_DYNAMIC Debian 6.12.48-1 (2025-09-20) x86_64 GNU/Linux
Linux k3s-agent02 6.12.63+deb13-amd64 #1 SMP PREEMPT_DYNAMIC Debian 6.12.63-1 (2025-12-30) x86_64 GNU/Linux
```

Cluster Configuration:

- 3 server cluster even though hostnames above suggest something different
- Each node is a VM on Proxmox
- On every node there are two interfaces and I configured k3s to only (mostly) use the second interface called `service-vip`

**Describe the bug:**

Pods cannot reach the kube-apiserver on `10.43.0.1` about every third call causing an i/o timeout. This is because k3s sets up loadbalancing when masquerading traffic to the kube-apiserver. Every time an i/o timeout occurs the node the pod is currently running on gets selected for handling the request. Using the IP of the `service-vip` inside the pod to connect to the kube-apiserver results in the same i/o timeout. `tcpdump` shows the `SYN` on `cni0` interface but there is never an `ACK`.

**Steps To Reproduce:**

- Installed K3s: k3s-io/k3s-ansible
- Extra config in `config.yaml` and `config.yaml.d`
```yaml
write-kubeconfig-mode: "0644"
write-kubeconfig-group: k3s-admins
servicelb-namespace: servicelb
bind-address: <IP on service-vip>
flannel-iface: service-vip
flannel-backend: host-gw
node-ip: <IP on service-vip>

# Extra TLS
tls-san+:
  - <IP on service-vip>
  - <DNS record for service-vip IP>
```
- Run `kubectl run --rm -it --image busybox test` and inside try hitting the kube-apiserver `wget -O - -S https://10.43.0.1:443`

**Expected behavior:**

Pods can connect to the kube-apiserver present on the node they are scheduled on.

**Actual behavior:**
Pods send out their connection request to the kube-apiserver present on the node they are scheduled on but the connection never gets accepted.

**Additional context / logs:**

There is probably something in my environment which I did not account for in my config but I have been at a loss for days what it could be. `firewalld` is disabled and not running.

ChatGPT suggested setting the sysctl `net.ipv4.conf.{all,default}.rp_filter=0` but it did not help.

I did take a look at #10010 but if I am not mistaking the iptables kernel modules are loaded.

<details>

<summary>Successful tcpdump</summary>

The Pod with IP `10.42.2.5` hits a kube-apiserver not on its scheduled node.

```
# tcpdump -i any tcp dst port 6443 | grep --line-buffered 10.42.2.5
12:24:43.115575 cni0  In  IP 10.42.2.5.33266 > 192.168.192.153.6443: Flags [S], seq 747479255, win 64240, options [mss 1460,sackOK,TS val 2328267192 ecr 0,nop,wscale 7], length 0
12:24:43.115874 cni0  In  IP 10.42.2.5.33266 > 192.168.192.153.6443: Flags [.], ack 4085291945, win 502, options [nop,nop,TS val 2328267192 ecr 2852989711], length 0
12:24:43.116251 cni0  In  IP 10.42.2.5.33266 > 192.168.192.153.6443: Flags [P.], seq 0:106, ack 1, win 502, options [nop,nop,TS val 2328267192 ecr 2852989711], length 106
12:24:43.116630 cni0  In  IP 10.42.2.5.33266 > 192.168.192.153.6443: Flags [.], ack 1468, win 491, options [nop,nop,TS val 2328267193 ecr 2852989712], length 0
12:24:43.116706 cni0  In  IP 10.42.2.5.33266 > 192.168.192.153.6443: Flags [P.], seq 106:118, ack 1468, win 491, options [nop,nop,TS val 2328267193 ecr 2852989712], length 12
12:24:43.157143 cni0  In  IP 10.42.2.5.33266 > 192.168.192.153.6443: Flags [P.], seq 118:244, ack 1468, win 491, options [nop,nop,TS val 2328267233 ecr 2852989753], length 126
12:24:43.157741 cni0  In  IP 10.42.2.5.33266 > 192.168.192.153.6443: Flags [P.], seq 244:349, ack 1519, win 491, options [nop,nop,TS val 2328267234 ecr 2852989753], length 105
12:24:43.158233 cni0  In  IP 10.42.2.5.33266 > 192.168.192.153.6443: Flags [.], ack 1957, win 488, options [nop,nop,TS val 2328267234 ecr 2852989754], length 0
12:24:43.158442 cni0  In  IP 10.42.2.5.33266 > 192.168.192.153.6443: Flags [F.], seq 349, ack 1957, win 488, options [nop,nop,TS val 2328267234 ecr 2852989754], length 0
```

</details>

<details>

<summary>Failing tcpdump</summary>

The Pod with IP `10.42.2.5` hits the kube-apiserver on its scheduled node.

```
# tcpdump -i any tcp dst port 6443 | grep --line-buffered 10.42.2.5
12:28:23.649647 cni0  In  IP 10.42.2.5.41382 > service-vip.6443: Flags [S], seq 2396742969, win 64240, options [mss 1460,sackOK,TS val 2328487726 ecr 0,nop,wscale 7], length 0
12:28:24.670709 cni0  In  IP 10.42.2.5.41382 > service-vip.6443: Flags [S], seq 2396742969, win 64240, options [mss 1460,sackOK,TS val 2328488747 ecr 0,nop,wscale 7], length 0
12:28:25.694583 cni0  In  IP 10.42.2.5.41382 > service-vip.6443: Flags [S], seq 2396742969, win 64240, options [mss 1460,sackOK,TS val 2328489771 ecr 0,nop,wscale 7], length 0
12:28:26.718627 cni0  In  IP 10.42.2.5.41382 > service-vip.6443: Flags [S], seq 2396742969, win 64240, options [mss 1460,sackOK,TS val 2328490795 ecr 0,nop,wscale 7], length 0
12:28:27.742614 cni0  In  IP 10.42.2.5.41382 > service-vip.6443: Flags [S], seq 2396742969, win 64240, options [mss 1460,sackOK,TS val 2328491819 ecr 0,nop,wscale 7], length 0
12:28:28.766615 cni0  In  IP 10.42.2.5.41382 > service-vip.6443: Flags [S], seq 2396742969, win 64240, options [mss 1460,sackOK,TS val 2328492843 ecr 0,nop,wscale 7], length 0
12:28:30.782604 cni0  In  IP 10.42.2.5.41382 > service-vip.6443: Flags [S], seq 2396742969, win 64240, options [mss 1460,sackOK,TS val 2328494859 ecr 0,nop,wscale 7], length 0
12:28:34.974628 cni0  In  IP 10.42.2.5.41382 > service-vip.6443: Flags [S], seq 2396742969, win 64240, options [mss 1460,sackOK,TS val 2328499051 ecr 0,nop,wscale 7], length 0
12:28:43.166602 cni0  In  IP 10.42.2.5.41382 > service-vip.6443: Flags [S], seq 2396742969, win 64240, options [mss 1460,sackOK,TS val 2328507243 ecr 0,nop,wscale 7], length 0
```

</details>

**Comment by sha256chiku** [comment]
Some startup logs which I could not attach to the original message maybe they reveal something oblivious to me ...

<details>

<summary>Logs</summary>

```
Mar 03 12:38:59 k3s-agent01 k3s[1176712]: time="2026-03-03T12:38:59+01:00" level=info msg="Starting k3s v1.35.0+k3s1 (a6c6cd15)"
Mar 03 12:38:59 k3s-agent01 k3s[1176712]: time="2026-03-03T12:38:59+01:00" level=info msg="Managed etcd cluster bootstrap already complete and initialized"
Mar 03 12:38:59 k3s-agent01 k3s[1176712]: time="2026-03-03T12:38:59+01:00" level=info msg="Reconciling bootstrap data between datastore and disk"
Mar 03 12:38:59 k3s-agent01 k3s[1176712]: time="2026-03-03T12:38:59+01:00" level=info msg="Successfully reconciled with remote datastore"
Mar 03 12:39:00 k3s-agent01 k3s[1176712]: time="2026-03-03T12:39:00+01:00" level=info msg="Password verified locally for node k3s-agent01"
Mar 03 12:39:00 k3s-agent01 k3s[1176712]: time="2026-03-03T12:39:00+01:00" level=info msg="certificate CN=k3s-agent01 signed by CN=k3s-server-ca@1772536208: notBefore=2026-03-03 11:10:08 +0000 UTC notAfter=2027-03-03 11:39:00 +0000 UTC"
Mar 03 12:39:00 k3s-agent01 k3s[1176712]: time="2026-03-03T12:39:00+01:00" level=info msg="certificate CN=system:node:k3s-agent01,O=system:nodes signed by CN=k3s-client-ca@1772536208: notBefore=2026-03-03 11:10:08 +0000 UTC notAfter=2027-03-03 11:39:00 +0000 UTC"
Mar 03 12:39:00 k3s-agent01 k3s[1176712]: time="2026-03-03T12:39:00+01:00" level=info msg="certificate CN=system:kube-proxy signed by CN=k3s-client-ca@1772536208: notBefore=2026-03-03 11:10:08 +0000 UTC notAfter=2027-03-03 11:39:00 +0000 UTC"
Mar 03 12:39:00 k3s-agent01 k3s[1176712]: time="2026-03-03T12:39:00+01:00" level=info msg="certificate CN=system:k3s-controller signed by CN=k3s-client-ca@1772536208: notBefore=2026-03-03 11:10:08 +0000 UTC notAfter=2027-03-03 11:39:00 +0000 UTC"
Mar 03 12:39:00 k3s-agent01 k3s[1176712]: time="2026-03-03T12:39:00+01:00" level=info msg="Module overlay was already loaded"
Mar 03 12:39:00 k3s-agent01 k3s[1176712]: time="2026-03-03T12:39:00+01:00" level=info msg="Module nf_conntrack was already loaded"
Mar 03 12:39:00 k3s-agent01 k3s[1176712]: time="2026-03-03T12:39:00+01:00" level=info msg="Module br_netfilter was already loaded"
Mar 03 12:39:00 k3s-agent01 k3s[1176712]: time="2026-03-03T12:39:00+01:00" level=info msg="Module iptable_nat was already loaded"
Mar 03 12:39:00 k3s-agent01 k3s[1176712]: time="2026-03-03T12:39:00+01:00" level=info msg="Module iptable_filter was already loaded"
Mar 03 12:39:00 k3s-agent01 k3s[1176712]: time="2026-03-03T12:39:00+01:00" level=warning msg="Failed to load kernel module nft-expr-counter with modprobe"
Mar 03 12:39:00 k3s-agent01 k3s[1176712]: time="2026-03-03T12:39:00+01:00" level=info msg="Logging containerd to /var/lib/rancher/k3s/agent/containerd/containerd.log"
Mar 03 12:39:00 k3s-agent01 k3s[1176712]: time="2026-03-03T12:39:00+01:00" level=info msg="Running containerd -c /var/lib/rancher/k3s/agent/etc/containerd/config.toml"
Mar 03 12:39:00 k3s-agent01 k3s[1176712]: time="2026-03-03T12:39:00+01:00" level=info msg="Connecting to proxy" url="wss://192.168.192.53:6443/v1-k3s/connect"
Mar 03 12:39:00 k3s-agent01 k3s[1176712]: time="2026-03-03T12:39:00+01:00" level=info msg="Creating k3s-cert-monitor event broadcaster"
Mar 03 12:39:00 k3s-agent01 k3s[1176712]: time="2026-03-03T12:39:00+01:00" level=info msg=start
Mar 03 12:39:00 k3s-agent01 k3s[1176712]: time="2026-03-03T12:39:00+01:00" level=info msg="schedule, now=2026-03-03T12:39:00+01:00, entry=1, next=2026-03-04T00:00:00+01:00"
Mar 03 12:39:00 k3s-agent01 k3s[1176712]: time="2026-03-03T12:39:00+01:00" level=info msg="Starting etcd for existing cluster member"
Mar 03 12:39:00 k3s-agent01 k3s[1176712]: time="2026-03-03T12:39:00+01:00" level=error msg="Failed to check local etcd status for learner management: rpc error: code = Unavailable desc = connection error: desc = \"transport: Error while dialing: dial tcp 127.0.0.1:2379: connect: connection refused\""
Mar 03 12:39:00 k3s-agent01 k3s[1176712]: time="2026-03-03T12:39:00+01:00" level=info msg="Failed to test etcd connection: failed to get etcd status: rpc error: code = Unavailable desc = connection error: desc = \"transport: Error while dialing: dial tcp 127.0.0.1:2379: connect: connection refused\""
Mar 03 12:39:00 k3s-agent01 k3s[1176712]: time="2026-03-03T12:39:00+01:00" level=info msg="Polling for API server readiness: GET /readyz failed: the server is currently unable to handle the request"
Mar 03 12:39:00 k3s-agent01 k3s[1176712]: time="2026-03-03T12:39:00+01:00" level=info msg="Handling backend connection request [k3s-agent01]"
Mar 03 12:39:00 k3s-agent01 k3s[1176712]: time="2026-03-03T12:39:00+01:00" level=info msg="Connected to proxy" url="wss://192.168.192.53:6443/v1-k3s/connect"
Mar 03 12:39:00 k3s-agent01 k3s[1176712]: time="2026-03-03T12:39:00+01:00" level=info msg="Remotedialer connected to proxy" url="wss://192.168.192.53:6443/v1-k3s/connect"
Mar 03 12:39:00 k3s-agent01 k3s[1176712]: {"level":"info","ts":"2026-03-03T12:39:00.789724+0100","caller":"embed/etcd.go:132","msg":"configuring socket options","reuse-address":true,"reuse-port":true}
Mar 03 12:39:00 k3s-agent01 k3s[1176712]: {"level":"info","ts":"2026-03-03T12:39:00.789773+0100","caller":"embed/etcd.go:138","msg":"configuring peer listeners","listen-peer-urls":["https://127.0.0.1:2380","https://192.168.192.53:2380"]}
Mar 03 12:39:00 k3s-agent01 k3s[1176712]: {"level":"info","ts":"2026-03-03T12:39:00.789789+0100","caller":"embed/etcd.go:544","msg":"starting with peer TLS","tls-info":"cert = /var/lib/rancher/k3s/server/tls/etcd/peer-server-client.crt, key = /var/lib/rancher/k3s/server/tls/etcd/peer-server-client.key, client-cert=, client-key=, trusted-ca = /var/lib/rancher/k3s/server/tls/etcd/peer-ca.crt, client-cert-auth = true, crl-file = ","cipher-suites":[]}
Mar 03 12:39:00 k3s-agent01 k3s[1176712]: {"level":"info","ts":"2026-03-03T12:39:00.790151+0100","caller":"embed/etcd.go:146","msg":"configuring client listeners","listen-client-urls":["https://127.0.0.1:2379","https://192.168.192.53:2379"]}
Mar 03 12:39:00 k3s-agent01 k3s[1176712]: {"level":"info","ts":"2026-03-03T12:39:00.790289+0100","caller":"embed/etcd.go:323","msg":"starting an etcd server","etcd-version":"3.6.6","git-sha":"HEAD","go-version":"go1.25.5","go-os":"linux","go-arch":"amd64","max-cpu-set":16,"max-cpu-available":16,"member-initialized":true,"name":"k3s-agent01-f1584fc4","data-dir":"/var/lib/rancher/k3s/server/db/etcd","wal-dir":"","wal-dir-dedicated":"","member-dir":"/var/lib/rancher/k3s/server/db/etcd/member","force-new-cluster":false,"heartbeat-interval":"500ms","election-timeout":"5s","initial-election-tick-advance":true,"snapshot-count":10000,"max-wals":5,"max-snapshots":5,"snapshot-catchup-entries":5000,"initial-advertise-peer-urls":["http://localhost:2380"],"listen-peer-urls":["https://127.0.0.1:2380","https://192.168.192.53:2380"],"advertise-client-urls":["https://192.168.192.53:2379"],"listen-client-urls":["https://127.0.0.1:2379","https://192.168.192.53:2379"],"listen-metrics-urls":["http://127.0.0.1:2381"],"experimental-local-address":"","cors":["*"],"host-whitelist":["*"],"initial-cluster":"","initial-cluster-state":"new","initial-cluster-token":"","quota-backend-bytes":2147483648,"max-request-bytes":1572864,"max-concurrent-streams":4294967295,"pre-vote":true,"feature-gates":"InitialCorruptCheck=true","initial-corrupt-check":false,"corrupt-check-time-interval":"0s","compact-check-time-interval":"1m0s","auto-compaction-mode":"periodic","auto-compaction-retention":"0s","auto-compaction-interval":"0s","discovery-url":"","discovery-proxy":"","discovery-token":"","discovery-endpoints":"","discovery-dial-timeout":"2s","discovery-request-timeout":"5s","discovery-keepalive-time":"2s","discovery-keepalive-timeout":"6s","discovery-insecure-transport":true,"discovery-insecure-skip-tls-verify":false,"discovery-cert":"","discovery-key":"","discovery-cacert":"","discovery-user":"","downgrade-check-interval":"5s","max-learners":1,"v2-deprecation":"write-only"}
Mar 03 12:39:00 k3s-agent01 k3s[1176712]: {"level":"info","ts":"2026-03-03T12:39:00.790662+0100","logger":"bbolt","caller":"backend/backend.go:203","msg":"Opening db file (/var/lib/rancher/k3s/server/db/etcd/member/snap/db) with mode -rw------- and with options: {Timeout: 0s, NoGrowSync: false, NoFreelistSync: true, PreLoadFreelist: false, FreelistType: hashmap, ReadOnly: false, MmapFlags: 8000, InitialMmapSize: 10737418240, PageSize: 0, NoSync: false, OpenFile: 0x0, Mlock: false, Logger: 0xc0000cb500}"}
Mar 03 12:39:00 k3s-agent01 k3s[1176712]: {"level":"info","ts":"2026-03-03T12:39:00.795181+0100","logger":"bbolt","caller":"bbolt@v1.4.3/db.go:322","msg":"Opening bbolt db (/var/lib/rancher/k3s/server/db/etcd/member/snap/db) successfully"}
Mar 03 12:39:00 k3s-agent01 k3s[1176712]: {"level":"info","ts":"2026-03-03T12:39:00.795249+0100","caller":"storage/backend.go:80","msg":"opened backend db","path":"/var/lib/rancher/k3s/server/db/etcd/member/snap/db","took":"4.65323ms"}
Mar 03 12:39:00 k3s-agent01 k3s[1176712]: {"level":"info","ts":"2026-03-03T12:39:00.795280+0100","caller":"etcdserver/bootstrap.go:220","msg":"restore consistentIndex","index":8417}
Mar 03 12:39:00 k3s-agent01 k3s[1176712]: {"level":"info","ts":"2026-03-03T12:39:00.812795+0100","caller":"etcdserver/bootstrap.go:413","msg":"recovered v2 store from snapshot","snapshot-index":762,"snapshot-size":"8.7 kB"}
Mar 03 12:39:00 k3s-agent01 k3s[1176712]: {"level":"info","ts":"2026-03-03T12:39:00.812883+0100","caller":"storage/backend.go:108","msg":"Skipping snapshot backend","consistent-index":8417,"snapshot-index":762}
Mar 03 12:39:00 k3s-agent01 k3s[1176712]: {"level":"info","ts":"2026-03-03T12:39:00.812905+0100","caller":"etcdserver/bootstrap.go:232","msg":"recovered v3 backend","backend-size-bytes":8634368,"backend-size":"8.6 MB","backend-size-in-use-bytes":4202496,"backend-size-in-use":"4.2 MB"}
Mar 03 12:39:00 k3s-agent01 k3s[1176712]: {"level":"info","ts":"2026-03-03T12:39:00.812992+0100","caller":"etcdserver/bootstrap.go:90","msg":"Bootstrapping WAL from snapshot"}
Mar 03 12:39:00 k3s-agent01 k3s[1176712]: {"level":"info","ts":"2026-03-03T12:39:00.834632+0100","caller":"etcdserver/bootstrap.go:599","msg":"restarting local member","cluster-id":"4b7efcc6c72a43ba","local-member-id":"faccf952ee064646","commit-index":8417}
Mar 03 12:39:00 k3s-agent01 k3s[1176712]: {"level":"info","ts":"2026-03-03T12:39:00.834710+0100","caller":"etcdserver/bootstrap.go:94","msg":"bootstrapping cluster"}
Mar 03 12:39:00 k3s-agent01 k3s[1176712]: {"level":"info","ts":"2026-03-03T12:39:00.834820+0100","caller":"etcdserver/bootstrap.go:101","msg":"bootstrapping storage"}
Mar 03 12:39:00 k3s-agent01 k3s[1176712]: {"level":"info","ts":"2026-03-03T12:39:00.835041+0100","caller":"api/capability.go:76","msg":"enabled capabilities for version","cluster-version":"3.6"}
Mar 03 12:39:00 k3s-agent01 k3s[1176712]: {"level":"info","ts":"2026-03-03T12:39:00.835224+0100","caller":"membership/cluster.go:297","msg":"recovered/added member from store","cluster-id":"4b7efcc6c72a43ba","local-member-id":"faccf952ee064646","recovered-remote-peer-id":"60198d7fe2a05aa2","recovered-remote-peer-urls":["https://192.168.192.74:2380"],"recovered-remote-peer-is-learner":false}
Mar 03 12:39:00 k3s-agent01 k3s[1176712]: {"level":"info","ts":"2026-03-03T12:39:00.835283+0100","caller":"membership/cluster.go:297","msg":"recovered/added member from store","cluster-id":"4b7efcc6c72a43ba","local-member-id":"faccf952ee064646","recovered-remote-peer-id":"63933e0f56fda0cd","recovered-remote-peer-urls":["https://192.168.192.153:2380"],"recovered-remote-peer-is-learner":false}
Mar 03 12:39:00 k3s-agent01 k3s[1176712]: {"level":"info","ts":"2026-03-03T12:39:00.835329+0100","caller":"membership/cluster.go:297","msg":"recovered/added member from store","cluster-id":"4b7efcc6c72a43ba","local-member-id":"faccf952ee064646","recovered-remote-peer-id":"faccf952ee064646","recovered-remote-peer-urls":["https://192.168.192.53:2380"],"recovered-remote-peer-is-learner":false}
Mar 03 12:39:00 k3s-agent01 k3s[1176712]: {"level":"info","ts":"2026-03-03T12:39:00.835374+0100","caller":"membership/cluster.go:307","msg":"set cluster version from store","cluster-version":"3.6"}
Mar 03 12:39:00 k3s-agent01 k3s[1176712]: {"level":"info","ts":"2026-03-03T12:39:00.835424+0100","caller":"etcdserver/bootstrap.go:109","msg":"bootstrapping raft"}
Mar 03 12:39:00 k3s-agent01 k3s[1176712]: {"level":"info","ts":"2026-03-03T12:39:00.835501+0100","caller":"etcdserver/server.go:312","msg":"bootstrap successfully"}
Mar 03 12:39:00 k3s-agent01 k3s[1176712]: {"level":"info","ts":"2026-03-03T12:39:00.835586+0100","logger":"raft","caller":"v3@v3.6.0/raft.go:1981","msg":"faccf952ee064646 switched to configuration voters=(6924721482461371042 7175146866936225997) learners=(18072093539306980934)"}
Mar 03 12:39:00 k3s-agent01 k3s[1176712]: {"level":"info","ts":"2026-03-03T12:39:00.835621+0100","logger":"raft","caller":"v3@v3.6.0/raft.go:897","msg":"faccf952ee064646 became follower at term 2"}
Mar 03 12:39:00 k3s-agent01 k3s[1176712]: {"level":"info","ts":"2026-03-03T12:39:00.835633+0100","logger":"raft","caller":"v3@v3.6.0/raft.go:493","msg":"newRaft faccf952ee064646 [peers: [60198d7fe2a05aa2,63933e0f56fda0cd], term: 2, commit: 8417, applied: 762, lastindex: 8417, lastterm: 2]"}
Mar 03 12:39:00 k3s-agent01 k3s[1176712]: {"level":"warn","ts":"2026-03-03T12:39:00.848989+0100","caller":"auth/store.go:1135","msg":"simple token is not cryptographically signed"}
Mar 03 12:39:00 k3s-agent01 k3s[1176712]: {"level":"info","ts":"2026-03-03T12:39:00.862089+0100","caller":"mvcc/kvstore.go:334","msg":"restored last compact revision","meta-bucket-name-key":"finishedCompactRev","restored-compact-revision":5281}
Mar 03 12:39:00 k3s-agent01 k3s[1176712]: {"level":"info","ts":"2026-03-03T12:39:00.865289+0100","caller":"mvcc/kvstore.go:408","msg":"kvstore restored","current-rev":7208}
Mar 03 12:39:00 k3s-agent01 k3s[1176712]: time="2026-03-03T12:39:00+01:00" level=error msg="Sending HTTP/1.1 503 response to 192.168.192.53:59160: runtime core not ready"
Mar 03 12:39:00 k3s-agent01 k3s[1176712]: {"level":"info","ts":"2026-03-03T12:39:00.905213+0100","caller":"storage/quota.go:93","msg":"enabled backend quota with default value","quota-name":"v3-applier","quota-size-bytes":2147483648,"quota-size":"2.1 GB"}
Mar 03 12:39:00 k3s-agent01 k3s[1176712]: {"level":"info","ts":"2026-03-03T12:39:00.905541+0100","caller":"rafthttp/peer.go:133","msg":"starting remote peer","remote-peer-id":"60198d7fe2a05aa2"}
Mar 03 12:39:00 k3s-agent01 k3s[1176712]: {"level":"info","ts":"2026-03-03T12:39:00.905575+0100","caller":"rafthttp/pipeline.go:72","msg":"started HTTP pipelining with remote peer","local-member-id":"faccf952ee064646","remote-peer-id":"60198d7fe2a05aa2"}
Mar 03 12:39:00 k3s-agent01 k3s[1176712]: {"level":"info","ts":"2026-03-03T12:39:00.906017+0100","caller":"rafthttp/stream.go:168","msg":"started stream writer with remote peer","local-member-id":"faccf952ee064646","remote-peer-id":"60198d7fe2a05aa2"}
Mar 03 12:39:00 k3s-agent01 k3s[1176712]: {"level":"info","ts":"2026-03-03T12:39:00.907491+0100","caller":"rafthttp/stream.go:168","msg":"started stream writer with remote peer","local-member-id":"faccf952ee064646","remote-peer-id":"60198d7fe2a05aa2"}
Mar 03 12:39:00 k3s-agent01 k3s[1176712]: {"level":"info","ts":"2026-03-03T12:39:00.908020+0100","caller":"rafthttp/peer.go:137","msg":"started remote peer","remote-peer-id":"60198d7fe2a05aa2"}
Mar 03 12:39:00 k3s-agent01 k3s[1176712]: {"level":"info","ts":"2026-03-03T12:39:00.908040+0100","caller":"rafthttp/stream.go:394","msg":"started stream reader with remote peer","stream-reader-type":"stream MsgApp v2","local-member-id":"faccf952ee064646","remote-peer-id":"60198d7fe2a05aa2"}
Mar 03 12:39:00 k3s-agent01 k3s[1176712]: {"level":"info","ts":"2026-03-03T12:39:00.908056+0100","caller":"rafthttp/transport.go:317","msg":"added remote peer","local-member-id":"faccf952ee064646","remote-peer-id":"60198d7fe2a05aa2","remote-peer-urls":["https://192.168.192.74:2380"]}
Mar 03 12:39:00 k3s-agent01 k3s[1176712]: {"level":"info","ts":"2026-03-03T12:39:00.908089+0100","caller":"rafthttp/peer.go:133","msg":"starting remote peer","remote-peer-id":"63933e0f56fda0cd"}
Mar 03 12:39:00 k3s-agent01 k3s[1176712]: {"level":"info","ts":"2026-03-03T12:39:00.908101+0100","caller":"rafthttp/pipeline.go:72","msg":"started HTTP pipelining with remote peer","local-member-id":"faccf952ee064646","remote-peer-id":"63933e0f56fda0cd"}
Mar 03 12:39:00 k3s-agent01 k3s[1176712]: {"level":"info","ts":"2026-03-03T12:39:00.908140+0100","caller":"rafthttp/stream.go:394","msg":"started stream reader with remote peer","stream-reader-type":"stream Message","local-member-id":"faccf952ee064646","remote-peer-id":"60198d7fe2a05aa2"}
Mar 03 12:39:00 k3s-agent01 k3s[1176712]: {"level":"info","ts":"2026-03-03T12:39:00.908296+0100","caller":"rafthttp/stream.go:168","msg":"started stream writer with remote peer","local-member-id":"faccf952ee064646","remote-peer-id":"63933e0f56fda0cd"}
Mar 03 12:39:00 k3s-agent01 k3s[1176712]: {"level":"info","ts":"2026-03-03T12:39:00.908352+0100","caller":"rafthttp/peer.go:137","msg":"started remote peer","remote-peer-id":"63933e0f56fda0cd"}
Mar 03 12:39:00 k3s-agent01 k3s[1176712]: {"level":"info","ts":"2026-03-03T12:39:00.908368+0100","caller":"rafthttp/transport.go:317","msg":"added remote peer","local-member-id":"faccf952ee064646","remote-peer-id":"63933e0f56fda0cd","remote-peer-urls":["https://192.168.192.153:2380"]}
Mar 03 12:39:00 k3s-agent01 k3s[1176712]: {"level":"info","ts":"2026-03-03T12:39:00.908360+0100","caller":"rafthttp/stream.go:168","msg":"started stream writer with remote peer","local-member-id":"faccf952ee064646","remote-peer-id":"63933e0f56fda0cd"}
Mar 03 12:39:00 k3s-agent01 k3s[1176712]: {"level":"info","ts":"2026-03-03T12:39:00.908380+0100","caller":"etcdserver/corrupt.go:91","msg":"starting initial corruption check","local-member-id":"faccf952ee064646","timeout":"15s"}
Mar 03 12:39:00 k3s-agent01 k3s[1176712]: {"level":"info","ts":"2026-03-03T12:39:00.908414+0100","caller":"rafthttp/stream.go:394","msg":"started stream reader with remote peer","stream-reader-type":"stream MsgApp v2","local-member-id":"faccf952ee064646","remote-peer-id":"63933e0f56fda0cd"}
Mar 03 12:39:00 k3s-agent01 k3s[1176712]: {"level":"info","ts":"2026-03-03T12:39:00.908394+0100","caller":"rafthttp/stream.go:394","msg":"started stream reader with remote peer","stream-reader-type":"stream Message","local-member-id":"faccf952ee064646","remote-peer-id":"63933e0f56fda0cd"}
Mar 03 12:39:00 k3s-agent01 k3s[1176712]: time="2026-03-03T12:39:00+01:00" level=info msg="Running kube-proxy --cluster-cidr=10.42.0.0/16 --conntrack-max-per-core=0 --conntrack-tcp-timeout-close-wait=0s --conntrack-tcp-timeout-established=0s --healthz-bind-address=127.0.0.1 --hostname-override=k3s-agent01 --kubeconfig=/var/lib/rancher/k3s/agent/kubeproxy.kubeconfig --proxy-mode=iptables"
Mar 03 12:39:01 k3s-agent01 k3s[1176712]: time="2026-03-03T12:39:01+01:00" level=info msg="containerd is now running"
Mar 03 12:39:01 k3s-agent01 k3s[1176712]: time="2026-03-03T12:39:01+01:00" level=info msg="Handling backend connection request [k3s-server01]"
Mar 03 12:39:01 k3s-agent01 k3s[1176712]: time="2026-03-03T12:39:01+01:00" level=info msg="Handling backend connection request [k3s-agent02]"
Mar 03 12:39:02 k3s-agent01 k3s[1176712]: time="2026-03-03T12:39:02+01:00" level=info msg="Running kubelet --cloud-provider=external --config-dir=/var/lib/rancher/k3s/agent/etc/kubelet.conf.d --containerd=/run/k3s/containerd/containerd.sock --hostname-override=k3s-agent01 --kubeconfig=/var/lib/rancher/k3s/agent/kubelet.kubeconfig --node-ip=192.168.192.53 --node-labels= --read-only-port=0"
Mar 03 12:39:05 k3s-agent01 k3s[1176712]: time="2026-03-03T12:39:05+01:00" level=info msg="Failed to test etcd connection: failed to get etcd status: rpc error: code = Unavailable desc = connection error: desc = \"transport: Error while dialing: dial tcp 127.0.0.1:2379: connect: connection refused\""
Mar 03 12:39:05 k3s-agent01 k3s[1176712]: {"level":"warn","ts":"2026-03-03T12:39:05.908260+0100","caller":"rafthttp/probing_status.go:68","msg":"prober detected unhealthy status","round-tripper-name":"ROUND_TRIPPER_RAFT_MESSAGE","remote-peer-id":"60198d7fe2a05aa2","rtt":"0s"}
Mar 03 12:39:05 k3s-agent01 k3s[1176712]: {"level":"warn","ts":"2026-03-03T12:39:05.908295+0100","caller":"rafthttp/probing_status.go:68","msg":"prober detected unhealthy status","round-tripper-name":"ROUND_TRIPPER_SNAPSHOT","remote-peer-id":"60198d7fe2a05aa2","rtt":"0s"}
Mar 03 12:39:05 k3s-agent01 k3s[1176712]: {"level":"warn","ts":"2026-03-03T12:39:05.908421+0100","caller":"rafthttp/probing_status.go:68","msg":"prober detected unhealthy status","round-tripper-name":"ROUND_TRIPPER_SNAPSHOT","remote-peer-id":"63933e0f56fda0cd","rtt":"0s"}
Mar 03 12:39:05 k3s-agent01 k3s[1176712]: {"level":"warn","ts":"2026-03-03T12:39:05.908443+0100","caller":"rafthttp/probing_status.go:68","msg":"prober detected unhealthy status","round-tripper-name":"ROUND_TRIPPER_RAFT_MESSAGE","remote-peer-id":"63933e0f56fda0cd","rtt":"0s"}
Mar 03 12:39:05 k3s-agent01 k3s[1176712]: {"level":"info","ts":"2026-03-03T12:39:05.915841+0100","caller":"rafthttp/peer_status.go:53","msg":"peer became active","peer-id":"63933e0f56fda0cd"}
Mar 03 12:39:05 k3s-agent01 k3s[1176712]: {"level":"info","ts":"2026-03-03T12:39:05.915939+0100","caller":"rafthttp/stream.go:411","msg":"established TCP streaming connection with remote peer","stream-reader-type":"stream MsgApp v2","local-member-id":"faccf952ee064646","remote-peer-id":"63933e0f56fda0cd"}
Mar 03 12:39:05 k3s-agent01 k3s[1176712]: {"level":"info","ts":"2026-03-03T12:39:05.916147+0100","caller":"rafthttp/stream.go:411","msg":"established TCP streaming connection with remote peer","stream-reader-type":"stream Message","local-member-id":"faccf952ee064646","remote-peer-id":"63933e0f56fda0cd"}
Mar 03 12:39:05 k3s-agent01 k3s[1176712]: {"level":"info","ts":"2026-03-03T12:39:05.917695+0100","caller":"rafthttp/peer_status.go:53","msg":"peer became active","peer-id":"60198d7fe2a05aa2"}
Mar 03 12:39:05 k3s-agent01 k3s[1176712]: {"level":"info","ts":"2026-03-03T12:39:05.917722+0100","caller":"rafthttp/stream.go:411","msg":"established TCP streaming connection with remote peer","stream-reader-type":"stream Message","local-member-id":"faccf952ee064646","remote-peer-id":"60198d7fe2a05aa2"}
Mar 03 12:39:05 k3s-agent01 k3s[1176712]: {"level":"info","ts":"2026-03-03T12:39:05.918184+0100","caller":"rafthttp/stream.go:411","msg":"established TCP streaming connection with remote peer","stream-reader-type":"stream MsgApp v2","local-member-id":"faccf952ee064646","remote-peer-id":"60198d7fe2a05aa2"}
Mar 03 12:39:05 k3s-agent01 k3s[1176712]: {"level":"info","ts":"2026-03-03T12:39:05.969318+0100","logger":"raft","caller":"v3@v3.6.0/node.go:370","msg":"raft.node: faccf952ee064646 elected leader 63933e0f56fda0cd at term 2"}
Mar 03 12:39:10 k3s-agent01 k3s[1176712]: time="2026-03-03T12:39:10+01:00" level=info msg="Failed to test etcd connection: failed to get etcd status: rpc error: code = Unavailable desc = connection error: desc = \"transport: Error while dialing: dial tcp 127.0.0.1:2379: connect: connection refused\""
Mar 03 12:39:10 k3s-agent01 k3s[1176712]: {"level":"info","ts":"2026-03-03T12:39:10.928413+0100","caller":"etcdserver/corrupt.go:172","msg":"initial corruption checking passed; no corruption","local-member-id":"faccf952ee064646"}
Mar 03 12:39:10 k3s-agent01 k3s[1176712]: {"level":"info","ts":"2026-03-03T12:39:10.928487+0100","caller":"etcdserver/server.go:589","msg":"starting etcd server","local-member-id":"faccf952ee064646","local-server-version":"3.6.6","cluster-id":"4b7efcc6c72a43ba","cluster-version":"3.6"}
Mar 03 12:39:10 k3s-agent01 k3s[1176712]: {"level":"info","ts":"2026-03-03T12:39:10.928644+0100","caller":"embed/etcd.go:766","msg":"starting with client TLS","tls-info":"cert = /var/lib/rancher/k3s/server/tls/etcd/server-client.crt, key = /var/lib/rancher/k3s/server/tls/etcd/server-client.key, client-cert=, client-key=, trusted-ca = /var/lib/rancher/k3s/server/tls/etcd/server-ca.crt, client-cert-auth = true, crl-file = ","cipher-suites":[]}
Mar 03 12:39:10 k3s-agent01 k3s[1176712]: {"level":"info","ts":"2026-03-03T12:39:10.928724+0100","caller":"etcdserver/server.go:499","msg":"starting initial election tick advance","election-ticks":10}
Mar 03 12:39:10 k3s-agent01 k3s[1176712]: {"level":"info","ts":"2026-03-03T12:39:10.928760+0100","caller":"fileutil/purge.go:49","msg":"started to purge file","dir":"/var/lib/rancher/k3s/server/db/etcd/member/snap","suffix":"snap.db","max":5,"interval":"30s"}
Mar 03 12:39:10 k3s-agent01 k3s[1176712]: {"level":"info","ts":"2026-03-03T12:39:10.928822+0100","caller":"fileutil/purge.go:49","msg":"started to purge file","dir":"/var/lib/rancher/k3s/server/db/etcd/member/snap","suffix":"snap","max":5,"interval":"30s"}
Mar 03 12:39:10 k3s-agent01 k3s[1176712]: {"level":"info","ts":"2026-03-03T12:39:10.928831+0100","caller":"fileutil/purge.go:49","msg":"started to purge file","dir":"/var/lib/rancher/k3s/server/db/etcd/member/wal","suffix":"wal","max":5,"interval":"30s"}
Mar 03 12:39:10 k3s-agent01 k3s[1176712]: {"level":"info","ts":"2026-03-03T12:39:10.928906+0100","caller":"embed/etcd.go:292","msg":"now serving peer/client/metrics","local-member-id":"faccf952ee064646","initial-advertise-peer-urls":["http://localhost:2380"],"listen-peer-urls":["https://127.0.0.1:2380","https://192.168.192.53:2380"],"advertise-client-urls":["https://192.168.192.53:2379"],"listen-client-urls":["https://127.0.0.1:2379","https://192.168.192.53:2379"],"listen-metrics-urls":["http://127.0.0.1:2381"]}
Mar 03 12:39:10 k3s-agent01 k3s[1176712]: {"level":"info","ts":"2026-03-03T12:39:10.928913+0100","caller":"embed/etcd.go:640","msg":"serving peer traffic","address":"192.168.192.53:2380"}
Mar 03 12:39:10 k3s-agent01 k3s[1176712]: {"level":"info","ts":"2026-03-03T12:39:10.928931+0100","caller":"embed/etcd.go:611","msg":"cmux::serve","address":"192.168.192.53:2380"}
Mar 03 12:39:10 k3s-agent01 k3s[1176712]: time="2026-03-03T12:39:10+01:00" level=info msg="Running kube-apiserver --advertise-address=192.168.192.53 --advertise-port=6443 --allow-privileged=true --anonymous-auth=false --api-audiences=https://kubernetes.default.svc.cluster.local,k3s --authorization-mode=Node,RBAC --bind-address=127.0.0.1 --cert-dir=/var/lib/rancher/k3s/server/tls/temporary-certs --client-ca-file=/var/lib/rancher/k3s/server/tls/client-ca.crt --egress-selector-config-file=/var/lib/rancher/k3s/server/etc/egress-selector-config.yaml --enable-admission-plugins=NodeRestriction --enable-aggregator-routing=true --enable-bootstrap-token-auth=true --etcd-cafile=/var/lib/rancher/k3s/server/tls/etcd/server-ca.crt --etcd-certfile=/var/lib/rancher/k3s/server/tls/etcd/client.crt --etcd-keyfile=/var/lib/rancher/k3s/server/tls/etcd/client.key --etcd-servers=https://127.0.0.1:2379 --kubelet-certificate-authority=/var/lib/rancher/k3s/server/tls/server-ca.crt --kubelet-client-certificate=/var/lib/rancher/k3s/server/tls/client-kube-apiserver.crt --kubelet-client-key=/var/lib/rancher/k3s/server/tls/client-kube-apiserver.key --kubelet-preferred-address-types=InternalIP,ExternalIP,Hostname --profiling=false --proxy-client-cert-file=/var/lib/rancher/k3s/server/tls/client-auth-proxy.crt --proxy-client-key-file=/var/lib/rancher/k3s/server/tls/client-auth-proxy.key --requestheader-allowed-names=system:auth-proxy --requestheader-client-ca-file=/var/lib/rancher/k3s/server/tls/request-header-ca.crt --requestheader-extra-headers-prefix=X-Remote-Extra- --requestheader-group-headers=X-Remote-Group --requestheader-username-headers=X-Remote-User --secure-port=6444 --service-account-issuer=https://kubernetes.default.svc.cluster.local --service-account-key-file=/var/lib/rancher/k3s/server/tls/service.key --service-account-signing-key-file=/var/lib/rancher/k3s/server/tls/service.current.key --service-cluster-ip-range=10.43.0.0/16 --service-node-port-range=30000-32767 --storage-backend=etcd3 --tls-cert-file=/var/lib/rancher/k3s/server/tls/serving-kube-apiserver.crt --tls-cipher-suites=TLS_ECDHE_ECDSA_WITH_AES_256_GCM_SHA384,TLS_ECDHE_RSA_WITH_AES_256_GCM_SHA384,TLS_ECDHE_ECDSA_WITH_AES_128_GCM_SHA256,TLS_ECDHE_RSA_WITH_AES_128_GCM_SHA256,TLS_ECDHE_ECDSA_WITH_CHACHA20_POLY1305,TLS_ECDHE_RSA_WITH_CHACHA20_POLY1305 --tls-private-key-file=/var/lib/rancher/k3s/server/tls/serving-kube-apiserver.key"
Mar 03 12:39:10 k3s-agent01 k3s[1176712]: {"level":"info","ts":"2026-03-03T12:39:10.929341+0100","caller":"embed/etcd.go:890","msg":"serving metrics","address":"http://127.0.0.1:2381"}
Mar 03 12:39:10 k3s-agent01 k3s[1176712]: {"level":"info","ts":"2026-03-03T12:39:10.929384+0100","caller":"embed/etcd.go:640","msg":"serving peer traffic","address":"127.0.0.1:2380"}
Mar 03 12:39:10 k3s-agent01 k3s[1176712]: {"level":"info","ts":"2026-03-03T12:39:10.929417+0100","caller":"embed/etcd.go:611","msg":"cmux::serve","address":"127.0.0.1:2380"}
Mar 03 12:39:10 k3s-agent01 k3s[1176712]: {"level":"info","ts":"2026-03-03T12:39:10.929403+0100","logger":"raft","caller":"v3@v3.6.0/raft.go:1981","msg":"faccf952ee064646 switched to configuration voters=(6924721482461371042 7175146866936225997 18072093539306980934)"}
Mar 03 12:39:10 k3s-agent01 k3s[1176712]: {"level":"info","ts":"2026-03-03T12:39:10.929503+0100","caller":"rafthttp/stream.go:248","msg":"set message encoder","from":"faccf952ee064646","to":"60198d7fe2a05aa2","stream-type":"stream MsgApp v2"}
Mar 03 12:39:10 k3s-agent01 k3s[1176712]: {"level":"info","ts":"2026-03-03T12:39:10.929524+0100","caller":"rafthttp/stream.go:273","msg":"established TCP streaming connection with remote peer","stream-writer-type":"stream MsgApp v2","local-member-id":"faccf952ee064646","remote-peer-id":"60198d7fe2a05aa2"}
Mar 03 12:39:10 k3s-agent01 k3s[1176712]: {"level":"info","ts":"2026-03-03T12:39:10.929546+0100","caller":"rafthttp/stream.go:248","msg":"set message encoder","from":"faccf952ee064646","to":"60198d7fe2a05aa2","stream-type":"stream Message"}
Mar 03 12:39:10 k3s-agent01 k3s[1176712]: {"level":"info","ts":"2026-03-03T12:39:10.929571+0100","caller":"rafthttp/stream.go:273","msg":"established TCP streaming connection with remote peer","stream-writer-type":"stream Message","local-member-id":"faccf952ee064646","remote-peer-id":"60198d7fe2a05aa2"}
Mar 03 12:39:10 k3s-agent01 k3s[1176712]: {"level":"info","ts":"2026-03-03T12:39:10.929582+0100","caller":"rafthttp/stream.go:248","msg":"set message encoder","from":"faccf952ee064646","to":"63933e0f56fda0cd","stream-type":"stream MsgApp v2"}
Mar 03 12:39:10 k3s-agent01 k3s[1176712]: {"level":"info","ts":"2026-03-03T12:39:10.929596+0100","caller":"membership/cluster.go:574","msg":"ignore already promoted member in v3store","cluster-id":"4b7efcc6c72a43ba","local-member-id":"faccf952ee064646","promoted-member-id":"faccf952ee064646"}
Mar 03 12:39:10 k3s-agent01 k3s[1176712]: {"level":"info","ts":"2026-03-03T12:39:10.929615+0100","caller":"rafthttp/stream.go:273","msg":"established TCP streaming connection with remote peer","stream-writer-type":"stream MsgApp v2","local-member-id":"faccf952ee064646","remote-peer-id":"63933e0f56fda0cd"}
Mar 03 12:39:10 k3s-agent01 k3s[1176712]: time="2026-03-03T12:39:10+01:00" level=info msg="Running kube-scheduler --authentication-kubeconfig=/var/lib/rancher/k3s/server/cred/scheduler.kubeconfig --authorization-kubeconfig=/var/lib/rancher/k3s/server/cred/scheduler.kubeconfig --bind-address=127.0.0.1 --kubeconfig=/var/lib/rancher/k3s/server/cred/scheduler.kubeconfig --profiling=false --secure-port=10259 --tls-cert-file=/var/lib/rancher/k3s/server/tls/kube-scheduler/kube-scheduler.crt --tls-private-key-file=/var/lib/rancher/k3s/server/tls/kube-scheduler/kube-scheduler.key"
Mar 03 12:39:10 k3s-agent01 k3s[1176712]: {"level":"info","ts":"2026-03-03T12:39:10.929806+0100","caller":"rafthttp/stream.go:248","msg":"set message encoder","from":"faccf952ee064646","to":"63933e0f56fda0cd","stream-type":"stream Message"}
Mar 03 12:39:10 k3s-agent01 k3s[1176712]: {"level":"info","ts":"2026-03-03T12:39:10.929819+0100","caller":"rafthttp/stream.go:273","msg":"established TCP streaming connection with remote peer","stream-writer-type":"stream Message","local-member-id":"faccf952ee064646","remote-peer-id":"63933e0f56fda0cd"}
Mar 03 12:39:10 k3s-agent01 k3s[1176712]: time="2026-03-03T12:39:10+01:00" level=info msg="Running kube-controller-manager --allocate-node-cidrs=true --authentication-kubeconfig=/var/lib/rancher/k3s/server/cred/controller.kubeconfig --authorization-kubeconfig=/var/lib/rancher/k3s/server/cred/controller.kubeconfig --bind-address=127.0.0.1 --cluster-cidr=10.42.0.0/16 --cluster-signing-kube-apiserver-client-cert-file=/var/lib/rancher/k3s/server/tls/client-ca.nochain.crt --cluster-signing-kube-apiserver-client-key-file=/var/lib/rancher/k3s/server/tls/client-ca.key --cluster-signing-kubelet-client-cert-file=/var/lib/rancher/k3s/server/tls/client-ca.nochain.crt --cluster-signing-kubelet-client-key-file=/var/lib/rancher/k3s/server/tls/client-ca.key --cluster-signing-kubelet-serving-cert-file=/var/lib/rancher/k3s/server/tls/server-ca.nochain.crt --cluster-signing-kubelet-serving-key-file=/var/lib/rancher/k3s/server/tls/server-ca.key --cluster-signing-legacy-unknown-cert-file=/var/lib/rancher/k3s/server/tls/server-ca.nochain.crt --cluster-signing-legacy-unknown-key-file=/var/lib/rancher/k3s/server/tls/server-ca.key --configure-cloud-routes=false --controllers=*,tokencleaner,-service,-route,-cloud-node-lifecycle --kubeconfig=/var/lib/rancher/k3s/server/cred/controller.kubeconfig --profiling=false --root-ca-file=/var/lib/rancher/k3s/server/tls/server-ca.crt --secure-port=10257 --service-account-private-key-file=/var/lib/rancher/k3s/server/tls/service.current.key --service-cluster-ip-range=10.43.0.0/16 --tls-cert-file=/var/lib/rancher/k3s/server/tls/kube-controller-manager/kube-controller-manager.crt --tls-private-key-file=/var/lib/rancher/k3s/server/tls/kube-controller-manager/kube-controller-manager.key --use-service-account-credentials=true"
Mar 03 12:39:10 k3s-agent01 k3s[1176712]: time="2026-03-03T12:39:10+01:00" level=info msg="Running cloud-controller-manager --allocate-node-cidrs=true --authentication-kubeconfig=/var/lib/rancher/k3s/server/cred/cloud-controller.kubeconfig --authorization-kubeconfig=/var/lib/rancher/k3s/server/cred/cloud-controller.kubeconfig --bind-address=127.0.0.1 --cloud-config=/var/lib/rancher/k3s/server/etc/cloud-config.yaml --cloud-provider=k3s --cluster-cidr=10.42.0.0/16 --configure-cloud-routes=false --controllers=*,-route --kubeconfig=/var/lib/rancher/k3s/server/cred/cloud-controller.kubeconfig --leader-elect-resource-name=k3s-cloud-controller-manager --node-status-update-frequency=1m0s --profiling=false"
Mar 03 12:39:10 k3s-agent01 k3s[1176712]: time="2026-03-03T12:39:10+01:00" level=info msg="Server node token is available at /var/lib/rancher/k3s/server/token"
Mar 03 12:39:10 k3s-agent01 k3s[1176712]: time="2026-03-03T12:39:10+01:00" level=info msg="To join server node to cluster: k3s server -s https://192.168.192.53:6443 -t ${SERVER_NODE_TOKEN}"
Mar 03 12:39:10 k3s-agent01 k3s[1176712]: time="2026-03-03T12:39:10+01:00" level=info msg="Agent node token is available at /var/lib/rancher/k3s/server/agent-token"
Mar 03 12:39:10 k3s-agent01 k3s[1176712]: time="2026-03-03T12:39:10+01:00" level=info msg="To join agent node to cluster: k3s agent -s https://192.168.192.53:6443 -t ${AGENT_NODE_TOKEN}"
Mar 03 12:39:10 k3s-agent01 k3s[1176712]: time="2026-03-03T12:39:10+01:00" level=info msg="Wrote kubeconfig /etc/rancher/k3s/k3s.yaml"
Mar 03 12:39:10 k3s-agent01 k3s[1176712]: time="2026-03-03T12:39:10+01:00" level=info msg="Run: k3s kubectl"
Mar 03 12:39:10 k3s-agent01 k3s[1176712]: {"level":"info","ts":"2026-03-03T12:39:10.979742+0100","caller":"etcdserver/server.go:522","msg":"initialized peer connections; fast-forwarding election ticks","local-member-id":"faccf952ee064646","forward-ticks":8,"forward-duration":"4s","election-ticks":10,"election-timeout":"5s","active-remote-members":2}
Mar 03 12:39:11 k3s-agent01 k3s[1176712]: {"level":"info","ts":"2026-03-03T12:39:11.008208+0100","caller":"etcdserver/server.go:1822","msg":"published local member to cluster through raft","local-member-id":"faccf952ee064646","local-member-attributes":"{Name:k3s-agent01-f1584fc4 ClientURLs:[https://192.168.192.53:2379]}","cluster-id":"4b7efcc6c72a43ba","publish-timeout":"15s"}
Mar 03 12:39:11 k3s-agent01 k3s[1176712]: {"level":"info","ts":"2026-03-03T12:39:11.008266+0100","caller":"embed/serve.go:138","msg":"ready to serve client requests"}
Mar 03 12:39:11 k3s-agent01 k3s[1176712]: {"level":"info","ts":"2026-03-03T12:39:11.008270+0100","caller":"embed/serve.go:138","msg":"ready to serve client requests"}
Mar 03 12:39:11 k3s-agent01 k3s[1176712]: {"level":"info","ts":"2026-03-03T12:39:11.008361+0100","caller":"embed/serve.go:138","msg":"ready to serve client requests"}
Mar 03 12:39:11 k3s-agent01 k3s[1176712]: {"level":"warn","ts":"2026-03-03T12:39:11.008874+0100","caller":"v3rpc/grpc.go:109","msg":"etcdserver: failed to register grpc metrics","error":"descriptor Desc{fqName: \"grpc_server_msg_sent_total\", help: \"Total number of gRPC stream messages sent by the server.\", constLabels: {}, variableLabels: {grpc_type,grpc_service,grpc_method}} already exists with the same fully-qualified name and const label values"}
Mar 03 12:39:11 k3s-agent01 k3s[1176712]: {"level":"info","ts":"2026-03-03T12:39:11.008981+0100","caller":"v3rpc/health.go:63","msg":"grpc service status changed","service":"","status":"SERVING"}
Mar 03 12:39:11 k3s-agent01 k3s[1176712]: {"level":"info","ts":"2026-03-03T12:39:11.009283+0100","caller":"embed/serve.go:283","msg":"serving client traffic securely","traffic":"http","address":"127.0.0.1:2382"}
Mar 03 12:39:11 k3s-agent01 k3s[1176712]: {"level":"info","ts":"2026-03-03T12:39:11.009454+0100","caller":"v3rpc/health.go:63","msg":"grpc service status changed","service":"","status":"SERVING"}
Mar 03 12:39:11 k3s-agent01 k3s[1176712]: {"level":"info","ts":"2026-03-03T12:39:11.010550+0100","caller":"embed/serve.go:283","msg":"serving client traffic securely","traffic":"grpc","address":"192.168.192.53:2379"}
Mar 03 12:39:11 k3s-agent01 k3s[1176712]: {"level":"info","ts":"2026-03-03T12:39:11.010659+0100","caller":"embed/serve.go:283","msg":"serving client traffic securely","traffic":"grpc","address":"127.0.0.1:2379"}
Mar 03 12:39:15 k3s-agent01 k3s[1176712]: time="2026-03-03T12:39:15+01:00" level=info msg="Connected to etcd v3.6.6 - datastore using 4268032 of 8634368 bytes"
Mar 03 12:39:15 k3s-agent01 k3s[1176712]: time="2026-03-03T12:39:15+01:00" level=info msg="Defragmenting etcd database"
Mar 03 12:39:15 k3s-agent01 k3s[1176712]: {"level":"info","ts":"2026-03-03T12:39:15.790228+0100","caller":"v3rpc/maintenance.go:117","msg":"starting defragment"}
Mar 03 12:39:15 k3s-agent01 k3s[1176712]: {"level":"info","ts":"2026-03-03T12:39:15.808901+0100","caller":"backend/backend.go:522","msg":"defragmenting","path":"/var/lib/rancher/k3s/server/db/etcd/member/snap/db","current-db-size-bytes":8634368,"current-db-size":"8.6 MB","current-db-size-in-use-bytes":4268032,"current-db-size-in-use":"4.3 MB"}
Mar 03 12:39:15 k3s-agent01 k3s[1176712]: {"level":"info","ts":"2026-03-03T12:39:15.898727+0100","logger":"bbolt","caller":"backend/backend.go:574","msg":"Opening db file (/var/lib/rancher/k3s/server/db/etcd/member/snap/db) with mode -rw------- and with options: {Timeout: 0s, NoGrowSync: false, NoFreelistSync: true, PreLoadFreelist: false, FreelistType: hashmap, ReadOnly: false, MmapFlags: 8000, InitialMmapSize: 10737418240, PageSize: 0, NoSync: false, OpenFile: 0x0, Mlock: false, Logger: 0xc0000cb500}"}
Mar 03 12:39:15 k3s-agent01 k3s[1176712]: {"level":"info","ts":"2026-03-03T12:39:15.899753+0100","logger":"bbolt","caller":"bbolt@v1.4.3/db.go:322","msg":"Opening bbolt db (/var/lib/rancher/k3s/server/db/etcd/member/snap/db) successfully"}
Mar 03 12:39:15 k3s-agent01 k3s[1176712]: {"level":"info","ts":"2026-03-03T12:39:15.899782+0100","caller":"backend/backend.go:592","msg":"finished defragmenting directory","path":"/var/lib/rancher/k3s/server/db/etcd/member/snap/db","current-db-size-bytes-diff":-4648960,"current-db-size-bytes":3985408,"current-db-size":"4.0 MB","current-db-size-in-use-bytes-diff":-290816,"current-db-size-in-use-bytes":3977216,"current-db-size-in-use":"4.0 MB","took":"109.49918ms"}
Mar 03 12:39:15 k3s-agent01 k3s[1176712]: {"level":"info","ts":"2026-03-03T12:39:15.899800+0100","caller":"v3rpc/maintenance.go:125","msg":"finished defragment"}
Mar 03 12:39:15 k3s-agent01 k3s[1176712]: {"level":"info","ts":"2026-03-03T12:39:15.899810+0100","caller":"v3rpc/health.go:63","msg":"grpc service status changed","service":"","status":"SERVING"}
Mar 03 12:39:15 k3s-agent01 k3s[1176712]: time="2026-03-03T12:39:15+01:00" level=info msg="Datastore using 3977216 of 3985408 bytes after defragment"
Mar 03 12:39:15 k3s-agent01 k3s[1176712]: time="2026-03-03T12:39:15+01:00" level=info msg="Connection to etcd is ready"
Mar 03 12:39:15 k3s-agent01 k3s[1176712]: time="2026-03-03T12:39:15+01:00" level=info msg="ETCD server is now running"
Mar 03 12:39:15 k3s-agent01 k3s[1176712]: time="2026-03-03T12:39:15+01:00" level=info msg="Saving cluster bootstrap data to datastore"
Mar 03 12:39:15 k3s-agent01 k3s[1176712]: I0303 12:39:15.911621 1176712 options.go:263] external host was not specified, using 192.168.192.53
Mar 03 12:39:15 k3s-agent01 k3s[1176712]: I0303 12:39:15.913674 1176712 server.go:158] Version: v1.35.0+k3s1
Mar 03 12:39:15 k3s-agent01 k3s[1176712]: I0303 12:39:15.913698 1176712 server.go:160] "Golang settings" GOGC="" GOMAXPROCS="" GOTRACEBACK=""
Mar 03 12:39:15 k3s-agent01 k3s[1176712]: I0303 12:39:15.923332 1176712 shared_informer.go:349] "Waiting for caches to sync" controller="node_authorizer"
Mar 03 12:39:15 k3s-agent01 k3s[1176712]: I0303 12:39:15.927028 1176712 shared_informer.go:370] "Waiting for caches to sync"
Mar 03 12:39:15 k3s-agent01 k3s[1176712]: I0303 12:39:15.929213 1176712 plugins.go:157] Loaded 14 mutating admission controller(s) successfully in the following order: NamespaceLifecycle,LimitRanger,ServiceAccount,NodeRestriction,TaintNodesByCondition,Priority,DefaultTolerationSeconds,DefaultStorageClass,StorageObjectInUseProtection,RuntimeClass,DefaultIngressClass,PodTopologyLabels,MutatingAdmissionPolicy,MutatingAdmissionWebhook.
Mar 03 12:39:15 k3s-agent01 k3s[1176712]: I0303 12:39:15.929237 1176712 plugins.go:160] Loaded 14 validating admission controller(s) successfully in the following order: LimitRanger,ServiceAccount,PodSecurity,Priority,PersistentVolumeClaimResize,RuntimeClass,CertificateApproval,CertificateSigning,ClusterTrustBundleAttest,CertificateSubjectRestriction,NodeDeclaredFeatureValidator,ValidatingAdmissionPolicy,ValidatingAdmissionWebhook,ResourceQuota.
Mar 03 12:39:15 k3s-agent01 k3s[1176712]: I0303 12:39:15.929476 1176712 instance.go:240] Using reconciler: lease
Mar 03 12:39:15 k3s-agent01 k3s[1176712]: I0303 12:39:15.941142 1176712 handler.go:304] Adding GroupVersion apiextensions.k8s.io v1 to ResourceManager
Mar 03 12:39:15 k3s-agent01 k3s[1176712]: W0303 12:39:15.941162 1176712 genericapiserver.go:787] Skipping API apiextensions.k8s.io/v1beta1 because it has no resources.
Mar 03 12:39:15 k3s-agent01 k3s[1176712]: I0303 12:39:15.943801 1176712 cidrallocator.go:198] starting ServiceCIDR Allocator Controller
Mar 03 12:39:15 k3s-agent01 k3s[1176712]: time="2026-03-03T12:39:15+01:00" level=warning msg="Bootstrap key already exists"
Mar 03 12:39:16 k3s-agent01 k3s[1176712]: I0303 12:39:16.009751 1176712 handler.go:304] Adding GroupVersion  v1 to ResourceManager
Mar 03 12:39:16 k3s-agent01 k3s[1176712]: I0303 12:39:16.010051 1176712 apis.go:112] API group "internal.apiserver.k8s.io" is not enabled, skipping.
Mar 03 12:39:16 k3s-agent01 k3s[1176712]: I0303 12:39:16.089658 1176712 apis.go:112] API group "storagemigration.k8s.io" is not enabled, skipping.
Mar 03 12:39:16 k3s-agent01 k3s[1176712]: I0303 12:39:16.143789 1176712 handler.go:304] Adding GroupVersion authentication.k8s.io v1 to ResourceManager
Mar 03 12:39:16 k3s-agent01 k3s[1176712]: W0303 12:39:16.143827 1176712 genericapiserver.go:787] Skipping API authentication.k8s.io/v1beta1 because it has no resources.
Mar 03 12:39:16 k3s-agent01 k3s[1176712]: W0303 12:39:16.143833 1176712 genericapiserver.go:787] Skipping API authentication.k8s.io/v1alpha1 because it has no resources.
Mar 03 12:39:16 k3s-agent01 k3s[1176712]: I0303 12:39:16.144171 1176712 handler.go:304] Adding GroupVersion authorization.k8s.io v1 to ResourceManager
Mar 03 12:39:16 k3s-agent01 k3s[1176712]: W0303 12:39:16.144186 1176712 genericapiserver.go:787] Skipping API authorization.k8s.io/v1beta1 because it has no resources.
Mar 03 12:39:16 k3s-agent01 k3s[1176712]: I0303 12:39:16.144685 1176712 handler.go:304] Adding GroupVersion autoscaling v2 to ResourceManager
Mar 03 12:39:16 k3s-agent01 k3s[1176712]: I0303 12:39:16.145128 1176712 handler.go:304] Adding GroupVersion autoscaling v1 to ResourceManager
Mar 03 12:39:16 k3s-agent01 k3s[1176712]: W0303 12:39:16.145143 1176712 genericapiserver.go:787] Skipping API autoscaling/v2beta1 because it has no resources.
Mar 03 12:39:16 k3s-agent01 k3s[1176712]: W0303 12:39:16.145147 1176712 genericapiserver.go:787] Skipping API autoscaling/v2beta2 because it has no resources.
Mar 03 12:39:16 k3s-agent01 k3s[1176712]: I0303 12:39:16.146222 1176712 handler.go:304] Adding GroupVersion batch v1 to ResourceManager
Mar 03 12:39:16 k3s-agent01 k3s[1176712]: W0303 12:39:16.146237 1176712 genericapiserver.go:787] Skipping API batch/v1beta1 because it has no resources.
Mar 03 12:39:16 k3s-agent01 k3s[1176712]: I0303 12:39:16.146749 1176712 handler.go:304] Adding GroupVersion certificates.k8s.io v1 to ResourceManager
Mar 03 12:39:16 k3s-agent01 k3s[1176712]: W0303 12:39:16.146764 1176712 genericapiserver.go:787] Skipping API certificates.k8s.io/v1beta1 because it has no resources.
Mar 03 12:39:16 k3s-agent01 k3s[1176712]: W0303 12:39:16.146769 1176712 genericapiserver.go:787] Skipping API certificates.k8s.io/v1alpha1 because it has no resources.
Mar 03 12:39:16 k3s-agent01 k3s[1176712]: I0303 12:39:16.147177 1176712 handler.go:304] Adding GroupVersion coordination.k8s.io v1 to ResourceManager
Mar 03 12:39:16 k3s-agent01 k3s[1176712]: W0303 12:39:16.147192 1176712 genericapiserver.go:787] Skipping API coordination.k8s.io/v1beta1 because it has no resources.
Mar 03 12:39:16 k3s-agent01 k3s[1176712]: W0303 12:39:16.147196 1176712 genericapiserver.go:787] Skipping API coordination.k8s.io/v1alpha2 because it has no resources.
Mar 03 12:39:16 k3s-agent01 k3s[1176712]: I0303 12:39:16.147696 1176712 handler.go:304] Adding GroupVersion discovery.k8s.io v1 to ResourceManager
Mar 03 12:39:16 k3s-agent01 k3s[1176712]: W0303 12:39:16.147714 1176712 genericapiserver.go:787] Skipping API discovery.k8s.io/v1beta1 because it has no resources.
Mar 03 12:39:16 k3s-agent01 k3s[1176712]: I0303 12:39:16.149533 1176712 handler.go:304] Adding GroupVersion networking.k8s.io v1 to ResourceManager
Mar 03 12:39:16 k3s-agent01 k3s[1176712]: W0303 12:39:16.149551 1176712 genericapiserver.go:787] Skipping API networking.k8s.io/v1beta1 because it has no resources.
Mar 03 12:39:16 k3s-agent01 k3s[1176712]: I0303 12:39:16.149895 1176712 handler.go:304] Adding GroupVersion node.k8s.io v1 to ResourceManager
Mar 03 12:39:16 k3s-agent01 k3s[1176712]: W0303 12:39:16.149913 1176712 genericapiserver.go:787] Skipping API node.k8s.io/v1beta1 because it has no resources.
Mar 03 12:39:16 k3s-agent01 k3s[1176712]: W0303 12:39:16.149920 1176712 genericapiserver.go:787] Skipping API node.k8s.io/v1alpha1 because it has no resources.
Mar 03 12:39:16 k3s-agent01 k3s[1176712]: I0303 12:39:16.150391 1176712 handler.go:304] Adding GroupVersion policy v1 to ResourceManager
Mar 03 12:39:16 k3s-agent01 k3s[1176712]: W0303 12:39:16.150407 1176712 genericapiserver.go:787] Skipping API policy/v1beta1 because it has no resources.
Mar 03 12:39:16 k3s-agent01 k3s[1176712]: I0303 12:39:16.151461 1176712 handler.go:304] Adding GroupVersion rbac.authorization.k8s.io v1 to ResourceManager
Mar 03 12:39:16 k3s-agent01 k3s[1176712]: W0303 12:39:16.151479 1176712 genericapiserver.go:787] Skipping API rbac.authorization.k8s.io/v1beta1 because it has no resources.
Mar 03 12:39:16 k3s-agent01 k3s[1176712]: W0303 12:39:16.151486 1176712 genericapiserver.go:787] Skipping API rbac.authorization.k8s.io/v1alpha1 because it has no resources.
Mar 03 12:39:16 k3s-agent01 k3s[1176712]: I0303 12:39:16.151794 1176712 handler.go:304] Adding GroupVersion scheduling.k8s.io v1 to ResourceManager
Mar 03 12:39:16 k3s-agent01 k3s[1176712]: W0303 12:39:16.151810 1176712 genericapiserver.go:787] Skipping API scheduling.k8s.io/v1beta1 because it has no resources.
Mar 03 12:39:16 k3s-agent01 k3s[1176712]: W0303 12:39:16.151815 1176712 genericapiserver.go:787] Skipping API scheduling.k8s.io/v1alpha1 because it has no resources.
Mar 03 12:39:16 k3s-agent01 k3s[1176712]: I0303 12:39:16.155059 1176712 handler.go:304] Adding GroupVersion storage.k8s.io v1 to ResourceManager
Mar 03 12:39:16 k3s-agent01 k3s[1176712]: W0303 12:39:16.155280 1176712 genericapiserver.go:787] Skipping API storage.k8s.io/v1beta1 because it has no resources.
Mar 03 12:39:16 k3s-agent01 k3s[1176712]: W0303 12:39:16.155294 1176712 genericapiserver.go:787] Skipping API storage.k8s.io/v1alpha1 because it has no resources.
Mar 03 12:39:16 k3s-agent01 k3s[1176712]: I0303 12:39:16.157187 1176712 handler.go:304] Adding GroupVersion flowcontrol.apiserver.k8s.io v1 to ResourceManager
Mar 03 12:39:16 k3s-agent01 k3s[1176712]: W0303 12:39:16.157198 1176712 genericapiserver.go:787] Skipping API flowcontrol.apiserver.k8s.io/v1beta3 because it has no resources.
Mar 03 12:39:16 k3s-agent01 k3s[1176712]: W0303 12:39:16.157204 1176712 genericapiserver.go:787] Skipping API flowcontrol.apiserver.k8s.io/v1beta2 because it has no resources.
Mar 03 12:39:16 k3s-agent01 k3s[1176712]: W0303 12:39:16.157207 1176712 genericapiserver.go:787] Skipping API flowcontrol.apiserver.k8s.io/v1beta1 because it has no resources.
Mar 03 12:39:16 k3s-agent01 k3s[1176712]: I0303 12:39:16.163115 1176712 handler.go:304] Adding GroupVersion apps v1 to ResourceManager
Mar 03 12:39:16 k3s-agent01 k3s[1176712]: W0303 12:39:16.163155 1176712 genericapiserver.go:787] Skipping API apps/v1beta2 because it has no resources.
Mar 03 12:39:16 k3s-agent01 k3s[1176712]: W0303 12:39:16.163160 1176712 genericapiserver.go:787] Skipping API apps/v1beta1 because it has no resources.
Mar 03 12:39:16 k3s-agent01 k3s[1176712]: I0303 12:39:16.164895 1176712 handler.go:304] Adding GroupVersion admissionregistration.k8s.io v1 to ResourceManager
Mar 03 12:39:16 k3s-agent01 k3s[1176712]: W0303 12:39:16.164912 1176712 genericapiserver.go:787] Skipping API admissionregistration.k8s.io/v1beta1 because it has no resources.
Mar 03 12:39:16 k3s-agent01 k3s[1176712]: W0303 12:39:16.164918 1176712 genericapiserver.go:787] Skipping API admissionregistration.k8s.io/v1alpha1 because it has no resources.
Mar 03 12:39:16 k3s-agent01 k3s[1176712]: I0303 12:39:16.165360 1176712 handler.go:304] Adding GroupVersion events.k8s.io v1 to ResourceManager
Mar 03 12:39:16 k3s-agent01 k3s[1176712]: W0303 12:39:16.165374 1176712 genericapiserver.go:787] Skipping API events.k8s.io/v1beta1 because it has no resources.
Mar 03 12:39:16 k3s-agent01 k3s[1176712]: I0303 12:39:16.166711 1176712 handler.go:304] Adding GroupVersion resource.k8s.io v1 to ResourceManager
Mar 03 12:39:16 k3s-agent01 k3s[1176712]: W0303 12:39:16.166727 1176712 genericapiserver.go:787] Skipping API resource.k8s.io/v1beta2 because it has no resources.
Mar 03 12:39:16 k3s-agent01 k3s[1176712]: W0303 12:39:16.166732 1176712 genericapiserver.go:787] Skipping API resource.k8s.io/v1beta1 because it has no resources.
Mar 03 12:39:16 k3s-agent01 k3s[1176712]: W0303 12:39:16.166736 1176712 genericapiserver.go:787] Skipping API resource.k8s.io/v1alpha3 because it has no resources.
Mar 03 12:39:16 k3s-agent01 k3s[1176712]: I0303 12:39:16.172430 1176712 handler.go:304] Adding GroupVersion apiregistration.k8s.io v1 to ResourceManager
Mar 03 12:39:16 k3s-agent01 k3s[1176712]: W0303 12:39:16.172457 1176712 genericapiserver.go:787] Skipping API apiregistration.k8s.io/v1beta1 because it has no resources.
Mar 03 12:39:16 k3s-agent01 k3s[1176712]: I0303 12:39:16.488892 1176712 dynamic_cafile_content.go:161] "Starting controller" name="request-header::/var/lib/rancher/k3s/server/tls/request-header-ca.crt"
Mar 03 12:39:16 k3s-agent01 k3s[1176712]: I0303 12:39:16.488915 1176712 dynamic_cafile_content.go:161] "Starting controller" name="client-ca-bundle::/var/lib/rancher/k3s/server/tls/client-ca.crt"
Mar 03 12:39:16 k3s-agent01 k3s[1176712]: I0303 12:39:16.489079 1176712 dynamic_serving_content.go:135] "Starting controller" name="serving-cert::/var/lib/rancher/k3s/server/tls/serving-kube-apiserver.crt::/var/lib/rancher/k3s/server/tls/serving-kube-apiserver.key"
Mar 03 12:39:16 k3s-agent01 k3s[1176712]: I0303 12:39:16.489266 1176712 secure_serving.go:211] Serving securely on 127.0.0.1:6444
Mar 03 12:39:16 k3s-agent01 k3s[1176712]: I0303 12:39:16.489318 1176712 tlsconfig.go:243] "Starting DynamicServingCertificateController"
Mar 03 12:39:16 k3s-agent01 k3s[1176712]: I0303 12:39:16.489395 1176712 system_namespaces_controller.go:66] Starting system namespaces controller
Mar 03 12:39:16 k3s-agent01 k3s[1176712]: I0303 12:39:16.489405 1176712 controller.go:113] "Deleting old lease on startup" lease="kube-system/apiserver-thcwii52j33kxhvenijbwizkua"
Mar 03 12:39:16 k3s-agent01 k3s[1176712]: I0303 12:39:16.489474 1176712 controller.go:127] "Starting legacy_token_tracking_controller"
Mar 03 12:39:16 k3s-agent01 k3s[1176712]: I0303 12:39:16.489484 1176712 shared_informer.go:370] "Waiting for caches to sync"
Mar 03 12:39:16 k3s-agent01 k3s[1176712]: I0303 12:39:16.490151 1176712 dynamic_serving_content.go:135] "Starting controller" name="aggregator-proxy-cert::/var/lib/rancher/k3s/server/tls/client-auth-proxy.crt::/var/lib/rancher/k3s/server/tls/client-auth-proxy.key"
Mar 03 12:39:16 k3s-agent01 k3s[1176712]: I0303 12:39:16.490242 1176712 gc_controller.go:85] "Starting apiserver lease garbage collector"
Mar 03 12:39:16 k3s-agent01 k3s[1176712]: I0303 12:39:16.490252 1176712 shared_informer.go:370] "Waiting for caches to sync"
Mar 03 12:39:16 k3s-agent01 k3s[1176712]: I0303 12:39:16.489420 1176712 apiservice_controller.go:100] Starting APIServiceRegistrationController
Mar 03 12:39:16 k3s-agent01 k3s[1176712]: I0303 12:39:16.490621 1176712 cache.go:32] Waiting for caches to sync for APIServiceRegistrationController controller
Mar 03 12:39:16 k3s-agent01 k3s[1176712]: I0303 12:39:16.490644 1176712 crdregistration_controller.go:114] Starting crd-autoregister controller
Mar 03 12:39:16 k3s-agent01 k3s[1176712]: I0303 12:39:16.490650 1176712 shared_informer.go:349] "Waiting for caches to sync" controller="crd-autoregister"
Mar 03 12:39:16 k3s-agent01 k3s[1176712]: I0303 12:39:16.490944 1176712 dynamic_cafile_content.go:161] "Starting controller" name="client-ca-bundle::/var/lib/rancher/k3s/server/tls/client-ca.crt"
Mar 03 12:39:16 k3s-agent01 k3s[1176712]: I0303 12:39:16.491036 1176712 dynamic_cafile_content.go:161] "Starting controller" name="request-header::/var/lib/rancher/k3s/server/tls/request-header-ca.crt"
Mar 03 12:39:16 k3s-agent01 k3s[1176712]: I0303 12:39:16.491100 1176712 controller.go:142] Starting OpenAPI controller
Mar 03 12:39:16 k3s-agent01 k3s[1176712]: I0303 12:39:16.491132 1176712 controller.go:90] Starting OpenAPI V3 controller
Mar 03 12:39:16 k3s-agent01 k3s[1176712]: I0303 12:39:16.491150 1176712 naming_controller.go:305] Starting NamingConditionController
Mar 03 12:39:16 k3s-agent01 k3s[1176712]: I0303 12:39:16.491176 1176712 nonstructuralschema_controller.go:202] Starting NonStructuralSchemaConditionController
Mar 03 12:39:16 k3s-agent01 k3s[1176712]: I0303 12:39:16.491189 1176712 apiapproval_controller.go:196] Starting KubernetesAPIApprovalPolicyConformantConditionController
Mar 03 12:39:16 k3s-agent01 k3s[1176712]: I0303 12:39:16.491200 1176712 crd_finalizer.go:273] Starting CRDFinalizer
Mar 03 12:39:16 k3s-agent01 k3s[1176712]: I0303 12:39:16.489484 1176712 default_servicecidr_controller.go:110] Starting kubernetes-service-cidr-controller
Mar 03 12:39:16 k3s-agent01 k3s[1176712]: I0303 12:39:16.491215 1176712 shared_informer.go:349] "Waiting for caches to sync" controller="kubernetes-service-cidr-controller"
Mar 03 12:39:16 k3s-agent01 k3s[1176712]: I0303 12:39:16.489569 1176712 apf_controller.go:377] Starting API Priority and Fairness config controller
Mar 03 12:39:16 k3s-agent01 k3s[1176712]: I0303 12:39:16.489564 1176712 controller.go:80] Starting OpenAPI V3 AggregationController
Mar 03 12:39:16 k3s-agent01 k3s[1176712]: I0303 12:39:16.489589 1176712 local_available_controller.go:156] Starting LocalAvailability controller
Mar 03 12:39:16 k3s-agent01 k3s[1176712]: I0303 12:39:16.491547 1176712 cache.go:32] Waiting for caches to sync for LocalAvailability controller
Mar 03 12:39:16 k3s-agent01 k3s[1176712]: I0303 12:39:16.489830 1176712 remote_available_controller.go:425] Starting RemoteAvailability controller
Mar 03 12:39:16 k3s-agent01 k3s[1176712]: I0303 12:39:16.491560 1176712 cache.go:32] Waiting for caches to sync for RemoteAvailability controller
Mar 03 12:39:16 k3s-agent01 k3s[1176712]: I0303 12:39:16.489847 1176712 repairip.go:210] Starting ipallocator-repair-controller
Mar 03 12:39:16 k3s-agent01 k3s[1176712]: I0303 12:39:16.491572 1176712 shared_informer.go:349] "Waiting for caches to sync" controller="ipallocator-repair-controller"
Mar 03 12:39:16 k3s-agent01 k3s[1176712]: I0303 12:39:16.490187 1176712 aggregator.go:185] waiting for initial CRD sync...
Mar 03 12:39:16 k3s-agent01 k3s[1176712]: I0303 12:39:16.490203 1176712 controller.go:78] Starting OpenAPI AggregationController
Mar 03 12:39:16 k3s-agent01 k3s[1176712]: I0303 12:39:16.490473 1176712 cluster_authentication_trust_controller.go:459] Starting cluster_authentication_trust_controller controller
Mar 03 12:39:16 k3s-agent01 k3s[1176712]: I0303 12:39:16.491612 1176712 shared_informer.go:370] "Waiting for caches to sync"
Mar 03 12:39:16 k3s-agent01 k3s[1176712]: I0303 12:39:16.490608 1176712 customresource_discovery_controller.go:294] Starting DiscoveryController
Mar 03 12:39:16 k3s-agent01 k3s[1176712]: I0303 12:39:16.523400 1176712 shared_informer.go:356] "Caches are synced" controller="node_authorizer"
Mar 03 12:39:16 k3s-agent01 k3s[1176712]: I0303 12:39:16.527096 1176712 shared_informer.go:377] "Caches are synced"
Mar 03 12:39:16 k3s-agent01 k3s[1176712]: I0303 12:39:16.527133 1176712 policy_source.go:248] refreshing policies
Mar 03 12:39:16 k3s-agent01 k3s[1176712]: I0303 12:39:16.544004 1176712 cidrallocator.go:302] created ClusterIP allocator for Service CIDR 10.43.0.0/16
Mar 03 12:39:16 k3s-agent01 k3s[1176712]: I0303 12:39:16.589572 1176712 shared_informer.go:377] "Caches are synced"
Mar 03 12:39:16 k3s-agent01 k3s[1176712]: I0303 12:39:16.590313 1176712 shared_informer.go:377] "Caches are synced"
Mar 03 12:39:16 k3s-agent01 k3s[1176712]: I0303 12:39:16.590652 1176712 cache.go:39] Caches are synced for APIServiceRegistrationController controller
Mar 03 12:39:16 k3s-agent01 k3s[1176712]: I0303 12:39:16.590685 1176712 shared_informer.go:356] "Caches are synced" controller="crd-autoregister"
Mar 03 12:39:16 k3s-agent01 k3s[1176712]: I0303 12:39:16.590840 1176712 aggregator.go:187] initial CRD sync complete...
Mar 03 12:39:16 k3s-agent01 k3s[1176712]: I0303 12:39:16.590861 1176712 autoregister_controller.go:144] Starting autoregister controller
Mar 03 12:39:16 k3s-agent01 k3s[1176712]: I0303 12:39:16.590868 1176712 cache.go:32] Waiting for caches to sync for autoregister controller
Mar 03 12:39:16 k3s-agent01 k3s[1176712]: I0303 12:39:16.590878 1176712 cache.go:39] Caches are synced for autoregister controller
Mar 03 12:39:16 k3s-agent01 k3s[1176712]: I0303 12:39:16.591550 1176712 apf_controller.go:382] Running API Priority and Fairness config worker
Mar 03 12:39:16 k3s-agent01 k3s[1176712]: I0303 12:39:16.591559 1176712 shared_informer.go:356] "Caches are synced" controller="kubernetes-service-cidr-controller"
Mar 03 12:39:16 k3s-agent01 k3s[1176712]: I0303 12:39:16.591570 1176712 apf_controller.go:385] Running API Priority and Fairness periodic rebalancing process
Mar 03 12:39:16 k3s-agent01 k3s[1176712]: I0303 12:39:16.591623 1176712 shared_informer.go:356] "Caches are synced" controller="ipallocator-repair-controller"
Mar 03 12:39:16 k3s-agent01 k3s[1176712]: I0303 12:39:16.591641 1176712 cache.go:39] Caches are synced for LocalAvailability controller
Mar 03 12:39:16 k3s-agent01 k3s[1176712]: I0303 12:39:16.591650 1176712 cache.go:39] Caches are synced for RemoteAvailability controller
Mar 03 12:39:16 k3s-agent01 k3s[1176712]: I0303 12:39:16.591776 1176712 shared_informer.go:377] "Caches are synced"
Mar 03 12:39:16 k3s-agent01 k3s[1176712]: I0303 12:39:16.591766 1176712 handler.go:304] Adding GroupVersion traefik.io v1alpha1 to ResourceManager
Mar 03 12:39:16 k3s-agent01 k3s[1176712]: I0303 12:39:16.591940 1176712 handler.go:304] Adding GroupVersion hub.traefik.io v1alpha1 to ResourceManager
Mar 03 12:39:16 k3s-agent01 k3s[1176712]: I0303 12:39:16.592004 1176712 handler.go:304] Adding GroupVersion k3s.cattle.io v1 to ResourceManager
Mar 03 12:39:16 k3s-agent01 k3s[1176712]: I0303 12:39:16.592193 1176712 handler.go:304] Adding GroupVersion gateway.networking.k8s.io v1 to ResourceManager
Mar 03 12:39:16 k3s-agent01 k3s[1176712]: I0303 12:39:16.592314 1176712 handler.go:304] Adding GroupVersion gateway.networking.k8s.io v1beta1 to ResourceManager
Mar 03 12:39:16 k3s-agent01 k3s[1176712]: I0303 12:39:16.592817 1176712 handler.go:304] Adding GroupVersion helm.cattle.io v1 to ResourceManager
Mar 03 12:39:16 k3s-agent01 k3s[1176712]: time="2026-03-03T12:39:16+01:00" level=error msg="Sending HTTP/1.1 502 response to 192.168.192.53:60108: dial tcp 10.42.1.4:10250: connect: network is unreachable"
Mar 03 12:39:16 k3s-agent01 k3s[1176712]: time="2026-03-03T12:39:16+01:00" level=error msg="Sending HTTP/1.1 502 response to 192.168.192.53:60122: dial tcp 10.42.1.4:10250: connect: network is unreachable"
Mar 03 12:39:16 k3s-agent01 k3s[1176712]: time="2026-03-03T12:39:16+01:00" level=error msg="Sending HTTP/1.1 502 response to 192.168.192.53:60138: dial tcp 10.42.1.4:10250: connect: network is unreachable"
Mar 03 12:39:16 k3s-agent01 k3s[1176712]: time="2026-03-03T12:39:16+01:00" level=error msg="Sending HTTP/1.1 502 response to 192.168.192.53:60152: dial tcp 10.42.1.4:10250: connect: network is unreachable"
Mar 03 12:39:16 k3s-agent01 k3s[1176712]: I0303 12:39:16.597742 1176712 handler_discovery.go:451] Starting ResourceDiscoveryManager
Mar 03 12:39:16 k3s-agent01 k3s[1176712]: I0303 12:39:16.624500 1176712 controller.go:667] quota admission added evaluator for: leases.coordination.k8s.io
Mar 03 12:39:16 k3s-agent01 k3s[1176712]: W0303 12:39:16.688496 1176712 lease.go:265] Resetting endpoints for master service "kubernetes" to [192.168.192.153 192.168.192.53 192.168.192.74]
Mar 03 12:39:16 k3s-agent01 k3s[1176712]: I0303 12:39:16.689971 1176712 controller.go:667] quota admission added evaluator for: endpoints
Mar 03 12:39:16 k3s-agent01 k3s[1176712]: I0303 12:39:16.701136 1176712 controller.go:667] quota admission added evaluator for: endpointslices.discovery.k8s.io
Mar 03 12:39:16 k3s-agent01 k3s[1176712]: W0303 12:39:16.738158 1176712 lease.go:265] Resetting endpoints for master service "kubernetes" to [192.168.192.153 192.168.192.74]
Mar 03 12:39:16 k3s-agent01 k3s[1176712]: E0303 12:39:16.758762 1176712 controller.go:100] Found stale data, removed previous endpoints on kubernetes service, apiserver didn't exit successfully previously
Mar 03 12:39:16 k3s-agent01 k3s[1176712]: time="2026-03-03T12:39:16+01:00" level=info msg="Polling for API server readiness: GET /readyz failed: an error on the server (\"[+]ping ok\\n[+]log ok\\n[+]etcd ok\\n[+]etcd-readiness ok\\n[+]informer-sync ok\\n[+]poststarthook/start-apiserver-admission-initializer ok\\n[+]poststarthook/generic-apiserver-start-informers ok\\n[+]poststarthook/priority-and-fairness-config-consumer ok\\n[+]poststarthook/priority-and-fairness-filter ok\\n[+]poststarthook/storage-object-count-tracker-hook ok\\n[+]poststarthook/start-apiextensions-informers ok\\n[+]poststarthook/start-apiextensions-controllers ok\\n[+]poststarthook/crd-informer-synced ok\\n[+]poststarthook/start-system-namespaces-controller ok\\n[+]poststarthook/start-cluster-authentication-info-controller ok\\n[+]poststarthook/start-kube-apiserver-identity-lease-controller ok\\n[+]poststarthook/start-kube-apiserver-identity-lease-garbage-collector ok\\n[+]poststarthook/start-legacy-token-tracking-controller ok\\n[+]poststarthook/start-service-ip-repair-controllers ok\\n[-]poststarthook/rbac/bootstrap-roles failed: reason withheld\\n[-]poststarthook/scheduling/bootstrap-system-priority-classes failed: reason withheld\\n[+]poststarthook/priority-and-fairness-config-producer ok\\n[+]poststarthook/bootstrap-controller ok\\n[+]poststarthook/start-kubernetes-service-cidr-controller ok\\n[+]poststarthook/aggregator-reload-proxy-client-cert ok\\n[+]poststarthook/start-kube-aggregator-informers ok\\n[+]poststarthook/apiservice-status-local-available-controller ok\\n[+]poststarthook/apiservice-status-remote-available-controller ok\\n[+]poststarthook/apiservice-registration-controller ok\\n[-]poststarthook/apiservice-discovery-controller failed: reason withheld\\n[+]poststarthook/kube-apiserver-autoregistration ok\\n[+]autoregister-completion ok\\n[+]poststarthook/apiservice-openapi-controller ok\\n[+]poststarthook/apiservice-openapiv3-controller ok\\n[+]shutdown ok\\nreadyz check failed\") has prevented the request from succeeding"
Mar 03 12:39:17 k3s-agent01 k3s[1176712]: I0303 12:39:17.495584 1176712 storage_scheduling.go:139] all system priority classes are created successfully or already exist.
Mar 03 12:39:18 k3s-agent01 k3s[1176712]: time="2026-03-03T12:39:18+01:00" level=info msg="Polling for API server readiness: GET /readyz failed: an error on the server (\"[+]ping ok\\n[+]log ok\\n[+]etcd ok\\n[+]etcd-readiness ok\\n[+]informer-sync ok\\n[+]poststarthook/start-apiserver-admission-initializer ok\\n[+]poststarthook/generic-apiserver-start-informers ok\\n[+]poststarthook/priority-and-fairness-config-consumer ok\\n[+]poststarthook/priority-and-fairness-filter ok\\n[+]poststarthook/storage-object-count-tracker-hook ok\\n[+]poststarthook/start-apiextensions-informers ok\\n[+]poststarthook/start-apiextensions-controllers ok\\n[+]poststarthook/crd-informer-synced ok\\n[+]poststarthook/start-system-namespaces-controller ok\\n[+]poststarthook/start-cluster-authentication-info-controller ok\\n[+]poststarthook/start-kube-apiserver-identity-lease-controller ok\\n[+]poststarthook/start-kube-apiserver-identity-lease-garbage-collector ok\\n[+]poststarthook/start-legacy-token-tracking-controller ok\\n[+]poststarthook/start-service-ip-repair-controllers ok\\n[+]poststarthook/rbac/bootstrap-roles ok\\n[+]poststarthook/scheduling/bootstrap-system-priority-classes ok\\n[+]poststarthook/priority-and-fairness-config-producer ok\\n[+]poststarthook/bootstrap-controller ok\\n[+]poststarthook/start-kubernetes-service-cidr-controller ok\\n[+]poststarthook/aggregator-reload-proxy-client-cert ok\\n[+]poststarthook/start-kube-aggregator-informers ok\\n[+]poststarthook/apiservice-status-local-available-controller ok\\n[+]poststarthook/apiservice-status-remote-available-controller ok\\n[+]poststarthook/apiservice-registration-controller ok\\n[-]poststarthook/apiservice-discovery-controller failed: reason withheld\\n[+]poststarthook/kube-apiserver-autoregistration ok\\n[+]autoregister-completion ok\\n[+]poststarthook/apiservice-openapi-controller ok\\n[+]poststarthook/apiservice-openapiv3-controller ok\\n[+]shutdown ok\\nreadyz check failed\") has prevented the request from succeeding"
Mar 03 12:39:19 k3s-agent01 k3s[1176712]: time="2026-03-03T12:39:19+01:00" level=info msg="error in remotedialer server [400]: websocket: close 1006 (abnormal closure): unexpected EOF"
Mar 03 12:39:19 k3s-agent01 k3s[1176712]: time="2026-03-03T12:39:19+01:00" level=info msg="error in remotedialer server [400]: websocket: close 1006 (abnormal closure): unexpected EOF"
Mar 03 12:39:21 k3s-agent01 k3s[1176712]: E0303 12:39:21.596026 1176712 remote_available_controller.go:462] "Unhandled Error" err="v1beta1.metrics.k8s.io failed with: Operation cannot be fulfilled on apiservices.apiregistration.k8s.io \"v1beta1.metrics.k8s.io\": the object has been modified; please apply your changes to the latest version and try again" logger="UnhandledError"
Mar 03 12:39:21 k3s-agent01 k3s[1176712]: I0303 12:39:21.597827 1176712 handler.go:304] Adding GroupVersion metrics.k8s.io v1beta1 to ResourceManager
Mar 03 12:39:21 k3s-agent01 k3s[1176712]: time="2026-03-03T12:39:21+01:00" level=error msg="Sending HTTP/1.1 502 response to 192.168.192.53:50614: dial tcp 10.42.1.4:10250: connect: network is unreachable"
Mar 03 12:39:21 k3s-agent01 k3s[1176712]: W0303 12:39:21.699994 1176712 lease.go:265] Resetting endpoints for master service "kubernetes" to [192.168.192.153 192.168.192.53 192.168.192.74]
Mar 03 12:39:22 k3s-agent01 k3s[1176712]: time="2026-03-03T12:39:22+01:00" level=info msg="Kube API server is now running"
Mar 03 12:39:22 k3s-agent01 k3s[1176712]: time="2026-03-03T12:39:22+01:00" level=info msg="k3s is up and running"
Mar 03 12:39:22 k3s-agent01 k3s[1176712]: time="2026-03-03T12:39:22+01:00" level=info msg="Waiting for cloud-controller-manager privileges to become available"
Mar 03 12:39:22 k3s-agent01 k3s[1176712]: Flag --containerd has been deprecated, This is a cadvisor flag that was mistakenly registered with the Kubelet. Due to legacy concerns, it will follow the standard CLI deprecation timeline before being removed.
Mar 03 12:39:22 k3s-agent01 k3s[1176712]: time="2026-03-03T12:39:22+01:00" level=info msg="Waiting for untainted node"
Mar 03 12:39:22 k3s-agent01 systemd[1]: Started k3s.service - Lightweight Kubernetes.
```

</details>
